post_id,title,selftext,created_utc,comments
1eawks0,"TV suggestions, Budget 50k w/ EMI","Hi, please help me with TV suggestions with the following parameters in mind.

1. Only Sony, Samsung & LG suggestions please.
2. No priority for gaming features.
3. Required most bang for the buck as possible.
4. TV size 50""+

My location: Thane, Maharashtra (if you might know offline suggestions)

Edit: got Sony Bravia 2 S25 from Kohinoor ",2024-07-24 08:52:23,"[""All three are great brands. Sony is usually pricier than the other two even for the same screen size TV. I'd suggest you go for Samsung or LG. Do a bit of research online. you'll find out.""]"
1e8qb8h,Are cheap chinese TVs good?,"I am looking to buy TV for my parents. I am looking at 50 inch TVs. With a budget of 30-40k. I know there are three premium brands in Samsung, LG and Sony. Which are offering their basic LED TVs in this price range.

And then there are these other brands like Hisense, VU, Kodak etc which offer QLED TVs that seem more feature rich on paper, and also have superior OS in GoogleTV. I wanted to know, if any of you guys have any experiences with these other brands. And any recommendations?",2024-07-21 16:32:19,"['Bro only go for samsung screens, rest chinese are super unreliable\n\nI have a samsung and LG and the samsung is way superior, faster in menus and gives overall better sound even though lg one is a more latest version\n\nYou can for this samsung one\n\nLink: https://amzn.to/46gwnBf\n\nSamsung 125 cm (50 inches) 4K Ultra HD Smart LED TV UA50DU7660KLXL (Black)', ""Well I don't know much but we have 12k worth 32 inch android tv from Xiaomi ,works really good"", ""In the case of TVs, more time goes in consuming the content rather than switching between the apps or menus and the software can be updated using an external Firestick or Android TV Box but Panel can't be. So the quality of Panel and the Calibration are the most important things while purchasing TVs. So go with companies who make good Panels and don't bother about specs so much."", 'No.']"
1e8oag5,Need monitor suggestions under 25k inr,"Need monitor suggestions. QHD, 27 inch 144+Hz refresh rate. Would be used for gaming and movies,etc. Gaming not limited to FPS. Don't care about curved or regular display, anything works. Would like to mount on monitor arms sometime in the furture and would prefer if service is good in case I have to had anything repaired/replaced. I live in Tier 1 cities for reference. Suggest one monitor among these:



1. \[LG Ultragear Gaming Monitor(27"") Qhd IPS Display(2560 \\\* 1440),Smooth Gameplay:165Hz & 1Ms,Hdr 10,Srgb 99%(Typ.),G-Sync,Amd Freesync Premium,Anti-Glare,Height,Pivot,Hdmi,Dp,Hp Out,27Gr75Q,Black\](https://www.amazon.in/LG-UltraGearTM-Monitor-Display-Gameplay/dp/B0C8MVVCQN/ref=sr\_1\_5?crid=1513GJKHLP5OR&dib=eyJ2IjoiMSJ9.XHMe-AQJIbYYtgJT2ZXOopQ1Dz5sYwO2QG-56-mFGGV\_dfLWDYQZ3FX4unzzMwwH3ttTc6HA37h74GnmBSmOOVssAN6wLbzFX\_zVqKf8m6HMqUz3kNWcv4faO754Kka30lj4d5f\_xcKPt7fmvy\_fe2u8bg0pkABCOWrlN-qBWDArs2x1kJNbUi73T8rx64X0RRUCB4BLgQ4Py87ycUFMCIkHMvHLaSjEZDiWvQxjfGw.k9L7FnNHj92vVlF3yjXIQynI33ce6vOlsKmD506Ri9E&dib\_tag=se&keywords=gaming%2Bmonitors&qid=1721459443&sprefix=gaming%2Bmonitors%2Caps%2C253&sr=8-5&th=1)

2. \[Samsung Odyssey G5 Gaming Monitor 68.5cm (27"") QHD 2560 X 1440, 165 Hz, 1ms(MPRT), HDR10, AMD Freesync, DP, HDMI, Height, Tilt, Pivot Adjust Stand, Bezel Less, Eye-Saver, LS27CG510EWXXL, Black\](https://www.amazon.in/Samsung-Odyssey-Freesync-Eye-Saver-LS27CG510EWXXL/dp/B0BZW6BG1F/ref=lp\_64224485031\_1\_9?pf\_rd\_p=9e034799-55e2-4ab2-b0d0-eb42f95b2d05&pf\_rd\_r=TSFN0XRG714ECGDD22R5&sbo=Tc8eqSFhUl4VwMzbE4fw%2Fw%3D%3D&th=1)

3. \[Lenovo G-Series 27 inch (68.58cm) 2K QHD VA Gaming Monitor, 2560 x 1440 Pixels 165Hz, 1ms, WLED, AMD Radeon FreeSync Compatible,HDMI, DP, Height Adjust Tilt Stand with Natural Low Blue Light, G27q-30\](https://www.amazon.in/Lenovo-68-58cm-FreeSync-Compatible-Certified/dp/B0B4SVY7PJ/ref=sr\_1\_26?dib=eyJ2IjoiMSJ9.2D9YY2PzN7BUxUP2oSHGi4gYiGMPt\_ytAI5O5Y2id0GiXorHrMeLmGACINY46GzAp0LJgwYV30ZwYvLoJPdIzO8rsmaqtYzkBJOootS-ZUAcfxmwBRuab2ZvU-rsT2ItcDtRc8fgNmpuzDlyR9\_uXQxVIazIWvzg-w4a-z8R6uEHfJf9qPW0IU11Ui-\_MWmybmZmVcenNvDSt7wLvuWt0D5trY\_Btp2L-VVJyQdNbnnLyU4s3FS-Oit038kjDpkXyKz72o60QajHiqRlq\_xtLq1-O61BYCGbmNCiQzBrcHw.FNO\_G6iWLJZPE\_4b3elj\_G3qfTrVdKh5JJjYsjOOkNE&dib\_tag=se&qid=1721459870&s=computers&sr=1-26&th=1)

4. \[ViewSonic Gaming(Originated in USA) 27Inch 170Hz IPS QHD 2K Gaming Monitor,1ms, HDR10, FreeSync, 137% sRGB, Height Adjustment, Swivel, Tilt, Pivot, Eye Care, 2 x HDMI, Display Port - VX2758A-2K-PRO-2\](https://www.amazon.in/ViewSonic-Originated-Monitor-FreeSync-Adjustment/dp/B0CMPW1698/ref=sr\_1\_7?crid=1513GJKHLP5OR&dib=eyJ2IjoiMSJ9.XHMe-AQJIbYYtgJT2ZXOopQ1Dz5sYwO2QG-56-mFGGV\_dfLWDYQZ3FX4unzzMwwH3ttTc6HA37h74GnmBSmOOVssAN6wLbzFX\_zVqKf8m6HMqUz3kNWcv4faO754Kka30lj4d5f\_xcKPt7fmvy\_fe2u8bg0pkABCOWrlN-qBWDArs2x1kJNbUi73T8rx64X0RRUCB4BLgQ4Py87ycUFMCIkHMvHLaSjEZDiWvQxjfGw.k9L7FnNHj92vVlF3yjXIQynI33ce6vOlsKmD506Ri9E&dib\_tag=se&keywords=gaming+monitors&qid=1721459443&sprefix=gaming+monitors%2Caps%2C253&sr=8-7)

5. \[Acer Nitro Xv272U V3 27 Inch IPS Wqhd 2560 X 1440 Pixels Gaming Backlight Led Lcd Monitor|Delta E<1,Dci-P3 95%|180Hz Refresh Rate,0.5Ms Resonse Time|Hdr 400|Amd Free Sync|Eyesafe Certified,Black\](https://www.amazon.in/Acer-Monitor-Backlight-Response-Speakers/dp/B0CCSL95T1/ref=sr\_1\_3?crid=1WIJKPFPLJSQZ&dib=eyJ2IjoiMSJ9.HOS5UvbdBWUPrQZnRxhBELfyUrmiH7OAumfJRfb3lD0CbjbecRpYNxKQmMje\_4MTJitwnvIg9vYQNf\_Ck9FSy-daQxjFC16mi-GnHahltLlDD4z6g\_Cy5pM7UvVGJxYzLuTGpiZ9cM\_eqFugnxGXIWKYivbPejrbEcEMo4UQ6LGZeQ9jI50rsYArn\_L53LY1A7-SDFLWY2UrIZiGhW3pYZ9nbe\_vhboWYZyR4pGvvKk.DmkRUPf5pUBGzJ8txy50VcUjT-k2CQ5iaaNwPLuYH0k&dib\_tag=se&keywords=acer%2Bnitro%2Bm3&qid=1721450596&sprefix=acer%2Bnitro%2Bm%2Caps%2C250&sr=8-3&th=1)



Budget < 25k so the LG on, 23k is the max I can go right now.",2024-07-21 15:02:46,"['This is a Fakespot Reviews Analysis bot. Fakespot detects fake reviews, fake products and unreliable sellers using AI.\n\nHere is the analysis for the Amazon product reviews:\n\n>**Name**: LG UltraGear™ Gaming Monitor(27"") QHD IPS Display(2560*1440), Smooth Gameplay:165Hz & 1ms, HDR 10, sRGB 99%(Typ.), G-SYNC®, AMD FreeSync™ Premium, Anti-Glare, Height, Pivot, HDMI, DP, HP Out, 27GR75Q \n\n>**Company**: Visit the LG Store\n\n>**Amazon Product Rating**: 4.4 \n\n>**Fakespot Reviews Grade**: A\n\n>**Adjusted Fakespot Rating**: 4.4\n\n>**Analysis Performed at**: 07-08-2024 \n\n[Link to Fakespot Analysis](https://fakespot.com/product/lg-ultragear-gaming-monitor-27-qhd-ips-display-2560-1440-smooth-gameplay-165hz-1ms-hdr-10-srgb-99-typ-g-sync-amd-freesync-premium-anti-glare-height-pivot-hdmi-dp-hp-out-27gr75q) | [Check out the Fakespot Chrome Extension!](https://chrome.google.com/webstore/detail/fakespot-analyze-fake-ama/nakplnnackehceedgkgkokbgbmfghain)\n\n*Fakespot analyzes the reviews authenticity and not the product quality using AI. We look for real reviews that mention product issues such as counterfeits, defects, and bad return policies that fake reviews try to hide from consumers.*\n\n*We give an A-F letter for trustworthiness of reviews. A = very trustworthy reviews, F = highly untrustworthy reviews. We also provide seller ratings to warn you if the seller can be trusted or not.*', 'Imo LG Ultragear is great for monitors\n\nhttps://amzn.to/4fdxDZZ\n\nLG Ultragear Gaming Monitor(27”) Qhd IPS Display(2560 * 1440),Smooth Gameplay:165Hz & 1Ms,Hdr 10,Srgb 99%(Typ.),G-Sync,Amd Freesync Premium,Anti-Glare,Height,Pivot,Hdmi,Dp,Hp Out,27Gr75Q,Black']"
1e6gh0u,Never buy MiTV,"I'll make it short and quick. 

These TVs die right after the warranty period ends, sometimes before if you're lucky but they are not made fo last long. The service Centre guys ask 45000 to repair a 55000 rupees TV

Further the service Centre guys offered to replace the back light (which was the issue with mine), for 15,000. The picture is what they delivered after the repair. It's dead in the exact same pattern as before, which means they did not replace the panel amd still charged 15000 rupees. 

Lesson learned, always buy from LG, Sony or Samsung, none of this hisense, tcl, realme, mitv stuff. 

This TV has never worked right, first one arrived with a broken panel, second one died within warranty period and that took like 3 months to replace. This 3rd one died after a few months of usage. And now it's gonna visit service center for the 4th time. ",2024-07-18 17:04:58,['Even I faced the same problem']
1e3re8o,poco x6 pro vs one plus nord ce4 ,"which phone will endure my usage   
  
i started with micromax unite e - 3/4month -> xolo era x - 1.5 years -> asus max pro m1 2.5years - 3 years - >   lg g8x 4 years by nov  
micromax and xolo died before getting asus, while asus died 1 month after getting lg g8x ( asus 2 time display change also third time broken display, swollen battery).     
the lg g8x dropped more time than all 3 phone combined, only back glass cracked when dropped rugged mud road without case . 99% time used with case. the phone more often switch off while the charge is around 15-20%.  
i use the phone continuously more than 12hrs daily, charge full charge twice normally more while used game.   
mainly web browsing, youtube and multimedia streaming in 4g data all the time now last 1.5 year 30-50% in wifi.  
also have network issues which need flight mode or even restarting.   
  
before asking above question decided poco x6 pro, nord ce 4 according to the payment and card offer at the time of purchase. will try to add in the list nord 4 after tomorrow  launch event and its offer.   
  
also wanted to give it a try for a35/a34 (for software update and nearby service center than performance decided against for performance , wanted to try a55 but too costly)  
  
nothing 2a and pixel skipped due to service center availability and time taken for service also network problems.  
  
price to performance with decent primary camera, os without lagging during normal usage and in-between switch apps mainly related to banking, whats app and chrome.  
  
also availability of part after 2+ years fast service in service center",2024-07-15 10:25:09,[]
1e3k89e,Help me choose a monitor under 10k ,"I don't play games at all. I just use my pc to watch movies and write some mock tests. So please help me.choose which monitor should I choose? 

I'm. More inclined towards HA240Y 120hz 

I initially wanted to buy LG ultragear or Gigabyte g24f2 but it felt like overkill for my usage. 
If you have any suggestions please put them in comments. Thanks
",2024-07-15 02:50:19,"['All are okay but do check 99-100% sRgb for better colour output...\n\nPlus i personally feel Dell and Benq monitors provide better display', 'I do have no ideas for suggestions.\nBut you want to buy in the upcoming  sale on Amazon & Flipkart.', 'Do check backlight bleeding which is pretty common in LCD monitors. Return asap if it’s too much.', 'koi bhi lele jiski price low ho sab sahi hai', 'There is a 9999k 165hz monitor by sonicview', 'Acer nitro vg240y is the best choice', 'Samsung G3', ""Just remember acer has one of the worst black light bleeding issues I have seen. \nIt's fine in most cases but it will ruin your movie/content watching experience. \n\nJust check it thoroughly before the return/replacement period ends."", ""i will say wait for sale,you might get lg monitor for 10k with credit card cashback,i have viewsonic 144hz one and it's neat(i think upgraded one is 165hz)"", 'go for : https://amzn.in/d/09Iutk3Y, worth every penny', ""With 5k you can get a decent monitor, Dell, HP, or any other brand should be fine, check the reviews in amazon if you are buying non branded monitor.\n\nTechnical things to check for-\n\n1. HDMI should be there must, otherwise you 'll have issues to connect to PC or TV.\n\n2. Check for color support, refresh rate.\n\n3. Resolution -**1080p (Full HD)**: 1920 x 1080 pixels\n\n4. Refresh Rate **240Hz and above**: for smooth motion and color."", 'last one for sure\n\nits full hd\n\npanal is ips\n\n180 HZ\n\n99% sRGB with HDR10\n\nreally low latency\n\nwith freesync\n\ni mean wt else u want under 10k??', 'https://preview.redd.it/imhucudtvpcd1.png?width=1080&format=pjpg&auto=webp&s=862e342d1ea94837dd56c2be0b48ccbeb8072818\n\n[bought this one for 11.5k from flipkart. absolutely worth the price.](http://flipkart.com/acer-27-inch-wqhd-led-backlit-ips-panel-hdr10-2x1w-inbuilt-speakers-flicker-blue-light-shield-ultra-thin-monitor-sa272u-e/p/itm72a97b3079900?pid=MO)', ""Okay I'll check both of their models and decide. Thanks for the suggestion."", ""Yes I'm waiting for prime day on 20th July"", 'Okay will check. Thank you for the advice', 'Damn bro is the monitor made out of gold for it to cost 99 lakhs?', ""I'm using an acer monitor so I just inclined to that lol. Which monitor do you suggest under 10k? I'm open for suggestions. Around 8k would be much better."", ""27 inch is not gonna fit on my pc stand haha. It's too large for me. Can you suggest a 24inch one?"", ""Yes I'm looking at similar specs. If you had to choose form the ones that I've posted, what would you choose?"", ""The link isn't working can you name the model please?"", 'Also, make sure to buy only ips monitors. Nothing wrong with vga and others, but they have the widest viewing angle. Vga and others often have small ghost images at high fps.', 'Nah dude I meant 9k. lol typo I guess', ""There is this gigabyte monitor G24 f-2 it's 11k+ but you can get it close to 10k with bank discounts.\n\nA couple of my friends have this model and it's one of the best in this segment.\n\n1080p 24 inch is the right spot for Monitor choice. \n\nIt also has really good colour gamets. \n\nJust check the reviews thoroughly and make the decision."", 'any brand of laptop or desktop like - dell hp, lenovo is fine. All laptop brands make good quality of monitor, check only hdmi port available or not, refresh rate around 240Hz, full hd support, thats enough.', 'acer sa272u e 27', 'I actually thought first one was just 2499 rupees then saw its emi', 'Yes I initially wanted to buy that or LG ultragear 24inch one. But I also have to get an ssd which is making my budget tight. If you have to choose a budget at 8k range for everyday use what would you recommend?']"
1e2vqtv,Washer-Dryer Combo,"Hello!
 With the rains pouring in, drying clothes has become more tedious than ever, especially in coastal cities like Bombay. 
I searched for washer dryer combos but the IFB and LG machines reviews are super bad. The drying is not 100% or the cycle time is too much. 

Has anyone here had any experience using a washer dryer combo? Any machine you’d recommend? ",2024-07-14 06:45:19,[]
1e28l3f,What do you guys think is the complaint?,It's an LG tv.,2024-07-13 11:51:16,"['backlight leds need a replacement', 'Your mirror has a feature of flickering!', 'Ak thappd maar chalu hoga dekh🌚', ""How's your experience with Jio Fiber/AirFiber? Just looking for a broadband and entertainment connection."", ""Ask a technician or don't u have money"", ""Thank you...I'll look for a technician now."", 'do u know any specific sub where i can find resolution for android tv problems /helpme.', ""I'm using jio airfiber in my village which has good 5g coverage in my area since March 2024.In first month I got some technical issues but solved within time.Now speed consistency has increased a lot.Can go for it if you don't have wired connection facility in your areas."", 'Not mine..asking for a friend.', 'nah man']"
1e03kl9,Nfc for payments in non-samsung phones.,"Hi friends,,
I have samsung s20fe 5g and use samsung touch and pay heavily for payments less than 1k.

My wife has LG g8x which has nfc and wants to use the same , but we've not been able to set it up via gpay+credit-card or any other app.

Does somebody have successful linking of credit card and some payment app in a non-samsung phone ?

If so, please share info.",2024-07-10 18:47:35,[]
1dru3fb,TV Recommendation Needed,"I thinking of buying a 55 0r 65 inch TV. Had an OLED few years back from LG that went kaput in 2 years. 

What is the good TV in the range of 80k-1L?",2024-06-30 05:13:38,['Go for Sony OLEDs.']
1dmlbnb,Selling my 34” monitor,"I’m not sure of the flair but I’m hoping this is a correct one.

This is an LG Ultrawide (Model: 34WP550) that I got almost 1.5 years ago (Dec ‘22 precisely). I bought it since I wanted to keep a decent WFH setup and it required me to have one during that time. Now that I changed my workplace and I don’t need the monitor anymore, I’d like to sell it.

* 3y manufacturer warranty
* 2560 x 1080p
* IPS display with matte finish",2024-06-23 12:44:24,"['Price\nAnd the time when u purchased?', 'Can fit the great wall of china in that thing', 'How much did you get it for? Also, where do you live?', 'Is this still available.', 'I’m asking somewhere between 12-15k. Mentioned the time of purchase in post above', 'Sorry for late reply. I got it for 29k from Amazon. Currently living in Delhi.']"
1dlrbjt,LG Transparent TV for Futuristic Experience Like Never Before ,,2024-06-22 08:51:52,[]
1dh8h44,How's this laptop?,,2024-06-16 14:13:46,"[""a great pick actually, but the battery sucks, tho that's the case with 99% of gaming laptops"", 'Good enough for everything', 'I have this one, its a great but sometimes screen flickers, its not a software problem as I reinstalled windows might some small hardware problems, anyone facing same problem or have solution?', 'Nitro V much better imo', 'this was great as of last year, i have it and it does everything i need it to do, almost all games run smooth at 60+ fps easily. BUT that was last year. these days you can get a 6gb 3050 instead at the SAME price which is obviously gonna be more helpful in playing games. or you can probably even get a 3060 if you add a  5-10k more', '[deleted]', ""Don't pay 70k for a RTX 3050 laptop. Wait for the major sales. Most RTX 3050 laptop receive major price cuts on sales."", 'I already stretched my budget, anyway thanx for the suggestion.', 'Bro when is the next sales ?', 'Prime day sales in AUG']"
1dh4675,Earphones suggestion - Realme buds air 5 pro or IEMs? ,"I'm planning on buying myself a pair of earbuds. 

I am looking for excellent sound quality, wide soundstage, great sterio seperation and that feeling of instruments and other sounds coming from a farther distance (if you know what I mean. Lol).

I'm confused between the above mentioned options since I like the comfort wireless brings with it but also sound quality and good amount of bass( not that type of bass in auto rickshaws which overshadows other instruments and distorts vocals) is a paramount requirement. 

I have heard mixed opinions about IEMs(mostly positive) and great opinion about realme buds air 5 pro. I need great audio quality kinda like CD quality type but also like the comfort of TWS. A good mic is a icing on cake (heard the realme buds air 5 pro has great mic as well).

I know I'm confusing but PLEASE OFFER YOUR VALUABLE SUGGESTIONS AND TIME FOR MY QUERY. Please suggest which one should I go for or any other options that offers best of both worlds. 

I have an iphone 14 with apple music premium and a LG G8X Thinq which has headphone jack with HiFi  Quad DAC and use Spotify premium on Android. 

Thank you in advance",2024-06-16 09:49:26,[]
1d5gdsh,"Moving in a few days and cleaning my drawers and storage boxes, found some of the boxes for the gadgets that I own(ed).",,2024-06-01 06:06:20,"['Good choices as per their time ..', 'Fellow LG G3 user here\n\nP.S I still have that phone (not using it tho)', 'Thanks!', 'I still have my LG G5 as well, I use it for teams office video calls', ""Wow man it's an amazing phone. I loved it to the core, but it's cpu was about to die that's y sold it...\nU have many lg phones, which another than lg did you try?"", 'LG GW 300 (qwerty)  \nLG G5  \nLG Shine  \nLG G8x  \nLG Q6']"
1d0nv5f,Considering a Mac Mini Purchase: Need Your Recommendations!,"Hey everyone,

I've been thinking about purchasing a Mac Mini for the past 2-3 months and would love to get your input and recommendations. Here are the specs of the Mac Mini I'm considering:

- 8-Core CPU
- 10-Core GPU
- 8GB Unified Memory
- 256GB SSD Storage

**Price:** ₹59,999 (Not sure if the student discount will apply)

**Here's what I'll be using it for:**

**Study:**
- Reading PDFs
- Creating projects & assignments

**Work:**
- Google Sheets
- Facebook Ads
- Slack

**Enjoy:**
- Watching movies & web series

I already have a laptop that I'm looking to retire, and I have a Full HD+ monitor (LG) that I plan to connect to the Mac Mini.

**Additional Storage:**
I also have a 500GB SSD and a 500GB HDD that I'm thinking of connecting to the Mac Mini for additional storage.

**Questions for you all:**
1. Is this a good buy at this price point?
2. Will the Mac Mini handle my usage comfortably?
3. Any suggestions for alternatives or upgrades?
4. Are there any deals or student discounts I should be aware of?
5. Any tips for setting up and using external storage with the Mac Mini?

I'm open to all suggestions and would love to hear from fellow gadget enthusiasts. Thanks in advance for your help!",2024-05-25 22:59:43,"[""For the storage, if you can opt the 512 GB model that would be great   \nCuz if you're doing some heavy task and you have only 50 GB space left of 256 GB, then the system starts throwing error plus about running out of memory,   \n(yeah this happens, when the 8GB ram get's full then it uses your part of storaage and uses it as a RAM (also known as Swap Memory)  so the system doesn't hang or crashes and this only happens when you'll be doing very heavy tasks)\n\nOtherwise the mac mini flies, and is very smooth to use and quite powerful in that price compared to a windows PC or a laptop"", 'If you happen to get Mac and external drive, setup TIME MACHINE if data is important to you.', 'Hey, let me know if you go ahead with your Apple product purchase. I am an apple employee and i get a 15% discount. Can help you out', ""Hey What's that can you explain further?...."", ""I haven't purchased yet how can you help me ?..... I'm confused?"", 'Is this offer applies for me as well? 🥹\n\nBy the way, I heard to get discount from Apple employees, they should buy it on-behalf of us. Sorry for saying it but your comment sounds little sus 😅 But maybe there’s another way as well. Please don’t feel offend just telling what I used to hear.', 'Backup mechanism in MacOS.', 'Buy it and send me the invoice. Dm me. Should be from apple.in. Will apply for reimbursement', 'Not for india brother. For anything outside India, Apple employees can make the purchase on uour behalf. Plus its safer this way. You make a purchase, you get the product. You share the invoice and i apply for reimbursement. You dont have to pay me anything', 'Oh thanks']"
1d0b935,Suggest me a TV,"SAMSUNG Crystal 4K Vision Pro (2024 Edition) 108 cm (43 inch) Ultra HD (4K) LED Smart Tizen TV on Flipkart
https://dl.flipkart.com/s/JgIOa1uuuN

 LG UR7500 108 cm (43 inch) Ultra HD (4K) LED Smart WebOS TV 2023 Edition with a5 AI Processor 4K Gen6 and 60Hz Refresh Rate, Magic remote capability on Flipkart
https://dl.flipkart.com/s/JDzqcHuuuN

Tell me which one should I buy.",2024-05-25 12:45:32,[]
1cy066g,Thoughts about this Vu TV?,"I’m thinking of getting a new TV soon, and I really liked the specs of this TV (16GB ROM as compared to 8, crazy 120 watt inbuilt sound system). It costs 33000 for 50 inches. Samsung, LG and such reputed brands are way too expensive (45-50k)ish.
So I wanted to know if anyone has this TV? I can’t help but think that there would be a catch. 

Please help a brother out. Thanks! :)",2024-05-22 13:25:11,"['I have this TV for over 1 year now. Speakers are loud but shitty, so a soundbar is highly recommended. Picture quality is average, and dark scenes are best viewed in a dark room only.', 'I am using VU tv from 2016 but its a smart Full HD tv ...  \n\nIts a really good tv ... in last 8 year not even once had issue with repair', 'Bro, I bought Edifier MR4 speakers and they have a combined output of 65watts. No way this TV got 125 watts.', 'Thanks for letting me know. Really helps!', 'Thanks! How about the speed and picture quality??', 'https://preview.redd.it/abo7lo9sa32d1.jpeg?width=828&format=pjpg&auto=webp&s=7c5983029a332e14419b5ec0dffae2dd3e75e58e\n\n104\\*\\* not 125', 'its good ... But i am using old model of VU called Smart Full HD. there are many videos in YouTube. You can also check Thompson TV. i heard that even that is good', 'Alright man will check it out. Thanks!']"
1cvgq19,LG unveils world's largest OLED TV in India,,2024-05-19 05:14:54,"[""20 lakhs is not bad i thought they'd be selling it for 1 crore 😭""]"
1cmgxdq,Planning to buy a 43 inch tv. Narrowed down to sony and samsung,"Hey there, planning to buy a 43 inch tv and i hv narrowed down my options to Sony X64Lseries and the Samsung D series crystal vivid pro. Havent considered LG as my previous one was LG thin q which was bad as the panel went blank after 2-3 years. Which one of the two would be a better buy?

Main requirements are a durable panel which lasts for 6-8 years atleast. Samsungs review werent so positive about the display and the samsung is 10k cheaper.",2024-05-07 17:05:10,['dont buy tv itself  \nsave money']
