post_id,title,selftext,created_utc,comments
1ckjpue,"Reliance Industries is preparing to challenge the dominance of Samsung, LG, and Sony in the consumer electronics market with its new brand, ""Wyzr""",,2024-05-05 05:09:44,"[""yeah good luck with that. They'll need to invest billions into R&D and establish a ton of factories to produce most of the parts if they really want to compete these 3 giants. They have the oil money to do with but I'm really skeptical they would do that. \n\nThe last time they entered phone business was a disaster with cheap quality rebranded 4G smartphones with LYF brand. I don't see how they would do any better with electronics."", ""I hope so. Only they can invest that much and bring a revolution in our industry. I hope they won't sell rebadged chinese items again"", 'Companies plans fail and succeed. Why only focus on the fails? Maybe they turn out to be good. We already know all products will be rebranded chinese.', 'I\'ve not ""focused"" on anything here, just implied that they\'re not going to win over the Indian consumer electronics market without heavy investments into actually making them inhouse.', 'One should focus on fails because I\'ll remember the time when I "" bought the lyf wind phone and it didn\'t last even one year and service centre refused to fix it citing water damage when there was none "" before buying their cheap tv....']"
1cjslen,Some of the deals on gadgets in sale,,2024-05-04 05:07:54,[]
1ci9iry,Need a 22 inches TV (non-smart preferred) for a small drawing room,"I am looking for a 22 inches TV for our drawing room. I know Sony had 22 inches TV, but they are all out of stock for months now and the LG one was a smart TV. Don't require any fancy feature, just a simple LED/LCD.

Any recommendation would be helpful. Thanks.",2024-05-02 07:19:07,"['KODAK 60 cm (24 inch) HD Ready LED Smart Linux TV 2024 EditionKODAK 60 cm (24 inch) HD Ready LED Smart Linux TV 2024 Edition\n\nSeems nice-ish. I am looking for similar specs and this is the only thing that showed up without google shit', 'if you need a tv that size the best resolution you would get will be just HD id suggest instead get a fhd monitor and pair speakers with it you will get much better ppi + can repurpose it on ur desk setup once you upgrade ur tv or room']"
1c287n1,Tech now vs then,"How far we've come in just a decade!

Who here had the nexus 4? One of the best phones ever made in my opinion.",2024-04-12 12:44:19,"['I miss my Nexus 4 ....', 'Does that Nexus works ?', 'Nexus 4  was so great. That glass back was so attractive 10 years ago.', ""That's one blast from the past   had a N4 with 8gb storage option..There are phones shipping now with more ram than that phone's storage !! Custom roms and the tweaking options for that phone were dope. Ran Ubuntu Touch on it for a while !!"", 'Owned one for 2+ years. Dope phone!', ""Perfect working condition. I'm going to add android 13 to it soon"", 'Nice man I am looking to buy one for myself']"
1by2rbh,Best 1.5Ton 3star AC ,"Please recommend 1.5Ton 3 star ACs. 
As per my research, LG and Panasonic are the two best I can go for (O general is out of budget). 

Can you please recommend me some more option or share your ideas about LG v/s Panasonic",2024-04-07 11:58:07,"['Why 3  star over 5 star', 'Voltas, cheap and best. Go for the window one.', 'Bluestar is also good.', 'Go for Daikin', 'If your room is on top floor go for Daikin or Mitsubishi AC', 'Go for Panasonic bought a month ago']"
1bw97wf,"Best WFH monitors under 13,000","Hey there techies,

Hope all of y'all doing great. My office has given me a budget of 13,000 to buy a monitor. Going to use it for work, coding and to watch movies. Preferable size is 24 inch. 

Have seen brands like: 

Dell
Viewsonic
BenQ
LG
Lenovo

Any guidance will be extremely useful. Thank you very much! 

",2024-04-05 04:35:04,['Here you go Benq 24 inch - [https://amzn.to/3xlK2JP](https://amzn.to/3xlK2JP)']
1bsxho4,Title has low budget,"I have considered some tws under 1k(i know zyada hi kam h budget)
•Noise VS404
•Hoppup Predator XO3
•Truke BTG Neo

Mujhe best toh truke ke features lge lekin kuch review mai log bol rhe hai ki 3-4 Maine mai issues aa rhi h aur customer care support acchi nhi h

Hoppup predator ka kuch khaas reviews nhi h pr ye brand suna hua nhi h toh kuch keh nhi skta (Flipkart pe acche reviews hai)

Noise ka comparatively features utne acche nhi h baaki 2 se pr reviews acche h Flipkart pe aur online bhi 


Again, i know budget km lg rha h pr pls ignore that  ಥ⁠‿⁠ಥ",2024-04-01 07:34:25,"['1000 aur save kar', 'Agar 1000 mai hi Lena hai. Then I can back up truke. Battery best hai among all competitors. Mujhe 2 saal ho gye hai truke ke tws liye. And still in great condition. Sound quality bhi decent hai. Anything till 1500 would be similar. Sirf expensive earphones se difference aayega. Baki Maine mehenge bhi use kiye hai. But agar proper experience chahiye to atleast 4-5k ke lene padenge. Baki to these are more than enough. Agar luxury use nhi hai to I recommend to go for them. Also check some other models for truke. They are quite good. Hopefully spend 100-200 more and get the best model of the options', 'There’s some op ones around 1600 invest in that!', ""Instead of looking for tws around ₹1000...try to extend your budget to get realme buds wireless 3 neckband...you won't compromise on the sound quality... unless you really want tws you should be ready to spend atleast ₹2000-2500 for some decent tws...or you can check out realme techlife t100 its almost a year old now...but its reviews are good"", 'https://preview.redd.it/ck8i91im7urc1.jpeg?width=1080&format=pjpg&auto=webp&s=d457a3ded9dc169dc3fa8be36f11fc8a420dfa57\n\nBhai ye wala sirf 100 rs zyada hai. Reviews ache hai', 'Bhai thoda aur save krle and boat ke hi lele', 'Redmi buds 4 active. I have been using it for months now. Cost around 1100 rs. \n\nOr base acche chahiye to boats lele', 'comments pdh ke toh yhi lg rha hai ab 🥲', 'is the battery backup same as what is shows, like 80hrs with case or so aur connectivity kaisa hai mtlb bohot log ke review mai dekha hai ki 3-4 mahine mai koi ek side ke buds kaam krna bnd kr dete hai \n\nbtw aapne konsa buds liya tha truke ke', 'https://preview.redd.it/8r3rjukpuurc1.jpeg?width=1080&format=pjpg&auto=webp&s=eb8cbbee503f5cb284ce829b57cfc04681c25c3a\n\nye accha hai kya?', 'Yeah. The battery is the best part. Like I have truke air buds lite. And have also used pro and S1. Mine showed 10 hrs in one charge and 60 hours with case. I easily had 9+ hours in one go. Which is the best coz when you game or watch webseries, you can easily go for the day without the hasle of battery going off. With the case, I charged em almost 4-5 times 0-100. So yeah. Almost similar. When I had average use I could go a week without charging the case.\n\nAbout the connectivity, connection is good till 10 m and no barriers. After that is starts distorting. After 18ish meters is disconnects. \n\nAlso, I had the problem of both buds not connecting, but it turned out I reseted just one bud so that caused the issue. I contacted the care centre. They told me to reset. I did it and they worked fine after that. The new buds have app support. So they are even better']"
1bgvglj,Recommendations for light laptops under 40k,"Guys..please give recos for light laptops under 40k. Already have a Lg g15 for heavy duty works..needs a second light one for data/document work. Priority-battery life, mobility, 14 inch Thought about getting a  Asus vivobook 14/14 go. Please give opinions or any other recommendations ",2024-03-17 11:36:31,"[""dude don't ask for things like battery in win laptops. for battery there is no other option aside m series.""]"
1bf6jbj,Any suggestions for 27-inch monitor? Content creation and writing is focus!,"Hello, long-story-short, will be using this new 27 inch display to write long-form content and edit videos for my small YouTube channel.

Currently using 24 inch 1080p LG IPS panel - planning to go QHD to see more content in same plane for the upgrade.

I've a compatible laptop that can power QHD screens without a hiccup.",2024-03-15 05:24:27,"['Here\'s a [list of 27"" QHD monitors](https://www.monitorprices.org/?size=27&max_resolution=QHD,WQHD) for comparison.']"
1alsm0p,Top 25 Tech brands of all time as per the GadgetsIndia members,,2024-02-08 10:20:38,"[""Sad and angry because Gada Electronics didn't make it"", 'No Linux brands that’s sad. Red Hat', 'Philips, Cisco', ""Can't see any networking company"", 'Amazon\n\nLinux\n\nLogitech', ""this list is pointless tbh \n\nthere is no good way to judge how these companies pit against one another especially when some of these have nothing to do with others (LG and nvidia ????really?)\n\nthis is just a popularity contest at this point because you guys literally voted for asus **before** IBM. I'm not gonna go into the details of it you can just google IBM's history on your own.\n\nThis list reflects one thing very well , a lot of ppl in this sub have gaming computers/ laptops and think that whichever brand their stuff is from deserves to be the greatest tech brand of all time(asus, lenovo , msi, logitech , acer and for some fucking reason,, gigabyte ?? wtf?)\n\nyou also failed to consider how badly some of these companies are seen in the public eye these days (hp, google , miscrosoft, and apple, but mostly hp)"", 'Not even one Indian Tech Company :(', 'logitech?? really??? top 25????', 'Amazon ??', 'Motorola', 'Where is micromax?', ""Can't see Xerox"", '[deleted]', 'Complete bs, these guys are living under a million rocks', 'Msi????🤣🤣🤣🤣', 'I’m happy Xerox made it to the list. It truly deserved to be on the list', 'Nintendo??', ""Msi amd and Asus don't deserve a spot here"", 'Really no Amazon, Broadcom or Facebook.', 'Zebronics', ""Linux is not popular in consumer, they don't want to go through tons of fixes to run one thing which other OS can do right of the box"", 'rainstorm placid domineering jellyfish existence vegetable point narrow head versed\n\n *This post was mass deleted and anonymized with [Redact](https://redact.dev)*', ""Wtf u talking bout NVIDIA is big ass brand.\n\nSurprise in this list would be Nokia! Fuck that nostalgia but this ain't a top tech brand at all!"", 'Don’t know why you are surprised', 'for the legacy \n\nyes', ""Bro doesn't really use any good peripherals."", 'Bottom right', 'True', 'In India Nintendo NES consoles were never released but we got famiclones or NES clones on which super mario bros, contra, e.t.c was played.', 'I am not surprised, Just wanted to point that out.', ""there are so many companies which offer great peripherals, why only logitech, and there are so many great tech companies like tesla, amazon, Adobe aren't even on the list.""]"
1akt794,[ Final Round ] Top 25 Tech Brands of all time. 5 most upvoted comments will get a place,,2024-02-07 03:23:09,"['i am surprised there is no motorola', 'Valve', 'Logitech', 'Xerox. They sort of invented computers after Bill Gates was fascinated by their innovation and grew upon it', 'Nintendo', 'Dell. Dell. Dell.', 'bear hospital pause bells numerous party fretful sugar memorize humorous\n\n *This post was mass deleted and anonymized with [Redact](https://redact.dev)*', 'Tcs', 'Hp', 'Can we take **Android** in to Consideration.', 'TATA and RELIANCE', 'Meta amazon apple google netflix', 'Hp, Dell, Amazon, Motorola, Ericsson, Xerox, Netflix (?)', 'Where is dell?', 'Panasonic', 'ok', 'Steam', 'Hp', 'why not Xiaomi giving indian’s access to decent products at affordable price like tv, phones and laptops\nmaybe even cars in future', 'Stark Enterprise.', 'How can you forget networking and communication in Technology\n\nMust include Cisco', 'Xiaomi Xiaomi Xiaomi this company made mobile phones affordable and feature rich in India and set some norms which ultimately helped Indian cosumers', 'Samsung', ""If it's all time, then Nokia has seen biggest peak in my opinion"", 'Google, HP', 'How come there is no Amazon?\nThat’s one company that deserves to be there over most of the companies in that list', 'Motorola', 'HCL', 'Boat?', 'Xiaomi', 'Motorola is a giant and they invented the mobile phone. Most wireless communication devices are made by them today', 'DELL', 'META', 'Amazon', 'Adobe', 'LG', 'xaomi', 'Motorola', 'Adobe', 'Sad to see Blackberry phasing out of this list quite literally 🪦', 'MathWorks', 'Panasonic', 'No cisco?', 'OpenAI?', 'ARM , \n\nHuawei', 'Huawei', 'ARM', ""I can't see Xerox, why?"", 'Where Philips', 'Passionfruit', ""Where's Amazon???\n\nReasons :\n\n* AWS\n* Twitch\n* Kindle\n* Alexa"", 'How is lenovo there but no dell', 'People are weird…BBK is right there rn but i got downvoted when i pointed it out', 'Lava, coz they are doing very well in recent days', 'How about NASA??', 'HTC\n\nTSMC', 'No mediatek? They deserve a spot', 'HOW DOES THIS NOT HAVE MOTOROLA? they having fucking important part in the tech history, like they a niche thing called mobile phone', 'Google is the worst of above', 'OpenAI', 'HP', 'BBK Electronics', 'Valve needs to be in that list, they revolutionized the gaming industry. Even their handheld console is considered one of the best in the market.', 'How come no one said Bosch?', 'mediatek', 'ASML\nThey make the lithography machines that are used to manufacture Integrated chips, especially Processors.\n\nAlmost every major chip manufacturer uses their machines.', 'Dell', 'Yeah, they created the first\xa0wireless telephone.', ""I'm surprised you got downvoted for saying motorola, who tf out here having beef with Motorola lol"", 'As far I know Mouse was created by them.', ""I absolutely love dell but tbf they haven't done any groundbreaking technical innovation per say , props to them for their very lean mfg & supply chain , but you get the point"", 'Really ?', 'This needs to be higher up', ""It's still a new brand with a lot to prove"", 'Google: Am I a joke to you?', 'Android was made by Google which is already on the list', ""They aren't tech brands dumbass"", 'Microsoft', 'Fuck HP', 'The only correct answer.\n\nAnd the ceo\n\nBuilt an ARC REACTOR\n\nIn a CAVE\n\nWITH A BUNCH OF SCRAPS', 'many other', 'i guess they added it in the later posts', 'The mouse the gui even a form of internet. They invented everything, Steve Jobs was the one who realized it.', 'actually the post is about top tach brands not the most innovative brands so my comment doesnt even matter. dell is awesome in their last post they already had dell so i typed gigabyte and now they have gigabyte so it pretty cool', 'familiar nutty imagine rhythm full telephone foolish like oatmeal aspiring\n\n *This post was mass deleted and anonymized with [Redact](https://redact.dev)*', ""That's another post in r/indiatech"", 'Oh okay', 'Then Fairphone deserves a spot too', 'ohh okay. motorola should be there is all', 'society work muddle beneficial hungry oatmeal innocent quarrelsome nose oil\n\n *This post was mass deleted and anonymized with [Redact](https://redact.dev)*']"
1ajzufh,Top 25 Tech Brands of all time. 5 most upvoted comments will get a place,,2024-02-06 03:11:26,"['gigabyte', 'Lenovo', 'Blackberry', 'Durex', 'QUALCOMM\n\nNone of the Android Smartphones will be as good if it weren’t for Qualcomm', 'Acer', 'Acer', 'Motorola', 'Amazon', 'Idk if OpenAI counts as Tech brand', '[deleted]', 'Dell', 'Tsmc', '[deleted]', 'Qualcomm', 'IBM', 'Space X', 'No Hp, Panasonic', 'Nintendo', 'logitech', 'Xiaomi', 'OpenAI', 'Infosys 😂', 'TSMC', 'You say all time … people may not be aware about Phillips radio… Murphy… Uptron …', 'cisco', 'Amazon', 'Huawei', 'Godrej', 'Nintendo', 'Tesla? I know it’s not really a tech brand but their cars are quite literally computers on wheels', 'IBM', 'Huawei', 'Motorola', 'Applied Materials!\n\nhttps://preview.redd.it/asn427ezrwgc1.png?width=1200&format=pjpg&auto=webp&s=342c5aba363603facfc21efbec3a99a3f3002616', 'cool', 'Logitech', 'Lenovo', 'Ubuntu', 'Atlassian', 'Accenture', 'Oneplus. They started in 2014/15 and actually changed the whole mobile scenario.\n\nThere were no mid range phones with good specs. Either above 40k or below 20k. They entered the mid range market and captured it the best.', 'Amazon', 'Logitech all the way', 'TSMC for the win', 'Epson', 'Sony cause of the diversity.... Microsoft comes close ( coding softwares,windows,xbox, linkdin).... Then Samsung', 'Nvidia', 'America', 'Broadcom', 'Acer', 'Amazon', 'Xiaomi', 'Remove amd msi and Asus', 'Nintendo', 'Steam', 'Cannon', 'ALPHABET is parent company of google, swap them', 'Huawei', 'Qualcomm', 'HTC, Blackberry', 'Honda', 'TSMC', 'Tencent\nLenovo\nHuawei\nXiaomi', ""The world's first cell phone was invented by Motorola. How can motorola not present in that list ?"", 'What about Atlassian?', 'Salesforce.', 'Tencent sap alibaba', 'ASML\n\nNo TSMC & NVIDIA without ASML \n\n(& no ASML without Philips)', 'Qualcomm', 'Cisco', 'Acer', 'Abc', 'Infinix', 'Toshiba? \n\nI mean they kinda created the first laptop', 'Huawei', 'BLACKBERRY', 'Amazon', 'I think nobody can bean apple.', 'Blackberry', 'ASML God tier', 'Amazon', 'HP', 'Dell', 'arm', 'Xerox, nokia, arm, ericsson,bell laboratories', 'Blackberry man', 'Blackberry', 'Meta / Facebook', 'Tesla', 'AMD', 'ROCKSTAR', 'Philips', 'Mitsubishi', 'Philips', 'adobe', 'Where is Asus', 'Amd intel asus navidia', 'Bosch', ""Xerox is the only brand for me and none can put be alongside it. (if you know the tech history).\n\nWithout Xerox's PARC unit nothing would have been possible. Ethernet, Mouse, GUI and many more contributions. It was a pioneer tech firm."", 'Meta, Tencent, Adobe, Cisco, SAP', 'Valve', 'Atari needs to make the list they are one of main reason why gaming is what today it is', 'Xiaomi', '[deleted]', 'Meta', 'Toshiba', 'Hp', 'Lockheed Martin🦅', 'Apple', 'Huawei', 'Micromax', 'DELL  \n\n\nTheir computers and Enterprise servers are really good to use.', 'Hp', 'Apple', 'ARM', 'People forgetting Amazon is also a tech company', 'GNU. There done a lot', 'LLOYD', 'For me\n\nAMD : APUs \n\nMicrosoft : Obviously Windows and computer to masses\n\nQualcomm: They showed how great and efficient chips can be with small size\n\nMotorola: with phones and their 16 bit processors. Even with product like Moto G\n\nSony: Playstation, Walkman, Sound system. Do i have to list anymore', 'Logitech', 'RedGear. \n\nPretty good brand for gaming peripherals like KEYBOARD, MOUSE , GAMEPADS , JOYSTICK under budget and good quality too.', 'HTC', 'Philips', 'Adobe', 'HP', 'JIRA', 'Nokia', 'Facebook/meta', 'Xerox', 'HP', 'Open AI', 'Redmi', 'Bell laboratories, Cisco and Motorola played a much more significant role than half the companies listed above.', 'Ibm', 'BROADCOM', 'Zebronics', 'Oracle', 'Philips', 'Nothing', 'Sony', 'Redhat', 'Texas Instruments', 'Hewlett Packard', 'Where the fuck is Motorola????', 'Sony', 'ARM, they make chips for mobile processors in the form of A-76,A-53 and TSMC who is the leading manufacturer of chips in the world almost 60-70% of the chips are manufactured by them', 'meta or facebook', 'IBM', 'Why Dell is not there? Dell.', 'Panasonic\n\nToshiba\n\nLenovo\n\nSHARP\n\nDell', 'Razer', 'Jio : hmm let me see', 'Fatty nvidia', 'TCS - Tata Consultancy Services', 'Alibaba', 'Xiaomi', 'Classic Alpha tech (ciggerate)', 'Does no one remember cisco?', 'Still no Amazon?!!! Dayum', 'AMD radeon', 'Samsung', ""It's sad to see lenovo hasn't made it in the list till now \n\nThey make really good laptops"", 'True.. im also using legion pro 5', 'In India most of the tech companies use lenovo laptops', 'When I think of Lenovo I also think of Logitech', 'Tech brand?', 'This is actually equally split between Qualcomm, Broadcom and Texas Instruments', ""Without  transformer (thanks to Google for that paper) gpt wasn't possible"", ""It's not independent company as it is owned by Microsoft, but it is a brand. So yes it counts."", 'All time great ? Nope.', 'not a tech brand', ""I don't think my lpg cylinder is high tech enough. /S"", 'If there was a prize for copying then yes this is the greatest of all time. They have done some innovation but not greatest of all time level.', ""The fact that xiaomi isn't here shows how tech illiterate this sub is"", 'Not even close to top 50', 'YoThe mean Canonical, her developers', 'I think one plus is already covered in BBK.', 'Nokia was already there', '??? Read the title', 'true using legion now', 'This. I regret buying Hp Omen. Shit thermals, come impregnated with bloatwares and underclocked performance. \n\nShould have gone for legion.', 'High tech', 'Who cares upvote it 😂😂', ""Bell laboratories in that case. None of the companies would've existed had they not made the I.C"", 'yeah but it does count right', '[deleted]', ""I don't care, I get value for money products, I buy"", 'The more downvotes it gets the more happy I am', 'If they are asking for a brand then Ubuntu is the name', 'Using a X1 Carbon, fantastic laptop', 'Ultra high tech', 'Yes, what happened there was incredible, but I’m looking at components. Actually simpler thing to say here is that there are more smartphone brands than component manufacturers. So for example, glass is always Asahi or Corning in all brands.', 'I thought Texas Instruments made the IC', 'It does', 'are Foxconn, Pegatron, Corning, Wistron tech brands? these are mass manufacturers who support the tech industry. They have a huge pool of machinery, material and human resources who can precisely execute the designs of Engineers into real world products.', ""Doesn't make it a top 25 greatest tech company."", 'Ultra thin tech', ""You're right. Bell labs made transistor"", '[deleted]', 'Ultra durable thin tech', ""labour costs, favourable climate, state of the art logistics facilities (shipping via air and perfect roads), uninterrupted access to water supply (+industrial coolants) and other raw materials dedicated for the plant, these are anti social but this is what keeps Chinese, Taiwanese and S Korean companies afloat.\n\nThe USP of TSMC is execution excellence and not innovation. They have a very strict quality control process and are better at shipping the chips (chips are very delicate consignments). They can execute a design into a physical chip with the maximum accuracy, Samsung is terrible at this and that's why Tensor, Exynos, Snapdragon 8 gen 1 were failures, these chips are best on paper but let down by poor execution.""]"
