post_id,title,selftext,created_utc,comments
1eybktt,"Apple iPhone Production Process, Your iPhone is made up of parts from over 5 countries",,2024-08-22 05:32:56,"['Good insights. Well I dont expect everything to be done by apple , It would be a bad move for the economy.', 'If only samsung understood that making chips is not one of their great strength.', 'Most of it is samsung based still market cap of ssung electronics is nowhere near apple, that proves juat how much profit apple makes on their phones', 'Damn, Japanese companies excel in niche hardware.', ""I see samsung supplying half of the iphone components and yet launching a new flagship phone every year to complete with iPhone. Samsung's revenue is so dependent on Apple that they can't even cut supplies for its biggest competitor."", ""if Samsung want to beat apple to come at top (i am not saying apple is currently at top) then they can just stop doing these things for apple, why don't they do it then?"", 'Which one of the parts do you guys think India might be able to manufacture in the future, considering our current state of technology?', 'to  be very honest samsung makes the s24 almost all in house except processors and other minor components . This means they have a good potential to save costs and probably cuz they save costs they can put more features(like the s pen)', 'This is killer and great information.', 'Highly recommend reading [""Chip War"" by Chris Miller](https://www.amazon.in/Chip-War-Dominate-Critical-Technology/dp/1398504106/ref=sr_1_1?crid=39YPDA4UWMMI5&dib=eyJ2IjoiMSJ9.FsaDxzvRKQ8mEbZ9c22bzqLJa-CYkLy_ZNGwwiDlzlb82wkM4xFu4MXuY43lj4YBhvJrZSy1nZJ-EIbRys7zagCxqIop_C2vVC4psscpTJZazwc8BKIsUZeviT9LjTXGTcw0N8Yg0oTdzJwHa1zEf9h-EMt3gi3D_SNAtrvJYxsYCJG4y8Jvd9n3GCclohdcwBZEESTQDhmtzP2SGOWyLXVC3oWjMdM8Oox3to0J_Fw.ILurXRQ_let7MbFIBKcjCB5xaLwppYvWNiCPZ3QzEag&dib_tag=se&keywords=chip+war+chris+miller&qid=1724332066&sprefix=chip+war%2Caps%2C209&sr=8-1) to understand how semi-conductor industry evolved and its power / impact on country dynamics. These chips are the new ""oil""', 'So this is basically Samsung Phone form inside', 'Jitne ka naya I phone pro  India me launched hota hai utne me to Dubai Jake phone leke wapas aajao', 'Still some shit think appul is better then Samsung.. most of components made by samsung.', 'to  be very honest samsung makes the s24 almost all in house except processors and other minor components . This means they have a good potential to save costs and probably cuz they save costs they can put more features(like the s pen)', 'Even ASML who makes machines for TSMC , samsung and Intel . for printing chips. Previously it was dominated by Japanese Nikon, canon .\n\n[How ASML Won Lithography (& Why Japan Lost) (youtube.com)](https://www.youtube.com/watch?v=SB8qIO6Ti_M&t=278s)', ""Samsung doesn't have monopoly in those fields. Apple would just move elsewhere resulting the ultimate loss to samsung ,also to apple userbase(ir any mobile userbase) doesnt care about the parts made by samsung. It can be made by any company as long as quality doesnt compromise"", 'lol true. Every phone is Samsung phone from the inside.', 'thats not even the point of this freaking post. this post probably even implies that just rather buy samsung phones .', 'but then why apple dont get their parts made by other companies making samsung get in loss and then apple will be at top', 'Maybe because at the moment Samsung provides best quality at that price.', 'Yeah but even if they degrade quality(samsung retreats) then no normal user would notice anyway thats why too', ""The real reason is that south korea is an occupied nation, just like Japan. US military complex protects these countries and they want to keep a mutually beneficial relationship with these countries, so they don't go rogue. This is manifested economically in how apple treats samsung and vice versa."", 'you could say that because samsung == gdp of south korea . However the point the original commenter said i just gave the reason', 'Its about 22.4 percent not full', ""Bro south korea literally only buys from samsung , it makes their military , consumer electronics and what not . Yeah it's not full but without Samsung they would be doomed"", 'Still the protests are happening there against samsung to increase wages💀', ""Where doesn't it 🤷\u200d♀️"", 'No wonder why samsung has huge history in qc faults😂', 'Well yeah , I mean if I had China to build my stuff then it would be much better . But hey indigenous stuff is also worthwhile']"
1estopt,Help me to buy a monitor!,"I've 10k budget(strict had to take it from EPF) to buy monitor. Please tell me which one I should go with? I want better after sale service and monitor should last longer. As far as I've researched I've ruled out companies like MSI (because service centre is far and low rating on Google maps), Gigabyte (because it's not available to deliver on my location), BenQ(old monitor was BenQ stopped working right after 3 years 10 days.) My desk is a laptop desk it's dimensions are 60cmx40cm. I want to use it as a secondary monitor for my laptop. It's really hard working with only laptop screen when you are used a secondary monitor.
Acer after discount 8k
LG 24GN60R after discount 9.5k
LG 24GN650 after discount 11k
Tell me if there are any other options (99% sRGB is must)",2024-08-15 12:18:01,"[""Both first and third have the same panels, but the third one has an amazing stand. I have the same one and you can tilt, swivel and has great height adjustment.\n\n Do check if you can find it on LG's own website, they offer a discount on the first order with card discounts too."", 'LG one reproduces colors more accurately than the others', '1st one go for it', 'Go with Samsung odyssey g3 monitor', 'Try asus you might find something way less than your budget', 'Edit: If your desk is small, go for the first one. The third one will take a lot of desk space.', 'in the future if I want to have a Vesa arm or stand for my monitor is there quality options available? under 1500?']"
1eqf2gq,Suggest phone under 35k. small screen,"Hi guys please suggest me phone under 35k. I'm using Lg V40 since 5 years. I can use it for 2 more years but display is cracked and it will cost 10k to replace. My requirements:
- small screen ≤ 6.1""
- wireless charging
- must have NFC
- IP67/68
- descent battery life

I don't want The Best Camera. 
I don't watch content for long hours(1hr max). 
I only play Clash royale and Polytopia(occasionally).

I'm thinking about nothing phone 2/ S23Fe/ Please suggest any other that gits my requirements.
I can wait for 2-3months for sale.

Edit: I think I should  just wait for S23 to drop below 40k",2024-08-12 14:23:28,"['There is no phone like this in market', 'Used iPhone mini or SE lol', 'me finding a 5 inch  screen new  smartphone which is extinct.\n\n![gif](giphy|qQdL532ZANbjy|downsized)', 'Seriously save 10k more for sometime and get an s23 whatever you say is included ,it way also become cheaper with time', 'I got s23 at around 41K.\nTry that', ""If you're okay with slow Updates, you can think about Motorola"", 'Get a second hand iphone 11 pro or pixel 4a', 'Try for used S23', 'Wait more iPhone mini or se series might make a comeback this year.\nOther wise go for pixel', 'Nokia 105', 'S23 best for your usercase ... NGL u got to wait ig as u said...', 'Wait for BBD, you can get S23FE around 30K and S23 around 35 / 38 K.', 'S23fe is good but heavy and battery life is not upto mark', 'U can go for realme gt 6t absolutely beast phone... It is good for gaming also though I am not a mobile gamer but tried some of the games they were doing pretty well and the realme ui is clean as compared to previous realme phones.. camera is also good.. battery is really good u can use your phone easily for one day.. and it has 120 watt fast charging so full charge in 30 minutes', 'sed lyf :(', ""Isn't it that the iPhone doesn't allow you to use the NFC in India? Cause Apple wallet isn't launched in India yet"", 'I wish. smaller the better ;)', ""yup I'm leaning towards S23 now might have to wait for BBD or diwali sale"", 'where can I get it at 41k?', ""they all have curved display. In my hands it's disaster waiting to happen"", 'already got [one](https://imgur.com/a/VMp2ET9)', ""there's no way he's getting 47k retailing s23 for 35k lmao unless he exchanges"", ""S23 fe isn't small 😭😭"", 'I Keep hearing this but without gaming and content watching can it last me for the day?', ""it's too big"", 'if there was , i would have bought it', 'Samsung Corporate portal : INR 43700\n5% SBI cashback credit card discount: INR 2100\nEffective ~ 41K', 'S23 128gb was available for 45k in recent sale and under 42k for student, employee program', ""tried exchange flipkart don't have option for Lg"", 'I know some one who got S23 at 42 from offline. May be S23 fall down to 40K.', ""Yes, but it is one of the smallest phone available in india with 6.4 inch screen. We don't have Asus zenphone with 5.9 inch. So best phone would be S23/FE"", 'Still no bro. Go for s23 with offers once it gets offers', ""I've been using it since a month and it is going great"", ""Naa budy it's not that big"", ""41-42k is understandable without exchange but no way you're getting it at 35k as this guy suggests."", ""ok I'll check it out in person.""]"
1emdwbk,Help me choose a TV in 55/65 in (Samsung/Sony/LG) Budget 65k-90k with slight flexibility ,"I am planning to buy a TV mainly for movies and gaming. With plethora of options mainly across the 3 brands I am somewhat confused.  

Between Samsung Crystal series (65k), LG QNED83SRA(80k, 120 Hz), Sony Bravia 3 (90k) Sony Bravia X82 series. 

Another confusion is getting a 55 OLED or high end TV compared to 65 regular 4k LED TV? What do you guys suggest?",2024-08-07 14:55:24,"['Get the 55""OLED rather than regular 65"" LED TV.\nAnd I\'d prefer in this order.\n\nSony > LG > Samsung.', 'I have also heard about OLED burn-in issues. How prevalent is that? Only LG model is offering 120 refresh rate in 80k price so need to take that into consideration. Sony regular LED would be costing 80k', ""Yes. Sony's Regular TVs cost almost 50% more than LG or Samsung's regular LED TV. Same with OLEDs too. But trust me Sony is the best when it comes to Picture Quality among these three whether it is OLED and Regular LED. You can also go for LG. LG has the best customer service among these three in India. Don't know about Sony's customer service because there hasn't been any issue with my sony products ever since I bought them. Try to get it during sale, companies usually offer extended warranty. And make sure it's the company who's offering extended warranty not the retail store.\n\nAnd yes OLEDs can have burn in issues. But that only occurs when there's a constant picture like a channel logo or something displayed constantly at the same place on screen for multiple days. But I doubt you'll watch cable channels on an OLED Tv for longer periods. And I don't remember which one among these three but one of them also has a technology to combat that, forcefully move that channel logo to left or right so that it can prevent burn in issues. But I think that comes in their premium flagship TVs, nothing under 1 Lac. You can look it up if you want. \n\nYou have to take extra care of it I guess. Higher the cost, higher the maintenance."", 'Thanks a lot for detailed answer. \n\nI am thinking of going with Sony in that case. The 2 models I am conflicted is x82 series (65k using all offers) and Bravia 3 (80k). Catch is that x82 has been discontinued as told by reliance digital guy, if I remember correctly it was launched in India just last year. \n\nSafe to go ahead with x82?', "">Safe to go ahead with x82?\n\nIt's better to check Sony's website for X82 if it's still available for sale or not. And try to reach out to them and ask their customer support if it has been actually discontinued or not. \n\nAnd try to wait for sale if possible. You'll get better deals then."", 'Yes, at present 15 Aug sale is going on in Amazon, giving 10k card+coupon discount. Not sure how better sales like BBD would work, given the waiting time.\n\n I also checked on Sony website, its available for sale at MRP 1.29 lac. Thinking of going ahead with this model', 'Okay . Make sure to look up some reviews of this specific model on Web and YouTube. Better if you find some long-term reviews.']"
1ekvzca,"Very difficult decision, help me which one to choose. ",,2024-08-05 18:59:03,"['LG Samsung Dell these 3 brands are trust worthy', ""I'm sure LG won't disappoint you"", ""My suggestion, Don't go for 24 inch, instead choose 27 inch. I also got 24 inch but now I realise 24 inch is too small. So if you can increase budget them go for 27 inch. \n\nBtw I got BenQ 24 inch"", 'I need for gaming and coding. Also what\xa0 about multitasking and near view experience.\xa0', 'LG, always go for LG', 'Go with acer. I have the same model & it\'s excellent. Color is good. No pixelated texts. 100hz but mediocre speaker.\n\nhttps://preview.redd.it/xg59eoeljwgd1.png?width=1080&format=pjpg&auto=webp&s=c1020eee0be50dee74632945a4d2f888e354d7cd\n\nBut if you want 24"" only there\'s a qhd model from LG for 14k that seems like a good choice.', '27"" 2K display for just 12k? Dont buy it. Among the two, LG one is safer bet.', 'Btw Acer has greater resolution and larger screen size, decide according to your needs.', 'Edit: thanks for inputs, now i have consider to raise my budget and got acer nitro xv272u for best value for money.\xa0', ""I mean LG Ultragear is a thing in itself but like it is smaller size AND lower resolution. If you talk more about your requirement maybe people can provide better answers. But for purposes other than gaming, Acer is the better option here.\n\nIf you plan on using a card for this purchase, make sure to use the pFinTools browser extension to make sure you're getting the best price for your card considering all the payment offers, coupon discounts and hidden costs of EMI. If you are on mobile device or for transactions other than amazon, use the website\xa0[pFinTools.com/NCE-Cal](http://pfintools.com/NCE-Cal)\n\nYou can join r/pFinTools if you are interested in learning more :)"", 'LG is better at making Displays, just like Samsung.\n\nFor coding and gaming, LG would be preferred. Also its better to go for this one (180hz) [https://www.amazon.in/LG-UltraGearTM-Compatible-Headphone-borderless/dp/B0D4YPL67T?source=ps-sl-shoppingads-lpcontext&ref\\_=fplfs&psc=1&smid=A14CZOWI0VEHLG](https://www.amazon.in/LG-UltraGearTM-Compatible-Headphone-borderless/dp/B0D4YPL67T?source=ps-sl-shoppingads-lpcontext&ref_=fplfs&psc=1&smid=A14CZOWI0VEHLG) (sold by Appario, so you can trust it. Also read reviews from Flipkart or some other places)\n\nBut if you want to watch Movies and content, a 2560 (2.5k) panel is just beautiful. Its good for content watching, editing and movies. But has the refresh rate of 100hz (still good but nowhere near 180).', 'Go with acer, the longevity is unmatched.\n\nP.S. I still have my acer monitor from 2000s', 'Go for LG , ACER is a strong candidate too . But I would still prefer LG', 'am i the only one who thinks acer is better choice?', 'Does 24 inch fhd will have pixelated texts.\xa0', ""I know LG has a own separate entity for making displays especially with OLED i.e. LG Display but does LG or LG Display actually produce displays for these cheap $50-300 LCD monitors? I'm speculating and I could be completely wrong here but isn't there's a chance these are outsourced from a contract manufacturer?"", 'Nice, but I like in the post more because of its stand.\xa0', 'I have my philips monitor from 2013.', 'Yeah but this specific monitor has more complainte, now i am increasing my budget and buying Acer Nitro Xv272U V3 27 Inch.\xa0', 'Any monitor having ppi value above 110-120 will not look pixelated. Below that ppi value it might look pixelated if you are sitting at distance less than your arm length.\n\n24"" fhd has 92ppi while qhd 27"" has 109ppi.\n\nI tried all 3 at local store (27” fhd, 24"" fhd, 27”qhd) and 27”fhd was terrible, 24” less than that & 27” is great.\n\nUse this site to calculate ppi for you monitor. [https://www.calculatorsoup.com/calculators/technology/ppi-calculator.php](https://www.calculatorsoup.com/calculators/technology/ppi-calculator.php)\n\nhttps://preview.redd.it/v2ba4ya0mwgd1.jpeg?width=1280&format=pjpg&auto=webp&s=f5dc683416dc5ef5b705067fcc4f367a0eeffb91\n\nText in 27"" qhd.', ""Only a few companies make good monitor screens, LG and Samsung are one of them. Its much cheaper for them to make a display rather than to outsource it and play with their customer base. Also Asus uses LG's displays."", ""Don't go after looks unless you will be seeing the legs on a daily basis. You will 99% of the time look at the screen and not at the legs."", ""Bro this sub doesn't know about monitors. Blindly recommending LG when other companies also have good options. Go to r/Indiangaming\n\nI would recommend this LG one, Gigabyte G24f 2 or acer vg240ys 180 Hz. Compare and decide, all are good."", 'All the best 👍', 'Thank you very much', 'Bro i have question for brightness it is 250 nits, so how much it feel, how much in bright room.\xa0', ""interesting! I pretty much thought big companies abandoned making cheap LCD panels in-house. I've had terrible experience with all monitors over the years lol. Bought from AOC, LG and most recently Gigabyte in 2019. Display corrupting overtime (could be due to moisture on my part) and vertical lines. Now I've been using a cheap 4K TV from Toshiba as my monitor lol. \n\nOff-topic but it would be nice to see cheap OLED monitors with 27-32 inch size lol for sub 30-35k. It's a bummer we have smartphones with ton of other expensive components and OLED display for 15-20k and no inexpensive sub $300 OLED monitors even in 2024."", ""🙃🙃you misunderstood me. Its stand is can adjust height and also can rotate to 90 degrees. I don't have a decent table at home so that's why I need a good monitor with adjustable stand. Can't afford separate stand and table right now.\xa0"", 'Already posted there😁', ""Depends on how bright your room is. I have a decently lit room, windows from 3 sides, sunlight coming in from one side & i use it at 50% brightness & during the evening at 10%. I'm not particularly used to high brightness, even on my smartphone so i have never kept my monitor at 100% brightness.\n\nBut 250nits is more than enough you wont be disappointed.  I'd suggest any nearby pc store & check any monitor with 250nits brightness."", ""OLED technology is hard to push into Indian market mainly because people still dont buy 4k TV's saying it wont make much difference, but recently newer companies have done it like VU, Xiaomi, TCL and One Plus. \n\nBut again because its hard to manufacture such displays and provide long warranties, the prices will be high especially for monitors because its not a big market in India.\n\nIt will be good to see some company release a gaming monitor with OLED and push the other companies for competition."", 'You can get a height adjustable stand for the difference in amount. This display is for 10.8k a VESA stand will cost you another 2k-2.5k. Your display is for 12k. So you are just paying 800-1000 extra for a 180hz monitor and a universal stand that will serve you for atleast 5 years (if you wish to change displays or mount more monitors).\n\nAnyways, the choice is yours. Good Luck.', ""fully disagree with you on the point where people don't buy 4K TVs since they're incredibly cheap in India and pretty much has become a commodity on Flipkart, Amazon and retailers like Croma and Reliance Digital with various brands just licensing their brand name for a generic 4K TV (including from the above brands you've mentioned) \n\nA 43 inch 4K TV today costs 20000 rs and is easily available for 23000 - 25000 INR without looking for additional discounts and card offers. 50 inch models cost 33,000 which is like 5-6 times cheaper than it was in a decade ago and before that in 2012-2015.\n\nOLED/QD-OLED monitors on the other hand are expensive and relatively niche anywhere around the world and that is also true especially in India where all units are mostly imported instead of manufactured/assembled locally. \n\nOn your later part where it is hard to manufacture such displays with long warranties I FULLY AGREE with you on that part. There's risk for burn-in too and as for warranty also yes, LG even for their OLED TVs in India have reduced warranty for many showroom models from 3 years to 2 years. You have the ability to buy additional 2 years of warranty though by paying like 15-20k extra for a 55 inch model or at least's what was quoted to me by a salesman in Croma showroom."", 'Well thanks for inputs, I will consider it.\xa0', ""Well off and Upper middle class people do buy 4K TV's (some on EMI's) but the lower middle class still cannot afford to spend that amount of money just for the premium-ness. They often end up buying such TV's in EMI's on festivals with huge offers. \n\nPeople still don't buy quality soundbar even though you can get one for as cheap as 10-15k. I have seen people go for a good 4k Dolby Vision TV with awful soundbar and vice versa.\n\nSome people here are not ready to spend upwards of 20k on a smartphone (one device which you will use the most throughout your life). Some people cheap out on the cable/adapter to charge the phone.\n\nYes, those TV's are cheap compared to a decade ago because the technology is much easier to manufacture now. A decade ago, the CPU's were built on the 22nm architecture, today we get CPU's with 10nm architecture. Some chips with as small as 3-4nm architecture.\n\nIn a decade, you will see the market surge with cheap OLED TV's when everyone is using Apple Vision Pro or something similar.\n\nIn India, people care the most about the budget. They don't care if they get a 5 star AC by just paying 8-9k extra. They end up buying the 3 star AC which costs quite more than the 5 star AC in its lifetime.\n\nPeople here end up buying cars with no NCAP just because they don't crumple on accidents (like TATA). Sure if a person has budget they will buy the 4K tv, but a person who just wants a TV (restricted by budget), will go with a FHD or 2K one."", '4K TVs are inexpensive right now! You will have a better time finding deals for 4K TVs then FHD ones. As for 1440p they don\'t even make televisions with this resolution and it\'s mostly used for computer monitors (and 1440p right now is the most popular standard especially in gaming!). \n\nUnlike a lot of other gadgets and electronics, Televisions like I\'ve said have almost become like commodities. They don\'t cost a lot and a cheap 4K TV today costs just 20,000 rs and at most 25,000 rs! That isn\'t a very big amount for people who expect it to last at least half a decade! \n\nhttps://youtu.be/ea987YO-vCI\n\nThere\'s a better explanation by a 3 year old video by Techquickie on that topic (sister channel of Linus Tech Tips on Why TVs are SO CHEAP!). \n\nAs for the lower middle class, manufacturers [even in India] aren\'t just going to target this segment of demographic alone! There\'s going to be multiple segments for nearly EVERY SINGLE PRODUCT. From smartphones to watches to refrigerators to televisions and smartphones and heck even something like a toothbrush! People are gonna buy mid range goods as much as ultra budget/low cost goods and that applies even to things such as clothes, fashion & lifestyle products! \n\nThe point is options to do exist for thousands of goods but when it comes to cheap 27 - 32 inch OLED displays there isn\'t one like they do with sooo many options with LCD monitors. We\'ve got TN panels, IPS panels, VA panels. Monitors with 90hz, 120hz, 144hz, 240 hz refresh rates all selling from as low as 5000 rs to 30000 rs range with sizes as low as 19 inch to as high as 40"". Huge number of brands with huge number of SKUs to choose from but oddly missing when it comes to OLED monitors and features such as local dimming zones, 600-800 nits of HDR brightness, 10-bit panels, Dolby Vision Support. Heck they good make an entry model OLED monitor with 1080p and 60hz and there still would be a sizable market for it!']"
1ef81mg,Best AC under 50k,"Been looking for an AC for my Terrace room, getting very sweaty up there lately. So, I have short listed few ACs 

1) LG 1.5 Ton 5 Star DUAL Inverter Split AC (Copper, AI Convertible 6-in-1 Cooling, 4 Way, HD Filter with Anti-Virus Protection, 2024 Model, TS-Q19YNZE, White) 
https://amzn.in/d/0e8ah8uZ

2) Panasonic 1.5 Ton 5 Star Wi-Fi Inverter Smart Split AC (India's 1st Matter Enabled RAC, Copper Condenser, 7in1 Convertible, True AI, 4 Way Swing, PM 0.1 Filter, CS/CU-NU18ZKY5W, 2024 Model, White) 
 https://amzn.in/d/09vVQQ7S

3) Daikin 1.5 Ton 5 Star Inverter Split AC (Copper, PM 2.5 Filter, 2023 Model, MTKM50U, White) 
https://amzn.in/d/022bKNog

Idk which one to get, the Panasonic one has more reviews tho. I don't have much requirements or specifications, just want it to perform the best. Share your opinions on the shortlisted and can suggest some other ACs too",2024-07-29 19:13:43,"[""All 3 are good ACs.\n \nPanasonic has the best and fastest cooling but it's too much noisy even on lowest power mode and the remote is fucking ugly. But it has Alexa support. Don't know much about after sales service. \n\nDaikin is not what it used to be. It used to be manufactured in Thailand but not anymore.\n\nLG is the best under this price. It is basically silent, has brand value, really good after sales service, good looks and the remote is good looking and easy to understand. It doesn't have alexa support. You can buy the wifi version though. Might cost extra."", 'Ig i will get the LG one']"
