,title,text,transformed_date,star,product_num,hp_data
0,"Service center using fake gas & local copper pipe, overcharging, customer care is helpless","Using Fake gas & copper pipe:
The service center (Royal Services Goa) used local copper pipes, several leftover pieces of insulation (instead of one continuous roll), and it seems they filled the AC with fake gas. AC was using full power but not cooling at all, the inside room temperature was higher than outside temperature & they were knowingly reporting wrong gas pressures to LG to cover up. I sent the pictures of the correct gas pressure to LG but the ASM took no action & service center stopped providing service and then closed the complaint. The installation technician also showed me samples of poor-quality copper pipes which he admitted were not from LG but from the local shop.

Overcharging & Arm twisting:
Service center said official company rates are for showing only. If I wanted officially published rates, the installation will not happen. That is exactly what they did. They kept me waiting for 10 days and then closed the complaint with reason ""customer does not want installation"" even though the matter was under escalation to with CEO's e-mail address.

Excess charges:
Extra Copper Pipe with insulation & vinyl tape: Official Rate 850/meter, Service center wanted: 1130 + gst
Power chord: Official Rate 60/meter, Service center wanted 180/meter
Gas refilling charge on brand new installation: Official rate: Free, its included, Service center wanted: 1500 + GST

Even after the matter was raised with the Area Service Manager (ASM), the ASM instead of upholding official rates said its not profitable for the service center & wanted me to directly negotiate unofficial rates with the service center.

AC not installed in 10 days:
Since I insisted on official installation prices, the service center stopped responding to calls or messages. The matter was escalated to the ASM but nothing changed.

Useless customer care:
The matter was escalated using the write to CEO link. This turned to be a total waste of time as you only get directed to customer care and get generic responses. They forwarded my complaint to the persons against whom the complaint was made. No one from LG customer care even called to find out whats going on & the harassment only increased. Amazon also escalated the issue at their end but the installation was not done in 10 days. Finally, I gave up and returned the AC.

This review is from someone who used to be a loyal LG customer. But now LG is not what it used to be.","Apr, 2024",1,"Copper, AI Convertible 6-in-1 Cooling, 4 Way Air Swing, HD Filter with Anti-Virus Protection, 2024 Model, TS-Q19YNZE1, White",LG 1.5 Ton 5 Star DUAL Inverter Split AC
1,Copper pipe was missing,"Cooling, efficiency, everything is good but the copper pipe was missing in the amazon package. Had to pay for the pipe and then calim the refund from amazon. Amazon provides refund in the form of amazon pay balance which was waste of money.","Aug, 2024",3,"Copper, AI Convertible 6-in-1 Cooling, 4 Way Air Swing, HD Filter with Anti-Virus Protection, 2024 Model, TS-Q19YNZE1, White",LG 1.5 Ton 5 Star DUAL Inverter Split AC
2,Good product with poor installation service,"Product is good but installing this thing is nightmare. Installation is done by brand itself on amazon & by third party installer on another e-commerce website. Brand installation is alway bad.
After hundreds of calls to LG, I received first technician visit after 7 days of delivery, when technician came to home, he told me he didnâ€™t carry any proper rotary hammer drill and having only drill machine and mechanical hammer to make a hole, I refused to install as this could damage wall.
Again after hundreds of calls to LG, three days later another technician visited, this time he was very professional and had all the tools.
So yeah, I recommend this product to someone who have a lot of patience. Product seems good after one week of uses.","Jun, 2024",3,"Copper, AI Convertible 6-in-1 Cooling, 4 Way Air Swing, HD Filter with Anti-Virus Protection, 2024 Model, TS-Q19YNZE1, White",LG 1.5 Ton 5 Star DUAL Inverter Split AC
3,Good,Good,"Aug, 2024",3,"Copper, AI Convertible 6-in-1 Cooling, 4 Way Air Swing, HD Filter with Anti-Virus Protection, 2024 Model, TS-Q19YNZE1, White",LG 1.5 Ton 5 Star DUAL Inverter Split AC
4,Installation,"The product is really good and nice cooling, less noise. For installation they charge more than what's shown on Amazon app. Standard installation they charge 1415 and we have to pay extra for stand and the three pin plug and other accessories and for installation of the outdoor unit stand separately which was around 1200. LG sent an installation service fee bill of Rs.2596 but the service team charged me more. I wish the right expectations were set before installation about the charges, hence writing it here, it may cost around 3k for installation alone!! Not a fair price!!","May, 2024",3,"Copper, AI Convertible 6-in-1 Cooling, 4 Way Air Swing, HD Filter with Anti-Virus Protection, 2024 Model, TS-Q19YNZE1, White",LG 1.5 Ton 5 Star DUAL Inverter Split AC
5,Review,"Overall its a good product, but the ocean black protection is missing in indoor coils , and also the gold protection is missing in the u bends of the outer condenser coil.","Jul, 2024",3,"Copper, AI Convertible 6-in-1 Cooling, 4 Way Air Swing, HD Filter with Anti-Virus Protection, 2024 Model, TS-Q19YNZE1, White",LG 1.5 Ton 5 Star DUAL Inverter Split AC
6,Good AC but Pathetic Installation,"Purchased the AC last week.Installation was a pain .Everyday someone claiming to be from LG would call only for not to turn up.Finally after 5 days a guy who pretended to be AC technician visited for installation.The guy was more suited for road construction rather than AC installation.He neither had patience to explain anything nor he had any skills to carry out installation.Left without giving Demo.For an AC costing north of 40k Atleast LG should send someone who knows the job.
Coming to the AC,it does work properly.There is no backlight in Remote which can be irritating at night without lights.AC is almost soundless ,cools my 140 sq feet room within 10-15 mins.","Apr, 2024",3,"Copper, AI Convertible 6-in-1 Cooling, 4 Way Air Swing, HD Filter with Anti-Virus Protection, 2024 Model, TS-Q19YNZE1, White",LG 1.5 Ton 5 Star DUAL Inverter Split AC
7,Product quality is good but service needs to be improved,Product Quality is good but service needs to be improved. I bought the AC along with stands(AC bracket) in Amazon but the service techinicans did not accept that to install and they asked me Rs. 300 extra for that otherwise I need to buy their products which costs Rs.1000 it seems. I bought 2 ACs and I lost around Rs. 500 and I tried to call Amazon and LG service centre but noresponsw from them. Please improve the service.,"Apr, 2024",3,"Copper, AI Convertible 6-in-1 Cooling, 4 Way Air Swing, HD Filter with Anti-Virus Protection, 2024 Model, TS-Q19YNZE1, White",LG 1.5 Ton 5 Star DUAL Inverter Split AC
8,Value for money,"Value for money, features, cooling, performance, connectivity, warranty","Jun, 2024",3,"Copper, AI Convertible 6-in-1 Cooling, 4 Way Air Swing, HD Filter with Anti-Virus Protection, 2024 Model, TS-Q19YNZE1, White",LG 1.5 Ton 5 Star DUAL Inverter Split AC
9,MRP,"Liked very quick delivery .
Dislike MRP as described 85990
less 45 % .net 46990

But the product tag has mfg date .july 2024 and MRP 30097 .inclusive all taxes .
Matter is serious and a minimum claim for refund of 46990-30097
=16893 .","Aug, 2024",2,"Copper, AI Convertible 6-in-1 Cooling, 4 Way Air Swing, HD Filter with Anti-Virus Protection, 2024 Model, TS-Q19YNZE1, White",LG 1.5 Ton 5 Star DUAL Inverter Split AC
10,Don't go for Inverter AC for domestic use.,"- Inverter AC is a scam and companies like LG are cashing on it.
- LG doesn't not provide Copper Condenser or Copper Pipes to OD unit.
- please double check with other brands as well, as the No1 Ac company is also No1 in Cheating customers. Very frustrating... Inverter will work fine for a couple of years ,after you will start getting problems..
So be watchman for your money, don't rely on the advertisement only...","Apr, 2024",3,"Copper, AI Convertible 6-in-1 Cooling, 4 Way Air Swing, HD Filter with Anti-Virus Protection, 2024 Model, TS-Q19YNZE1, White",LG 1.5 Ton 5 Star DUAL Inverter Split AC
11,Disappointed with the installation,"Toal cost 1415+600(for stand which i didnt used I have old AC installed)+ 250(for labour charge for drilling just 3 extra holes) + 580 (for dismentelling the Old AC and putting it on floor).
Also the guy didn't perform the leakage test, doesnt explain the functionality of Remote (due to lack of his knowledge i believe). Bad.
LG I am buying 46000 Rs AC, Dont you think Installation should be free??.","Apr, 2024",3,"Copper, AI Convertible 6-in-1 Cooling, 4 Way Air Swing, HD Filter with Anti-Virus Protection, 2024 Model, TS-Q19YNZE1, White",LG 1.5 Ton 5 Star DUAL Inverter Split AC
12,Not satisfy with product.,"It's been 2 years using this LG AC.
Not satisfied with the quality.
Doesn't cool fast and less cooling as compare to others.
I have samsung AC as well been using for 3 years, cools faster and make room SHIMLA within 10-15 mins.
LG claims that it consumes less Watts, but didn't see much difference as compare to Samsung AC.
Bought Samsung AC for less than the price of LG AC (almost 10k less )and it is older than LG AC, yet faster cooling and totally value for money and satisfied.
Don't go for LG AC.
LG AC has VIRAT mode as well. Just faster the Fan speed and does nothing.","Jul, 2024",2,"Copper, AI Convertible 6-in-1 Cooling, 4 Way Air Swing, HD Filter with Anti-Virus Protection, 2024 Model, TS-Q19YNZE1, White",LG 1.5 Ton 5 Star DUAL Inverter Split AC
13,Cooling,Cooling is very less I had whirl pool 1 ton magic cool ac it will cool with in minutes. But this ac taking lot of time to cool,"May, 2024",3,"Copper, AI Convertible 6-in-1 Cooling, 4 Way Air Swing, HD Filter with Anti-Virus Protection, 2024 Model, TS-Q19YNZE1, White",LG 1.5 Ton 5 Star DUAL Inverter Split AC
14,May work better for smaller rooms,"I bought this AC in May 2024 and have been using it for couple of weeks now. Earlier I had a 10 yrs old 1.5 ton fixed speed Carrier AC, deployed in my living room/kitchen area with a size of approx 150 sq ft and it would chill the room. This LG AC is able to moderate the temperature to some extent but the air flow is barely noticeable even in HC mode, till the time I am sitting in front of it. This AC does not justify the steep cost!
Since, I have to run it in highest power setting or so called Virat mode all the time, I don't notice the difference in spends vs my old AC. Probably it is good for room size of 120 sq ft or less. Not impressed.
I think a Carrier or Blue star would be a better option.
I am now buying a fixed speed Windows AC from Carrier for my bedroom. Avoid Inverter ACs wherever you can.","Jun, 2024",2,"Copper, AI Convertible 6-in-1 Cooling, 4 Way Air Swing, HD Filter with Anti-Virus Protection, 2024 Model, TS-Q19YNZE1, White",LG 1.5 Ton 5 Star DUAL Inverter Split AC
15,L.G split Air conditioner,"We bought it for our living room but was not fully satisfied the way it performs, not cooling the room that fast,","May, 2024",3,"Copper, AI Convertible 6-in-1 Cooling, 4 Way Air Swing, HD Filter with Anti-Virus Protection, 2024 Model, TS-Q19YNZE1, White",LG 1.5 Ton 5 Star DUAL Inverter Split AC
16,BEWARE OF THE EXTRA CHARGES,"Even after purchasing the AC which coated me more than 40K, I was charged separately for the plug. Also, for the installation, the total charge was close to 3800.","May, 2024",3,"Copper, AI Convertible 6-in-1 Cooling, 4 Way Air Swing, HD Filter with Anti-Virus Protection, 2024 Model, TS-Q19YNZE1, White",LG 1.5 Ton 5 Star DUAL Inverter Split AC
17,It's ok,hecked online not getting extended warranty offer for this model,"May, 2024",3,"Copper, AI Convertible 6-in-1 Cooling, 4 Way Air Swing, HD Filter with Anti-Virus Protection, 2024 Model, TS-Q19YNZE1, White",LG 1.5 Ton 5 Star DUAL Inverter Split AC
18,Not sure,"I really disappointed with LG service, I got a call from technitian yesterday but installation is not done yet, I called him many time but he is not even responding to my calls and pings, I'm not sure about the product but service is very slow as i unexpected.","Apr, 2024",3,"Copper, AI Convertible 6-in-1 Cooling, 4 Way Air Swing, HD Filter with Anti-Virus Protection, 2024 Model, TS-Q19YNZE1, White",LG 1.5 Ton 5 Star DUAL Inverter Split AC
19,They are not checking the products whether it is working or not.,"We received the new AC with damaged PCB, after lot of complain lot of follow up , they replace the pcb.
We faced problem","Apr, 2024",3,"Copper, AI Convertible 6-in-1 Cooling, 4 Way Air Swing, HD Filter with Anti-Virus Protection, 2024 Model, TS-Q19YNZE1, White",LG 1.5 Ton 5 Star DUAL Inverter Split AC
20,Accessaries are not mentioned neither offered at the time of purchase.,"They didn't mention clearly about the accessories such as wall bracket for the outdoor unit etc. Further the limitation of copper pipe is only three meters that is too short. In other countries they will provide 5-7meters in general.
Product and service may be good (not yet tested) but overall satisfaction is more important. We may not mind paying an extra buck for the important/essential accessories along with the product which may save us from headaches if the installation happens when elderly people or home care personnel at home.","Jan, 2024",3,"Copper, AI Convertible 6-in-1 Cooling, 4 Way Air Swing, HD Filter with Anti-Virus Protection, 2024 Model, TS-Q19YNZE1, White",LG 1.5 Ton 5 Star DUAL Inverter Split AC
21,Worst service,"Firstly I believed LG is best for its products until I experience their worst service experience .... Recently we purchased this AC for installation they sent some third party technician(outside mechanics) they didn't installed properly they didn't even gave receipt for our payment, the Ac condition was not so good for cooling it's takes minimum 20mins, later with some issue we contacted LG customer care services startingly they responded well but after ey didn't even send technician even a week after raising our issue, we're contacting customer care but later they not even responding to our calls ...please don't take this product as ur choice and coming to their service very very bad ...hope this review will helpfull to you... thankyou","Aug, 2024",1,"Copper, AI Convertible 6-in-1 Cooling, 4 Way Air Swing, HD Filter with Anti-Virus Protection, 2024 Model, TS-Q19YNZE1, White",LG 1.5 Ton 5 Star DUAL Inverter Split AC
22,"Outdoor unit support, drain pipe you have to buy separately","With the box you are not receiving any steel angle, drain pipe as well as the masking tape they are going to charge separately. Including all those you have to pay 3000 approx for installation","Jul, 2024",2,"Copper, AI Convertible 6-in-1 Cooling, 4 Way Air Swing, HD Filter with Anti-Virus Protection, 2024 Model, TS-Q19YNZE1, White",LG 1.5 Ton 5 Star DUAL Inverter Split AC
23,Poor quality for the price. Don't buy.,"Writing after 2 months of usage -
1. Water leakage in indoor unit after 2 months of usage. Will post service experience after getting it fixed.
2. The swing can't be set to blow air below. My bed is right below the AC, the swing can't be set to blow air right under it. At the lowest point I get the cool air for my feet.
3. Cooling is not great for it's configuration. Any mode I use it's almost the same.
4. Cost of operation is only slightly less compared to 3 star AC. Not much benefit if you use regularly. My electricity bill haven't reduced much.","Aug, 2024",1,"Copper, AI Convertible 6-in-1 Cooling, 4 Way Air Swing, HD Filter with Anti-Virus Protection, 2024 Model, TS-Q19YNZE1, White",LG 1.5 Ton 5 Star DUAL Inverter Split AC
24,AC was not working and return,The AC was not working so we return the item and Thanks Amazon for refund without loosing any money. The Service from LG was very poor. The service guys come very late and took long time to fix the unit even they don't fix all screws both inside and outside units. when they open the packs they notices the damages even though don't inform us until we found the problem. Once they fixed the AC was not working even they said it will work after some time and left. Usually we are using LG previously and it is very good and i don't know why its happens now...?,"Nov, 2023",3,"Copper, AI Convertible 6-in-1 Cooling, 4 Way Air Swing, HD Filter with Anti-Virus Protection, 2024 Model, TS-Q19YNZE1, White",LG 1.5 Ton 5 Star DUAL Inverter Split AC
25,Don't Buy this product. Strongly recommended.,"With in a year I launched the 4 complaints on cooling and water leakaeg issues. Sensors are very delicate and sound system also has gone (Only options is replace PCB ). In warranty support is worst. Even if you launch complaint, they just do temporary fix.
After warranty, I mean after 1 year 4 months, indoor unit coil has leakage. If I want to repair these issues, I need to invest Rs. 20,000/- (Coil, Gas charges, PCB board and service changes.). My strong Recommendation is don't buy this product. And also Seller is also not trustable.","Aug, 2024",1,"Copper, AI Convertible 6-in-1 Cooling, 4 Way Air Swing, HD Filter with Anti-Virus Protection, 2024 Model, TS-Q19YNZE1, White",LG 1.5 Ton 5 Star DUAL Inverter Split AC
26,Don't chilling room,"Even LG techinicians visited and unable to findout the chilling issue, instead online better to by in TATA Croma","Jul, 2024",2,"Copper, AI Convertible 6-in-1 Cooling, 4 Way Air Swing, HD Filter with Anti-Virus Protection, 2024 Model, TS-Q19YNZE1, White",LG 1.5 Ton 5 Star DUAL Inverter Split AC
27,Not Cooling within 5 months Error code CH 38,"New ac LG 1.5 ton 5 star installed on April 2023, with in 6 month cooling issue rectified ""Error code CH 38"",Tech visited and he said evaporator cooling unit need to be replaced ,after two days technician replaced the part, then also problem not solved. Now they are telling it may be the compressor problem and i am waiting for last two days.Complaint open since last week and waiting for the next course of action from service center.I am so worried about this, with in few months problem started...I will update further details after this..","Oct, 2023",3,"Copper, AI Convertible 6-in-1 Cooling, 4 Way Air Swing, HD Filter with Anti-Virus Protection, 2024 Model, TS-Q19YNZE1, White",LG 1.5 Ton 5 Star DUAL Inverter Split AC
28,Above Average,"Think before purchasing it. Too much cost, takes lot of time in cooling the room of 110 Sqft.","Apr, 2024",3,"Copper, AI Convertible 6-in-1 Cooling, 4 Way Air Swing, HD Filter with Anti-Virus Protection, 2024 Model, TS-Q19YNZE1, White",LG 1.5 Ton 5 Star DUAL Inverter Split AC
29,Cooling,"Taking a lot of time cool the room and , swing modes are not working properly , air is not comming when we slept under the AC. My suggestion is not to buy.","Jul, 2024",2,"Copper, AI Convertible 6-in-1 Cooling, 4 Way Air Swing, HD Filter with Anti-Virus Protection, 2024 Model, TS-Q19YNZE1, White",LG 1.5 Ton 5 Star DUAL Inverter Split AC
30,pathetic service in Bangalore,"The product is ok or not I can't say but the seevice in Bangalore is so pathetic that you will regret every other day. They will give numbers which will be switched off or not answerable for eternity. After installation the product will also sometimes not work properly and you will chase them like
forever. The worst decision of my life is to spent 50k on buying LG AC","May, 2024",2,"Copper, AI Convertible 6-in-1 Cooling, 4 Way Air Swing, HD Filter with Anti-Virus Protection, 2024 Model, TS-Q19YNZE1, White",LG 1.5 Ton 5 Star DUAL Inverter Split AC
31,Missing item,Cupper wire was not found. I bought it locally after additional payment. As per the package inside description it has been written that 3 mts cupper wire will provided. But i did not get it. Which disappoints us.,"May, 2024",2,"Copper, AI Convertible 6-in-1 Cooling, 4 Way Air Swing, HD Filter with Anti-Virus Protection, 2024 Model, TS-Q19YNZE1, White",LG 1.5 Ton 5 Star DUAL Inverter Split AC
32,LG Ac 1.5 ton 5 star wifi 2024 model review,"Purchased latest LG Ac but not satisfied with noise level of the product
Cooling is good but the outdoor unit humming sound is very high, it is very uncomfortable noise.
Approached LG service centre for a resolution but I am following them for past 18 days for a resolution. Complaint is moving from one executive to another but struggle continues.

Hope LG is reading this.

Buying an upgraded LG ac model replacing older has backfired this time.

Advice is think thrice before going for LG ac.","Apr, 2024",2,"Copper, AI Convertible 6-in-1 Cooling, 4 Way Air Swing, HD Filter with Anti-Virus Protection, 2024 Model, TS-Q19YNZE1, White",LG 1.5 Ton 5 Star DUAL Inverter Split AC
33,This product is not supported in the LG ThinQ app for smart diagnosis,"The smart features are oversold. LG's way of performing smart diagnosis is by using an audiomessage from the AC which is decoded on your phone. BUT THIS FEATURE ALSO ISNT APPLICABLE ON THIS AC.

The AC has the logo for smart diagnosis but it doesn't work.

The cooling worked in Bangalore heat for one day. Now it only reduces the humidity of my room but doesn't cool anything. Room temperature is still showing up at 30 degrees.

The remote does not have a backlight.
The AC doesn't close the intake valve when the power goes, it will only do that if the power is available. How hard was it to put a single battery that could have just done that as a fail safe?

The gas must have leaked during installation. The installation people aren't even bothering to look into my complaints. I can't even diagnose this AC myself, what rubbish in this age of smart technology! Do not buy this piece of rubbish.

UPDATE: So while my room is 250 sq ft, I can run this AC in the Viraat mode. It's effective that way. But it's still not worth the false advertising from LG.
Other problems: the Remote doesn't have a backlight. The AC flap doesn't close when the power goes. Would have been nice to have a small battery that did that much.","Apr, 2024",1,"Copper, AI Convertible 6-in-1 Cooling, 4 Way Air Swing, HD Filter with Anti-Virus Protection, 2024 Model, TS-Q19YNZE1, White",LG 1.5 Ton 5 Star DUAL Inverter Split AC
34,Irresponsible installation,"The delivery of the product was satisfied. But the installation of the AC by LG Thiruvalla was pathetic, terrible and irresponsible. The installation process wasn't done by a professional way. They leave the plug without fixing the pin when asked about that they said we need to fix it but earlier on the customer care call they informed that they are carrying every equipments and will fix.It was irresponsible installation done by LG Thiruvalla.","Apr, 2024",2,"Copper, AI Convertible 6-in-1 Cooling, 4 Way Air Swing, HD Filter with Anti-Virus Protection, 2024 Model, TS-Q19YNZE1, White",LG 1.5 Ton 5 Star DUAL Inverter Split AC
35,Outdoor unit makes so much noise leaks like tap water. Dont trust youtubers,Outdoor unit makes so much noise which gives you anxiety and its Leaks like tap water. Can fill a bucket same time a tap can fill.,"May, 2024",2,"Copper, AI Convertible 6-in-1 Cooling, 4 Way Air Swing, HD Filter with Anti-Virus Protection, 2024 Model, TS-Q19YNZE1, White",LG 1.5 Ton 5 Star DUAL Inverter Split AC
36,Cooling achhi ni h new ac lgwaya h bt cooling 0h,"Cooling achhi ni h new ac lgwaya h bt cooling 0h
Ai inverter AC lgwaya sbse costly bt cooling bilkul b ni isse achha to godrej ka hi tha voltas ka b achha h
Worst product paise bekar ho gye","May, 2024",2,"Copper, AI Convertible 6-in-1 Cooling, 4 Way Air Swing, HD Filter with Anti-Virus Protection, 2024 Model, TS-Q19YNZE1, White",LG 1.5 Ton 5 Star DUAL Inverter Split AC
37,LG AC Installation workmanship is very bad,"LG product wise I am happy with convertible option and cooling effect is very good, however installation team did a crap work , workmanship is very bad , please refer for the pics, how pipes are mounted everywhere.","May, 2024",2,"Copper, AI Convertible 6-in-1 Cooling, 4 Way Air Swing, HD Filter with Anti-Virus Protection, 2024 Model, TS-Q19YNZE1, White",LG 1.5 Ton 5 Star DUAL Inverter Split AC
38,Bad quality product,"LG is a pathetic company. I bought it's after some time it's flaps are not closing properly.
They don't do proper quality check for their products. After 6 months it's TV also stopped working. Never going to buy LG product again.","Aug, 2024",1,"Copper, AI Convertible 6-in-1 Cooling, 4 Way Air Swing, HD Filter with Anti-Virus Protection, 2024 Model, TS-Q19YNZE1, White",LG 1.5 Ton 5 Star DUAL Inverter Split AC
39,Installation was chargable and good enough,"Ac was dilivered on time but guys be vigilent from installation guys, they charge too much. I think LG should provide free installation. Will write another review after using AC for few more days","May, 2024",2,"Copper, AI Convertible 6-in-1 Cooling, 4 Way Air Swing, HD Filter with Anti-Virus Protection, 2024 Model, TS-Q19YNZE1, White",LG 1.5 Ton 5 Star DUAL Inverter Split AC
40,Noise,"My ac Noise is high,,i observed some LG ac's they are not giving noise,,","Feb, 2024",3,"Copper, AI Convertible 6-in-1 Cooling, 4 Way Air Swing, HD Filter with Anti-Virus Protection, 2024 Model, TS-Q19YNZE1, White",LG 1.5 Ton 5 Star DUAL Inverter Split AC
