,title,text,transformed_date,star,product_num,hp_data
230,indoor unit is to small like 1 ton,"I have order 1.5 ton AC but Indoor unit is to small like 1 ton AC and also not provided ac remote holderâ€¦.
Installation charge is so high 1400 (installation charge) 850 ( outdoor stand) 200 extra for hole in wallâ€¦ and engineer did not provide the wiring connectionâ€¦","Jun, 2024",2,"Copper, AI Convertible 6-in-1 Cooling, 2 Way Swing, HD Filter with Anti-Virus Protection, 2024 Model, TS-Q18JNXE3, White",LG 1.5 Ton 3 Star DUAL Inverter Split AC
231,Worth the money... Read through.,"2months of usage... 1.5ton 3star.
a). Super silent operation.
b). Cools room of 150Sq. Ft. in 10mins
c). The air within the room feels fresh. Subjective assessment.","Apr, 2024",3,"Copper, AI Convertible 6-in-1 Cooling, 2 Way Swing, HD Filter with Anti-Virus Protection, 2024 Model, TS-Q18JNXE3, White",LG 1.5 Ton 3 Star DUAL Inverter Split AC
232,no light in remote. Neither programable .,no light in remote. Neither programable .,"Jul, 2024",2,"Copper, AI Convertible 6-in-1 Cooling, 2 Way Swing, HD Filter with Anti-Virus Protection, 2024 Model, TS-Q18JNXE3, White",LG 1.5 Ton 3 Star DUAL Inverter Split AC
233,AI mode is not displaying,When we click on the modes AI mode is not visible and there is no AI mode,"Apr, 2024",3,"Copper, AI Convertible 6-in-1 Cooling, 2 Way Swing, HD Filter with Anti-Virus Protection, 2024 Model, TS-Q18JNXE3, White",LG 1.5 Ton 3 Star DUAL Inverter Split AC
234,Remote and cooling,Remot dislike.night time operating not now.and swing position limit is hight,"Apr, 2024",3,"Copper, AI Convertible 6-in-1 Cooling, 2 Way Swing, HD Filter with Anti-Virus Protection, 2024 Model, TS-Q18JNXE3, White",LG 1.5 Ton 3 Star DUAL Inverter Split AC
235,Issues with my two LG branded AC purchased recently.,"From my experience I would suggest not to go for LG barnded ACs. One month back I bought LG 1.5 Ton 3 . Star AI DUAL Inverter Split AC. After 5 days of delivery engineer came and installed and gave demo and left, after 30min from the indoor unti water started dropping even though it was cooling the room. I called the same engineer he did not come so next day I raised one complain. The service negineer came and said sir chassis need to be changed which may take 2-3days based on availability of equipment. After lots of followup after 11days they they came with chassis and checked again and said sir its not chassis rather cooling compartment needed to chang. Again i waited for around 12days. Every time I call customer care they will say we will send a esclation mail, at last they gave one number and asked me to speak. That person is saying sir PO has been raised material has to reach. In the mean while now AC is not cooling anymore. By the time I am writing this I am still waiting to get this repaired.
Just to add on in month Jan 2023 I bought another LG 5 star dual inverter AC as well for my other house, but that was offline. That was installed by LG engineer but after around 40days of installation it stopped cooling. When I raised complain the engineer came and did high level inspection and told while installation they might have done something wrong. After 2days again they came and checked by opening and said no sir installation is ok but gas is not there when I asked if installation is OK then how gas leak happened he said some story like sir it is very hot and humid outsied sometimes it happens. I was really surprised to here.
So out of these two LG AC experience I would suggest better go for other better brand though I can not suggest which brand as I am not an expert.
But one suggestion if you are purchasing LG brand then do installation by their engineer else they will put all problem on those guys and deny for providing free solution within the warranty period.","May, 2023",1,"Copper, AI Convertible 6-in-1 Cooling, 2 Way Swing, HD Filter with Anti-Virus Protection, 2024 Model, TS-Q18JNXE3, White",LG 1.5 Ton 3 Star DUAL Inverter Split AC
236,Bad installation experience,"The technicians of LG were not trained they were newbies and did a poor job of installation. Left extra wire hanging. Did not clarify at the start about the quotation, misguided so that extra copper pipes are needed, extra wire and outlet pipes etc. after drilling holes and hanging the inlet machine they said we need more pipe. My balcony has sufficient space so for the default pipe to suffice. They want to increase the bill and exploit peopleâ€¦ I wouldnâ€™t recommend it due to bad service.","Apr, 2024",2,"Copper, AI Convertible 6-in-1 Cooling, 2 Way Swing, HD Filter with Anti-Virus Protection, 2024 Model, TS-Q18JNXE3, White",LG 1.5 Ton 3 Star DUAL Inverter Split AC
237,Donâ€™t bare to buy this product If I have negative rating I can give - 10 this product,"Cooling capacity is very very poor

I have set the temperature as 19 , still cooling is not up to mark, itâ€™s better outside cooling outside of the room.

Worst customer support. No one is responding after the installation done.

Please donâ€™t choose LG Ac in onlineðŸ˜Ÿ.

If I have negative rating I can give - 10 this product

I felts like i did a big mistake","Aug, 2024",1,"Copper, AI Convertible 6-in-1 Cooling, 2 Way Swing, HD Filter with Anti-Virus Protection, 2024 Model, TS-Q18JNXE3, White",LG 1.5 Ton 3 Star DUAL Inverter Split AC
238,Suitable for 120sqf room size,Low cooling capacity,"Apr, 2024",3,"Copper, AI Convertible 6-in-1 Cooling, 2 Way Swing, HD Filter with Anti-Virus Protection, 2024 Model, TS-Q18JNXE3, White",LG 1.5 Ton 3 Star DUAL Inverter Split AC
239,Part broken,I have received LG AC and when technician came for installation he found that compresser part was broken. How could i get this part replaced.,"Mar, 2024",3,"Copper, AI Convertible 6-in-1 Cooling, 2 Way Swing, HD Filter with Anti-Virus Protection, 2024 Model, TS-Q18JNXE3, White",LG 1.5 Ton 3 Star DUAL Inverter Split AC
240,Nice,Play Video,"Apr, 2024",3,"Copper, AI Convertible 6-in-1 Cooling, 2 Way Swing, HD Filter with Anti-Virus Protection, 2024 Model, TS-Q18JNXE3, White",LG 1.5 Ton 3 Star DUAL Inverter Split AC
241,Worst model.,"Brand has a good value.
This particular model is worst and don't buy. Not getting cool and i have tried all the ways to resolve this issue but it's dummy piece. Need to throw it and buy a different model. Don't waste money and it really disturbs us.","Aug, 2024",1,"Copper, AI Convertible 6-in-1 Cooling, 2 Way Swing, HD Filter with Anti-Virus Protection, 2024 Model, TS-Q18JNXE3, White",LG 1.5 Ton 3 Star DUAL Inverter Split AC
242,Extremely high installation add on charges and ac cooling is not satisfactory at all.,Itâ€™s not a 1.5 ton ac in any scenario. Just has 4400 W capacity whereas papasonic and daikin have more than 5000W for the same price.Doesnâ€™t cool well even with Virat mode on. One good thing was installation experience with LG except for exorbitant charges.,"May, 2024",2,"Copper, AI Convertible 6-in-1 Cooling, 2 Way Swing, HD Filter with Anti-Virus Protection, 2024 Model, TS-Q18JNXE3, White",LG 1.5 Ton 3 Star DUAL Inverter Split AC
243,Worst Purchase of life,"I received a product that was not working, i.e. ODU making huge noise and cooling issues.

Amazon never supported a 10-day exchange just a headline.

Now LG, I bought a product which is more expensive than its peers, just for the sake of service, LG also denied replacement, and took around 10 days, that too when I wrote to the CEO's office LG, for 10 days, from the guy who installed to the last visit, they were just trying to convince me that AC is fine,
i had to call, write, and attend multiple calls daily to get work done.

However, finally, they opened ODU and fixed it, I ended up getting a faulty product that can stop working anytime, despite paying the best.

I will give up my prime subscription, As Amazon's policies are not worth at all.","Jun, 2024",1,"Copper, AI Convertible 6-in-1 Cooling, 2 Way Swing, HD Filter with Anti-Virus Protection, 2024 Model, TS-Q18JNXE3, White",LG 1.5 Ton 3 Star DUAL Inverter Split AC
244,No feeling of AC Cooling like other AC and Too much installation charges without standard rate card,"I have ordered AC on last week and installed yesterday and observed:
1. No cooling effect of LG AC.. very bad cooling
So not recommended to purchase this AC
2. Too much charges for installation without showing standard rate card and applied other charge

A. Installation charge: 1299+GST = 1416rs
B. Extra 5 feet Copper pipe : = 1875 rs
C. Drain Pipe plastic 4 metre. = 424 rs
D. Cable 5 feet. = 365 rs
E. Wrapping tape. = 400 rs

But actual cost of material in shop
B: Copper pipe 170 rs / feet = 850 rs
C. Drain pipe. 25 rs / feet = 125 rs
D. Cable. 20 rs / feet. = 100 rs

So be alert and better way to arrange your own material from hardware shop instead of taking from AC installation team.","Jun, 2024",1,"Copper, AI Convertible 6-in-1 Cooling, 2 Way Swing, HD Filter with Anti-Virus Protection, 2024 Model, TS-Q18JNXE3, White",LG 1.5 Ton 3 Star DUAL Inverter Split AC
245,Outdoor unit noise is quite high,My brother uses LG AC similar one. I ordered after checking it. The one i use at my home outdoor unit sound is quite high. From inside room i can hear fan speed rotation like a flight.,"Aug, 2024",1,"Copper, AI Convertible 6-in-1 Cooling, 2 Way Swing, HD Filter with Anti-Virus Protection, 2024 Model, TS-Q18JNXE3, White",LG 1.5 Ton 3 Star DUAL Inverter Split AC
246,"Dont buy, None of the features are working as mentioned","No horizontal swing, but feature mentioned on description
No Virat or diet mode - only HC same as old model
Installation charges 2400 - 1415 charges + 750 compressor stand + 250 drain pipe

No return or replacement policy

No explanation by service provider","Apr, 2024",2,"Copper, AI Convertible 6-in-1 Cooling, 2 Way Swing, HD Filter with Anti-Virus Protection, 2024 Model, TS-Q18JNXE3, White",LG 1.5 Ton 3 Star DUAL Inverter Split AC
247,Cooling not that great,"My room is not very big but this AC doesn't cool it much. It's new. I just bought it a month back. It feels an old ac with a new body.
For cooling purpose LG or this AC model is not great","Apr, 2024",2,"Copper, AI Convertible 6-in-1 Cooling, 2 Way Swing, HD Filter with Anti-Virus Protection, 2024 Model, TS-Q18JNXE3, White",LG 1.5 Ton 3 Star DUAL Inverter Split AC
248,Installation is the key factor!,"These we're the steps that LG says to be provides as per their website !
1.Enjoy the benefits of LG's Skilled Engineers talking care of your product
2.No Vibration,minimized sound level,No Gas leakage in long term
3.Performing proper vacum for faster cooling & better performance
4.Better look,proper laying of insulation to connecting tubes
5.Vinyl tapping on piping
6.Hole properly closed with White cement / POP - No Insect entry / rat bite

What they have done is
1. Vaccum was not done
2.holes were not sealed
3.taping was not proper.
4. Rubber bushes were not placed between the outdoor unit and ac stand which I bought from them. (Rubber bushes are sleeping on my drawer - may be it's not needed but why should company provides that)

As far as AC is concerned please go for who is providing proper installation as the quality and performance relies on installtion quality only.
Brand and it's cost nothing to do with the cooling and mostly all brands are same.

Cheers","May, 2024",1,"Copper, AI Convertible 6-in-1 Cooling, 2 Way Swing, HD Filter with Anti-Virus Protection, 2024 Model, TS-Q18JNXE3, White",LG 1.5 Ton 3 Star DUAL Inverter Split AC
249,Cooling is not good,Cooling is not good. Also i am using other brand ac far better than from it. High cooling also giving normal cooling. If possible refund option immediately I return it.,"May, 2024",2,"Copper, AI Convertible 6-in-1 Cooling, 2 Way Swing, HD Filter with Anti-Virus Protection, 2024 Model, TS-Q18JNXE3, White",LG 1.5 Ton 3 Star DUAL Inverter Split AC
250,installation was rejected by LG in uppal Hyderabad,"be careful when purchasing LG product, installation was denied by LG in Hyderabad location after the product arrived.
Had to escalate several times to get call back from Lg .","May, 2024",2,"Copper, AI Convertible 6-in-1 Cooling, 2 Way Swing, HD Filter with Anti-Virus Protection, 2024 Model, TS-Q18JNXE3, White",LG 1.5 Ton 3 Star DUAL Inverter Split AC
251,Cooling is very poor after 2 months of use,The AC is not capable of cooling in the hot summer season now. I have one more LG AC which is still working fine but this product seems inferior. I'll contact the LG customer service now and hope they fix it without any cost since it's just 2 months old.,"Apr, 2024",2,"Copper, AI Convertible 6-in-1 Cooling, 2 Way Swing, HD Filter with Anti-Virus Protection, 2024 Model, TS-Q18JNXE3, White",LG 1.5 Ton 3 Star DUAL Inverter Split AC
252,"Please do not make the same mistake as I did, this is a tinbox in name of AC","No cooling, worst customer experience, bad product, words can not describe how sad I am to put my hard earned income into this AC, which I never ever got any satisfaction after using it. Totally not a value for money.

I am not sure, why Amazon is hosting products like this and vendors who cheat customers. I am so regretful about this.

First Amazon forgets to ship the essential part of this AC, which is also tagged to be shipped together with this, the 4 mm copper pipe, and when installation team came for setting up the AC, they charged me extra for that pipe, when I called Amazon, they declined to give any support or send the missing components, they gave me a terrible gift voucher, which I never redeemed.

When I call Amazon customer care, they ask to call product care, when I call LG service center they ask to call local repair, when the local repairer comes they do not pay attention to solving the problem, and leave. And then the cycle repeats.

Now, the AC is completely broken, I have had more than six services and two repair sessions on this from LG repairers, but the problem persists.

If anyone reads this, please do not buy this product its a waste of money. Also, do not make the mistake of trusting this Vendor.

@Amazon if you are reading this, this is not called customer experience trying to cater to the world, when you can not even solve people's AC problems, purchased through you.","Nov, 2023",1,"Copper, AI Convertible 6-in-1 Cooling, 2 Way Swing, HD Filter with Anti-Virus Protection, 2024 Model, TS-Q18JNXE3, White",LG 1.5 Ton 3 Star DUAL Inverter Split AC
253,Worst AC in 1.5Ton,"I have purchased this AC on 20 May 2024. From the first day cooling is very poor. Even at the lowest temperature at 16Â°C my room temperature is showing 32Â°C. I have been filing complain, wanting to get service but nobody is giving any response from the last 3-4 days, they told we will visit and still nobody is coming.. I think it is .25ton AC which they are selling as 1.5Ton AC. I urge everyone not use buy this LG AC. instead go for DAIKIN, CARRIER, MITSUBISHI, BLUE STAR and if you have budget then O General","Jun, 2024",1,"Copper, AI Convertible 6-in-1 Cooling, 2 Way Swing, HD Filter with Anti-Virus Protection, 2024 Model, TS-Q18JNXE3, White",LG 1.5 Ton 3 Star DUAL Inverter Split AC
254,Performance Issue,"Iâ€™ve been using this LG air conditioner for three months now, and I regret to say itâ€™s a complete disappointment. I usually trust LG products for their quality and service, but this one is a failure for the company. Despite my room being standard-sized, this AC fails to cool it effectively, unlike other brands Iâ€™ve used. Furthermore, it doesnâ€™t save on energy bills as promised. I deeply regret buying this unit and would not recommend it to anyone. Save your money and look for a more reliable and efficient brand.","Jun, 2024",1,"Copper, AI Convertible 6-in-1 Cooling, 2 Way Swing, HD Filter with Anti-Virus Protection, 2024 Model, TS-Q18JNXE3, White",LG 1.5 Ton 3 Star DUAL Inverter Split AC
255,Compressor was making sound,"The compressor was making sound so the installs personal had to open it up and fix the fan. Canâ€™t believe had to tamper the compressor on the first day.

Itâ€™s working fine now. But would be better to QC it as well.","Mar, 2024",2,"Copper, AI Convertible 6-in-1 Cooling, 2 Way Swing, HD Filter with Anti-Virus Protection, 2024 Model, TS-Q18JNXE3, White",LG 1.5 Ton 3 Star DUAL Inverter Split AC
256,Weast of money,"AC at 22 not cool room ,low budget ac have better quality than this.","May, 2024",2,"Copper, AI Convertible 6-in-1 Cooling, 2 Way Swing, HD Filter with Anti-Virus Protection, 2024 Model, TS-Q18JNXE3, White",LG 1.5 Ton 3 Star DUAL Inverter Split AC
257,The pannel is broken,The front pannel is broken and the filter is broken,"May, 2024",2,"Copper, AI Convertible 6-in-1 Cooling, 2 Way Swing, HD Filter with Anti-Virus Protection, 2024 Model, TS-Q18JNXE3, White",LG 1.5 Ton 3 Star DUAL Inverter Split AC
258,Beaware .. this is a compact version ac which cost less,This is compact version which is of less price at showroom as well . Dont fall into the trap.,"Aug, 2024",1,"Copper, AI Convertible 6-in-1 Cooling, 2 Way Swing, HD Filter with Anti-Virus Protection, 2024 Model, TS-Q18JNXE3, White",LG 1.5 Ton 3 Star DUAL Inverter Split AC
259,Worst service from LG team,"I have ordered LG split ac , order delivered in very next day, fast delivery I appreciate that, but after delivery i need to make call for brand installation and demo, after severl days of calling and chatting with brand and amazon customer care servie agents the product was installed after 5 dayz only, the response from lg team was very bad and the response from amazon cc was not upto the mark, there was no proper solution for demo and installation from amazon end, they just told me to contact brand and they given the contact number, so i will recommend those who wish to fast installation of ac dont go for online go for any near by showroom.","May, 2024",1,"Copper, AI Convertible 6-in-1 Cooling, 2 Way Swing, HD Filter with Anti-Virus Protection, 2024 Model, TS-Q18JNXE3, White",LG 1.5 Ton 3 Star DUAL Inverter Split AC
260,Stay away from this buyer,45 Days and It started making noices. Not cooling properly.,"May, 2024",2,"Copper, AI Convertible 6-in-1 Cooling, 2 Way Swing, HD Filter with Anti-Virus Protection, 2024 Model, TS-Q18JNXE3, White",LG 1.5 Ton 3 Star DUAL Inverter Split AC
261,Poor,"After using it for one year, what I found the quality is pathetic. No cooling at all. Even after multiple complaints they come and just clean it but still all in vain.","Jul, 2024",1,"Copper, AI Convertible 6-in-1 Cooling, 2 Way Swing, HD Filter with Anti-Virus Protection, 2024 Model, TS-Q18JNXE3, White",LG 1.5 Ton 3 Star DUAL Inverter Split AC
262,Very poor product,"I have never seen such a bad AC in my life. In the name of cooling, I wasted Rs. 37 thousand of my hard work in the name of LG AC.","Aug, 2024",1,"Copper, AI Convertible 6-in-1 Cooling, 2 Way Swing, HD Filter with Anti-Virus Protection, 2024 Model, TS-Q18JNXE3, White",LG 1.5 Ton 3 Star DUAL Inverter Split AC
263,Just waste of money - Review after 2 months,"In March 2024, I purchased the LG Dual Inverter Air Conditioner, and I would say it's a complete disappointment for the following reasons:

a. Disastrous Cooling Performance: It doesn't cool the room effectively during hot days. With rising temperatures, this air conditioner just doesn't suit the climate.
b. Poor Customer service: Absolutely disappointing. They donâ€™t acknowledge that it's not working, just make minor adjustments, and never follow up.
c. High Energy Bills: Does it even save on the electricity bill? Come on, LG teamâ€”this product is a total failure.

In short, this product is not worth a penny, and I do not recommend it. In fact, Amazon should remove it from the listings.","May, 2024",1,"Copper, AI Convertible 6-in-1 Cooling, 2 Way Swing, HD Filter with Anti-Virus Protection, 2024 Model, TS-Q18JNXE3, White",LG 1.5 Ton 3 Star DUAL Inverter Split AC
264,Defective product and very poor installation,"Ac starts to leak water from inside unit within first instant of usage, ac installation mechanic is trained well, even he dont know how to install, he his calling some else for guidance, dont go this ac guys, Lg need to work in their customer service as well as quality of the product","Mar, 2024",2,"Copper, AI Convertible 6-in-1 Cooling, 2 Way Swing, HD Filter with Anti-Virus Protection, 2024 Model, TS-Q18JNXE3, White",LG 1.5 Ton 3 Star DUAL Inverter Split AC
265,Very bad product &LG Service are also very cheap,"I buy lg ac before 2 months ago
And ac not cooling automatically down cooling
And service centre also not giving any solutions
I suggested donâ€™t buy LG products","Jul, 2024",1,"Copper, AI Convertible 6-in-1 Cooling, 2 Way Swing, HD Filter with Anti-Virus Protection, 2024 Model, TS-Q18JNXE3, White",LG 1.5 Ton 3 Star DUAL Inverter Split AC
266,Authorised service installation person cut copper pipe and do welding,"Lg authorised person deputed by lg after delivery of ac cut copper pipe without asking and do welding. On asking told me that threads are not proper to joint loose copper pipes supplied with its unit to connect outdoor unit. I asked Amazon to return or replace unit after above, they popup message that ac is out of stock... What a miserable support from Amazon as I am still eligible for replacement till ten june but nobody replacing this. Don't recommend to purchase from amazon","Jun, 2024",1,"Copper, AI Convertible 6-in-1 Cooling, 2 Way Swing, HD Filter with Anti-Virus Protection, 2024 Model, TS-Q18JNXE3, White",LG 1.5 Ton 3 Star DUAL Inverter Split AC
267,Not satisfied,"I bought it 2months ago and it was delivered and installed like super fast.
If I talk about cooling itâ€™s not effective at all. You can run it all night long on Virat mode and the temperature if the room (10x12x10) drops just 2degrees.

Also, the indoor unit seems like itâ€™s 1ton as it is shorter than the normal 1.5tons indoor units. I clarified with service people who installed it but they said itâ€™s not written in the unit and they installed.

Itâ€™s waste of money for me.","May, 2024",1,"Copper, AI Convertible 6-in-1 Cooling, 2 Way Swing, HD Filter with Anti-Virus Protection, 2024 Model, TS-Q18JNXE3, White",LG 1.5 Ton 3 Star DUAL Inverter Split AC
268,LG selling lies. But Amazon is simply awesome.,"Choosing the right capacity is most crucial when buying an air conditioner. But these brands cheat you with their deceptive marketing.

Shame.

This unit is rated at 4400 wats (1.25 Tons) and LG is shamelessly selling this as 1.5 Ton.

Also you get a smart wifi enabled AC at this price point.

The star here is for amazon. Buying on amazon is such a peace of mind. The product was delivered to me and then after reading the specs on the box i decided that this ac will be insufficient for my room.

I requested amazon for a return. They processed the return and refund smoothly.

Three Cheers for Amazon. Such customer service makes Amazon my first choice of buying anything. From small accessories to big purchases.

Amazon 5 Star. LG 0 Star","Apr, 2024",1,"Copper, AI Convertible 6-in-1 Cooling, 2 Way Swing, HD Filter with Anti-Virus Protection, 2024 Model, TS-Q18JNXE3, White",LG 1.5 Ton 3 Star DUAL Inverter Split AC
269,Cooling reduced after one month,"After using it for one month the cooling system got reduced. I am writing about an AC from a LG company, it seems to be a good brand but I did not know that it is not good from the manufacturer AC. The cooling system stopped working within one month, after checking the service team said that it is ok. Our company has ACs of other brands which give good cooling. Now I have bought an AC. we do nothing ,only complain","Jun, 2024",1,"Copper, AI Convertible 6-in-1 Cooling, 2 Way Swing, HD Filter with Anti-Virus Protection, 2024 Model, TS-Q18JNXE3, White",LG 1.5 Ton 3 Star DUAL Inverter Split AC
270,Dont buy,"Seller is cheating by inflating the price. The price of this model as on box is 51k while seller is mentioning 78k.
This is 1.2 ton AC and not 1.5 ton. This very small in the compared to other brands at 37.5K
Also during delivery , the copper wires and nuts were missing, which costed another 3.6K which should come as part of the LG package. Technician mentioned delivery people carefully remove the copper wire and without hampering the box
Most disgusting experience","May, 2024",1,"Copper, AI Convertible 6-in-1 Cooling, 2 Way Swing, HD Filter with Anti-Virus Protection, 2024 Model, TS-Q18JNXE3, White",LG 1.5 Ton 3 Star DUAL Inverter Split AC
271,"AC of no use at all, never buy LG AC, you will be definitely disappointed","LG has failed to produce a minimum basic feature product. In the current competition world, LG like company is producing a product that is of no use.

1. We ordered this 1.5 ton AC because of room size(10X12). Its a very tiny one that produces big noise, I am thinking like I brought a tower fan

2. As this AC is very small size, it is fitted in some part of the room, actual problem starts from here. It doesn't have horizontal swing.

3. Worst design for indoor unit and its air flow, air flows only upwards

4. Remote has lot of buttons with no background light, while you are sleeping and want to change the something then you can't as you need to switch on the light and that will disturb everyone.

Overall, worst design from LG.","Apr, 2024",1,"Copper, AI Convertible 6-in-1 Cooling, 2 Way Swing, HD Filter with Anti-Virus Protection, 2024 Model, TS-Q18JNXE3, White",LG 1.5 Ton 3 Star DUAL Inverter Split AC
