,title,text,transformed_date,star,product_num,hp_data
353,AC indoor unit is producing some odd smell,Indoor unit delivering some odd small and no effective cooling. It takes very long time to bring down by 1 unit.,"Apr, 2024",2,"Copper, AI Convertible 6-in-1 Cooling, 4 Way Swing, HD Filter with Anti-Virus Protection, 2024 Model, TS-Q13JNYE, White",LG 1 Ton 4 Star DUAL Inverter Split AC
354,Not satisfied,"I purchased this air conditioner one month ago, but I am not satisfied with its performance. It is not cooling properly, and I have raised a service request. However, after 24 hours, the technician has not communicated with me. When I try to call him, his phone is temporarily out of service. I do not recommend this product. If you are planning to buy a split AC, please consider other brands such as Voltas or Blue Star. The quality of LG products and their service has declined, so I advise against purchasing an LG air conditioner.","May, 2024",1,"Copper, AI Convertible 6-in-1 Cooling, 4 Way Swing, HD Filter with Anti-Virus Protection, 2024 Model, TS-Q13JNYE, White",LG 1 Ton 4 Star DUAL Inverter Split AC
355,Defective product received,"I am using LG 5 star 1 ton AC from 2008 , which is running smoothly even after 16 years. Purchased one LG 5 star 1 ton dual inverter AC 2024 model on 7th May and got installed the same after 5 days.
Unfortunately the temperature and sleep time can not be set , which is a major defect for an AC . Will someone kindly advise me how to use an AC without setting the temperature level ?
I don't have any option but to throw it away as the company has taken long time in accepting that the indoor unt is defective and taking proper action.","Jun, 2024",1,"Copper, AI Convertible 6-in-1 Cooling, 4 Way Swing, HD Filter with Anti-Virus Protection, 2024 Model, TS-Q13JNYE, White",LG 1 Ton 4 Star DUAL Inverter Split AC
356,Bad service,The product seemed faulty from day1 and now it hasany cooling issues. Completely brand new AC and still not able to cool properly. The LG service is extremely poor. They are not able to send a person in 1 week to fix an issue. Only because the AC is under warranty and they have to fix it for free. Else they would have sent someone in few hours. Very bad experience with LG. I will not but any LG products going forward,"Jun, 2024",1,"Copper, AI Convertible 6-in-1 Cooling, 4 Way Swing, HD Filter with Anti-Virus Protection, 2024 Model, TS-Q13JNYE, White",LG 1 Ton 4 Star DUAL Inverter Split AC
357,Water leakage issue,I had ordered an AC and there is heavy water leakage from the AC and Outlet as well. I gave my whole day and the installation is also done improperly and many pipes are left opened.,"Jul, 2024",1,"Copper, AI Convertible 6-in-1 Cooling, 4 Way Swing, HD Filter with Anti-Virus Protection, 2024 Model, TS-Q13JNYE, White",LG 1 Ton 4 Star DUAL Inverter Split AC
358,"LG sent untrained abusive guys to install, wall destroyed","Update on 12th March: Totally pathetic installation experience, it was fulfilled by authorized LG service center with the name SAS AIR CONDITIONING. I was told that wall near balcony cannot be drilled and they put the pipes through the balcony door. The door cannot be closed now, and later we came to know that the wall can be drilled and there is no beam on it. These boys just want to complete the job and leave, and are least bothered about customer satisfaction. In the video, you can see that the other wall was completely destroyed by drilling and also there is an offset from the wall which makes it even more worse. What's more pathetic is that the boys were abusive all the time during installation and used cursing words about me on the phone, as he my ac installation was not as he expected it to be. I have raised complaint to LG customer care and yet to get a resolution.","Mar, 2024",1,"Copper, AI Convertible 6-in-1 Cooling, 4 Way Swing, HD Filter with Anti-Virus Protection, 2024 Model, TS-Q13JNYE, White",LG 1 Ton 4 Star DUAL Inverter Split AC
359,Poor,It give heavy light bill no use of 5 star waste of money,"Jul, 2024",1,"Copper, AI Convertible 6-in-1 Cooling, 4 Way Swing, HD Filter with Anti-Virus Protection, 2024 Model, TS-Q13JNYE, White",LG 1 Ton 4 Star DUAL Inverter Split AC
360,Installation,"Worse experience of installation of my AC by Suhana Service. My installation request was assigned to Suhana Service and installation was supposed to be completed after 72hrs of delivery as per policy. Almost 7 days passed and didn't receive any call from technician or service provider. I lodged multiple complaints to LG and also through Amazon but didn't workout. Tried to call to Service Provider by number which I got from LG customer care many a times but no one picked or called back.

My personal experience if installation request is assigned to Suhana Service immediately call LG customer care to change request to some other service provider.

Suggestion to LG immediately blacklist Suhana Service from your account to avoid such experience.","May, 2024",1,"Copper, AI Convertible 6-in-1 Cooling, 4 Way Swing, HD Filter with Anti-Virus Protection, 2024 Model, TS-Q13JNYE, White",LG 1 Ton 4 Star DUAL Inverter Split AC
361,It's an average ac but bit expensive,"Honest review after 1 month usage
1) AC is average and expensive to comparing to other 1 ton ACs
2) I don't see any AI option in remote
3) it not energy efficient
4) cooling is average
5) installation by lg is not good they charge extra then mrp
Overall I don't recommend this lg ac. It's not worth.","May, 2023",3,"Copper, AI Convertible 6-in-1 Cooling, 4 Way Swing, HD Filter with Anti-Virus Protection, 2024 Model, TS-Q13JNYE, White",LG 1 Ton 4 Star DUAL Inverter Split AC
362,Just one week old ac,"After usage of one week I am facing water leakage and no cooling, in this summer I spend around 40k and even after I am suffering from heat. The response got after registering a complaint is
"" ""During visit, engineer will confirm 'Warranty' after referring product Bill / AMC Invoice /Serial Number.

*In warranty*- No service charges will be applicable(Except Physical damage).
*In case of jet pump service, Extra charges will be Applicable*

*Out of Warranty* - Service charges will be Rs. 708* [ Including GST ] + Part charges if required. In case service is not availed - Visiting/Inspection charges will be Rs. 472
*In case of jet pump service, Extra charges will be Applicable*""","Apr, 2024",1,"Copper, AI Convertible 6-in-1 Cooling, 4 Way Swing, HD Filter with Anti-Virus Protection, 2024 Model, TS-Q13JNYE, White",LG 1 Ton 4 Star DUAL Inverter Split AC
363,Worth it on price,"AC is perfect for small size room , installation is also perfect however there is confusion where I felt cheated from Amazon on installation charges where they previously showing its added while purchasing and later brand will charge for it.
Rest AC is perfect features are also great and best thing is it's completely silent rest will see after couple of months","Apr, 2023",3,"Copper, AI Convertible 6-in-1 Cooling, 4 Way Swing, HD Filter with Anti-Virus Protection, 2024 Model, TS-Q13JNYE, White",LG 1 Ton 4 Star DUAL Inverter Split AC
364,Service is good. But some of the vital parts are missing,"There is no plug in the package. The length of the drain pipe is around 1feet which is very less.
Remote holder also not provided within package.","Sep, 2023",3,"Copper, AI Convertible 6-in-1 Cooling, 4 Way Swing, HD Filter with Anti-Virus Protection, 2024 Model, TS-Q13JNYE, White",LG 1 Ton 4 Star DUAL Inverter Split AC
365,Good product..but,"Please note that after buying there are installation charges which cost around 4-5k.
In box 10ft copper pipe was missing which cost around 300 per feet.
You need to raise complaint for that but they will refund very less amount compared to actual cost.","Jul, 2023",3,"Copper, AI Convertible 6-in-1 Cooling, 4 Way Swing, HD Filter with Anti-Virus Protection, 2024 Model, TS-Q13JNYE, White",LG 1 Ton 4 Star DUAL Inverter Split AC
366,Worst customer service,"Waise toh mai kabhi koi review dalti nhi hu lekin isbaar mujhe dalna padrha hai kyu ke LG ki service bohat jyada kharab hai... Maine ac order Kiya tha or 20 april ko recieve hua tha uske baad installation ke liye koi nhi aarha tha itna call karne ke baad bhi koi support nhi tha kam se kam 50_60 call ki thi mai roz bolte the kal ayenge lekin nhi aate the pure 15 din baad ek Banda aaya tha installation ke liye
Mai toh yahi bolungi koi or brand ka AC lelo lekin LG ka kabhi koi product nhi Lena bohat bekar customer service hai","Apr, 2024",1,"Copper, AI Convertible 6-in-1 Cooling, 4 Way Swing, HD Filter with Anti-Virus Protection, 2024 Model, TS-Q13JNYE, White",LG 1 Ton 4 Star DUAL Inverter Split AC
367,Not good cooling,Not able to cool small room in summer heat not able to bring temp below 30,"Apr, 2024",2,"Copper, AI Convertible 6-in-1 Cooling, 4 Way Swing, HD Filter with Anti-Virus Protection, 2024 Model, TS-Q13JNYE, White",LG 1 Ton 4 Star DUAL Inverter Split AC
368,Pathetic Service from Brand,"Fast delivery as usual by Amazon. Product arrived in original brand package. Neat and clean handling by Amazon.

Installation service provided by LG is the worst ever. I had to raise multiple complaints via Amazon customer service for them to even schedule an installation. Installation was done on the 6th day after receiving product. LG customer care will try to mislead the customer saying that its the Amazon's responsibility to raise a request and customers can't. They did nothing until I raised a complaint through Amazon customer care. Installation is also not clean. They messed up the whole place and expect the customer to clean later.","Apr, 2024",1,"Copper, AI Convertible 6-in-1 Cooling, 4 Way Swing, HD Filter with Anti-Virus Protection, 2024 Model, TS-Q13JNYE, White",LG 1 Ton 4 Star DUAL Inverter Split AC
369,"Worst installation service, does not even have the bare minimum equipments.",The product is good but the installation service is pathetic. They did not seem to be well trained and they do not bring all the required equipments. They did not bring the round drill bit for drilling the wall and hence damaged my wall. They did not had the vacuum machine and was suggesting that it is not required. They also didn't do the basic electrical setup to get my ac running. Instead they just tested my ac with a 2.5mm wire and was refusing to test it for a longer period. I had to call another electrician to power my ac. I didn't expected this kind of service from LG.,"Mar, 2024",1,"Copper, AI Convertible 6-in-1 Cooling, 4 Way Swing, HD Filter with Anti-Virus Protection, 2024 Model, TS-Q13JNYE, White",LG 1 Ton 4 Star DUAL Inverter Split AC
370,CHEATED BY AMAZON,"There is no added installation, they didn't give all the necessary items required for installation, if you want them which obviously you want should purchase again at a higher rate. Installation included is a big joke. It's only booking for installation. Like book a movie ticket at zero rupees, but if you want to see the movie pay 300 rupees plus GST and additionally you have to get your own chair or buy a stupid chair from the theater owner at a higher cost. No value for money. No quality. Poor service. Worst performance.","May, 2024",1,"Copper, AI Convertible 6-in-1 Cooling, 4 Way Swing, HD Filter with Anti-Virus Protection, 2024 Model, TS-Q13JNYE, White",LG 1 Ton 4 Star DUAL Inverter Split AC
371,Pathetic product terrible service,"Just 1 month after purchase ac is not cooling making hell of noise and I am chasing service helpline and service center and nobody is responding, really feeling helpless. I would recommend anybody to not purchase this product. It's worst product.","Jun, 2024",1,"Copper, AI Convertible 6-in-1 Cooling, 4 Way Swing, HD Filter with Anti-Virus Protection, 2024 Model, TS-Q13JNYE, White",LG 1 Ton 4 Star DUAL Inverter Split AC
372,Extremely expensive service & not worth the money.,"Product arrived on time. Service guy arrived on time too. But took almost 6K in the name of installation (1415 for installation, 2000 for copper pipes, 130 rs for the plug, 650 for water pipe, 1100 for the stand, 350 for some insulation white wrap). They ended up drilling a very big hole and not filling it properly too. We had to spend time filling the area left by the service ppl. So in totality if someone is planning to buy this product go with the assumption that it will cost you almost 50K (MRP Says approx 40k.. you end up paying 6 to 7 k more) for mediocre service. Now all I am hoping is the product is not as mediocre as their service.","Apr, 2024",1,"Copper, AI Convertible 6-in-1 Cooling, 4 Way Swing, HD Filter with Anti-Virus Protection, 2024 Model, TS-Q13JNYE, White",LG 1 Ton 4 Star DUAL Inverter Split AC
373,Don't buy lg,"We bought 2 ac in past month
Worst installation we are depressed and un satisfied cooling also not perfect my son bought daikin it gives chill cooling. Compare to daikin lg is worst cooling performance","Jun, 2024",1,"Copper, AI Convertible 6-in-1 Cooling, 4 Way Swing, HD Filter with Anti-Virus Protection, 2024 Model, TS-Q13JNYE, White",LG 1 Ton 4 Star DUAL Inverter Split AC
374,"Nice AC, but the package didn't came with copper tube",AC looks and works fine. However inside the arrived package the 3m copper tube connecting inner and outer unit was missing.,"Mar, 2024",2,"Copper, AI Convertible 6-in-1 Cooling, 4 Way Swing, HD Filter with Anti-Virus Protection, 2024 Model, TS-Q13JNYE, White",LG 1 Ton 4 Star DUAL Inverter Split AC
375,The 3 pin plug is not given with the product,The delivery is incomplete,"Apr, 2024",2,"Copper, AI Convertible 6-in-1 Cooling, 4 Way Swing, HD Filter with Anti-Virus Protection, 2024 Model, TS-Q13JNYE, White",LG 1 Ton 4 Star DUAL Inverter Split AC
376,Worst Product... DON'T BUY,"Don't buy LG ACs, I purchased LG 4 star AC on MAR 23 because I belived in LG, I used only 2 months in that year, now I started to use, but no cooling, technician visited and informed me, we need to do gas top-up, it will cost 1200 to 3000, that we need to pay as one year warrany is over. There is no leakage problem, within one year we need to fill the Gas. Very cheap quality, means ever year we need to fill the GAS.. Don't BUY.
Note: When I connected with customer care and asked about their build quality, they cut my phone.","Apr, 2024",1,"Copper, AI Convertible 6-in-1 Cooling, 4 Way Swing, HD Filter with Anti-Virus Protection, 2024 Model, TS-Q13JNYE, White",LG 1 Ton 4 Star DUAL Inverter Split AC
377,No cooling,I don't know if it's a faulty product.. but no cooling... i bought 1 month back but every 3-4 days it stops cooling n I have to contact lg support,"Jun, 2024",1,"Copper, AI Convertible 6-in-1 Cooling, 4 Way Swing, HD Filter with Anti-Virus Protection, 2024 Model, TS-Q13JNYE, White",LG 1 Ton 4 Star DUAL Inverter Split AC
378,AC didn't operate,"On mounting it was found that AC is not cooling. Technician informed that it doesn't contain sufficient GAS.
RETURN instructions: Before sending pickup team, please send a person to uninstall and pack the faulty AC.
Also we cannot pay Installation Charges as the AC didn't work.","Jun, 2024",1,"Copper, AI Convertible 6-in-1 Cooling, 4 Way Swing, HD Filter with Anti-Virus Protection, 2024 Model, TS-Q13JNYE, White",LG 1 Ton 4 Star DUAL Inverter Split AC
379,Noisy product,"I bought same product last year, i was fully satisfied with the product. This year also I went ahead bought same this year also, but it is giving irritating high frequency noise. Quality dropped, why pay more now compared to others brand. Go with Indian brand.","Jun, 2024",1,"Copper, AI Convertible 6-in-1 Cooling, 4 Way Swing, HD Filter with Anti-Virus Protection, 2024 Model, TS-Q13JNYE, White",LG 1 Ton 4 Star DUAL Inverter Split AC
380,Value for money,This one is costly as compared to similar products available in the same category.,"Sep, 2023",3,"Copper, AI Convertible 6-in-1 Cooling, 4 Way Swing, HD Filter with Anti-Virus Protection, 2024 Model, TS-Q13JNYE, White",LG 1 Ton 4 Star DUAL Inverter Split AC
381,Very bad service,Ac is very good but service is soi bad,"Jul, 2024",1,"Copper, AI Convertible 6-in-1 Cooling, 4 Way Swing, HD Filter with Anti-Virus Protection, 2024 Model, TS-Q13JNYE, White",LG 1 Ton 4 Star DUAL Inverter Split AC
382,Worst installation service provided by authorized service engineer,"Authorized Service engineer (Not trained)
LG authorized service engineer is not installing AC according to installation manual. He skipped Vaccuming of copper pipe deliberately after telling. Vaccuming is very important it increases life and efficiency of AC. Either service engineer is not properly trained. Spending money on authorized service engineer not worth it.","May, 2024",1,"Copper, AI Convertible 6-in-1 Cooling, 4 Way Swing, HD Filter with Anti-Virus Protection, 2024 Model, TS-Q13JNYE, White",LG 1 Ton 4 Star DUAL Inverter Split AC
383,Not cooling as others ac,"After installation I felt it is not cooling properly and taking about an hour's for colling 8*10 room. While another brand ac in my other room is taking only 10 minutes . Technician says if it is draing water, it is ok","May, 2024",1,"Copper, AI Convertible 6-in-1 Cooling, 4 Way Swing, HD Filter with Anti-Virus Protection, 2024 Model, TS-Q13JNYE, White",LG 1 Ton 4 Star DUAL Inverter Split AC
384,Really bad,Really bad model .. ac has sweating problems and pathetic customer care .. there is manufacturing defects,"Jun, 2024",1,"Copper, AI Convertible 6-in-1 Cooling, 4 Way Swing, HD Filter with Anti-Virus Protection, 2024 Model, TS-Q13JNYE, White",LG 1 Ton 4 Star DUAL Inverter Split AC
385,Please dont buy from Amezon bad service.,"The service and the customer care experience from Amezon is so bad.Its all shows included but, its separatly hiddenly chargeble. So bad experience with customer care from amezon end.Shortly
,LG product is good but amezon experience is bad.","Jun, 2024",1,"Copper, AI Convertible 6-in-1 Cooling, 4 Way Swing, HD Filter with Anti-Virus Protection, 2024 Model, TS-Q13JNYE, White",LG 1 Ton 4 Star DUAL Inverter Split AC
386,Missing copper wire and Damaged outdoor unit cover,"The AC was delivered without the 3mtr copper wire for which we had to pay extra more than 3000 to the installation team.
The outdoor unit's cover was also damaged which was identified during the installation when all the packaging was already undone. So no option but to get installed using a quick patch.
LG doesn't provide any necessary equipment with the product for installation and you will have to pay extra for every small thing from wire to drain pipe.","Apr, 2024",1,"Copper, AI Convertible 6-in-1 Cooling, 4 Way Swing, HD Filter with Anti-Virus Protection, 2024 Model, TS-Q13JNYE, White",LG 1 Ton 4 Star DUAL Inverter Split AC
387,Don't waste your money worst AC,"I bought this LG 6 in 1 1 ton AC and it have a terrible issue, it's not cooling my room in 23 or 24 degrees always i have to set 16 to get cooling even it takes half an hour to cool the room. Worst AC i have ever experienced, even 2011 1 ton model lg AC is cooling much better than this 2024 model.

Not recommended, don't buy and wast your money","Apr, 2024",1,"Copper, AI Convertible 6-in-1 Cooling, 4 Way Swing, HD Filter with Anti-Virus Protection, 2024 Model, TS-Q13JNYE, White",LG 1 Ton 4 Star DUAL Inverter Split AC
388,Worst service,"Worst service for lg installation agent.
Delivered me ac by 3 day ago. He
Not receiving any call by me.
Top product by lg but but not supporting
By there service partner..
So sad..","May, 2024",1,"Copper, AI Convertible 6-in-1 Cooling, 4 Way Swing, HD Filter with Anti-Virus Protection, 2024 Model, TS-Q13JNYE, White",LG 1 Ton 4 Star DUAL Inverter Split AC
389,Ac cooling performance low,Cooling performance is very low. after running the AC for an hour. I need a technican to check the gas level and cooling performance.,"May, 2023",3,"Copper, AI Convertible 6-in-1 Cooling, 4 Way Swing, HD Filter with Anti-Virus Protection, 2024 Model, TS-Q13JNYE, White",LG 1 Ton 4 Star DUAL Inverter Split AC
390,Pathetic working,It stopped cooling within 2 months. LG is not even sending its technician for visit.,"Jun, 2024",1,"Copper, AI Convertible 6-in-1 Cooling, 4 Way Swing, HD Filter with Anti-Virus Protection, 2024 Model, TS-Q13JNYE, White",LG 1 Ton 4 Star DUAL Inverter Split AC
391,Low cooling,"Cooling is way low, even on 16 it doesn't get much cool. I have Diken ac which gets way more cooler on 22. Should have gone with Diaken only:(.

Installation was also not good, installation guy were unprofessional and rude. Standard installation charges are close to 3000 which is way more mentioned on Amazon, so its misleading.","Apr, 2024",1,"Copper, AI Convertible 6-in-1 Cooling, 4 Way Swing, HD Filter with Anti-Virus Protection, 2024 Model, TS-Q13JNYE, White",LG 1 Ton 4 Star DUAL Inverter Split AC
392,Delay in installation,Product LG AC delivered on 30 th April and after 5 days no one contacted for installation . I spoke to LG customer service which is equally rubish. They keep giving false promise. I will return the product tomorrow . Don't buy LG products as service and installation is pathetic.,"May, 2024",1,"Copper, AI Convertible 6-in-1 Cooling, 4 Way Swing, HD Filter with Anti-Virus Protection, 2024 Model, TS-Q13JNYE, White",LG 1 Ton 4 Star DUAL Inverter Split AC
393,The service is pathetic and installation done is bot proper,"Some local electrician in the name of LG installation team cane and didnt install it properly, the Ac is tilted not properly installed and leaking . Also they took installation amout 4.5k and canceled the service request saying they ll correct it tomorrow and now theyâ€™re not responding. I am not sure what kind of 3rd party is providing service here but this is not what expected from LG . Kindly get this corrected asap","Mar, 2024",1,"Copper, AI Convertible 6-in-1 Cooling, 4 Way Swing, HD Filter with Anti-Virus Protection, 2024 Model, TS-Q13JNYE, White",LG 1 Ton 4 Star DUAL Inverter Split AC
394,Cooling issue,In order to save electricity...LG forgot to put effiecient cooling,"Jul, 2024",1,"Copper, AI Convertible 6-in-1 Cooling, 4 Way Swing, HD Filter with Anti-Virus Protection, 2024 Model, TS-Q13JNYE, White",LG 1 Ton 4 Star DUAL Inverter Split AC
395,Defective product. Gas leakage. Not able to replace also,Donâ€™t buy from Amazon. Gas leakage from new AC which been identified by LG technician after installation. They asking for installation charge also. Huge loss.,"Jun, 2024",1,"Copper, AI Convertible 6-in-1 Cooling, 4 Way Swing, HD Filter with Anti-Virus Protection, 2024 Model, TS-Q13JNYE, White",LG 1 Ton 4 Star DUAL Inverter Split AC
396,Hidden conditions,This review is not about product but about LG company . If anyone who wants to buy LG split AC don't go if you don't have back to back installation for outdoor unit. LG company made a rule that lg installation services will be not provided if they have to use ropes for installation. So because of them we have to make big hole and all ac pipes awkwardly will be shown if you have concealed pipes in your house and did interior with lakhs . They will just say sorry . Safety is important but they have to tell to customer that we do not provide service when ropes are involved. This is cheating on their part not providing this information while selling their product and installation cannot be done with others as warranty will not be valid. If they can't do then we can choose another product who can do it.,"Nov, 2023",1,"Copper, AI Convertible 6-in-1 Cooling, 4 Way Swing, HD Filter with Anti-Virus Protection, 2024 Model, TS-Q13JNYE, White",LG 1 Ton 4 Star DUAL Inverter Split AC
397,"Not a good product, very disappointed.","Event at virat mode for an hour it fails to get the room temperature to 27 degrees.
Worst cooling experience in this hot summer.","Jun, 2024",1,"Copper, AI Convertible 6-in-1 Cooling, 4 Way Swing, HD Filter with Anti-Virus Protection, 2024 Model, TS-Q13JNYE, White",LG 1 Ton 4 Star DUAL Inverter Split AC
398,Ac is good... LG service pathetic,"Ac is really good and working fine. Using since last 11 months. Contacting LG service desk for ac service is a herculean task. They don't pick the call or even if they pick, they say the technician will call in 24 hours and they don't call. Their website for service registration is so complicated and page Design is so silly, it is nearly impossible to register a product or raise a service request. Needs lot of improvement team LG.","Apr, 2024",1,"Copper, AI Convertible 6-in-1 Cooling, 4 Way Swing, HD Filter with Anti-Virus Protection, 2024 Model, TS-Q13JNYE, White",LG 1 Ton 4 Star DUAL Inverter Split AC
399,Worst service from service centre,"Product is excellent but service centre don't do vaccuming during installation nor they do it during gas charging if needed. Irresponcive, inefficient, ineffective customer care and service centre service. Comprehensive warranty for name sake. No more LG product purchase in future.","May, 2024",1,"Copper, AI Convertible 6-in-1 Cooling, 4 Way Swing, HD Filter with Anti-Virus Protection, 2024 Model, TS-Q13JNYE, White",LG 1 Ton 4 Star DUAL Inverter Split AC
