,text,star,hp_data,city,transformed_date,product_num,state
628,"Worst product, Cooling issue from 2nd week, The 3rd party installation provided by flipkart is worst ,they don't even know to properly install it , no response while calling and lg team also not taking.
Totally hate the purchase.",1,"LG AI Convertible 6-in-1 Cooling 2024 Model 1.5 Ton 4 Star Split Dual Inverter Viraat Mode, Super Silent, HD Filter With Anti-Virus Protection AC With 4 Way Swing, Monsoon Comfort & ADC Sensor AC - White",Thoraipakkam,"Jun, 2024","TS-Q19JNYE, Copper Condenser",Thoraipakkam
629,"Worst ac I ever seen. After 10 days, colling process became pathetic. I have raised complaints but no solution so far. Don't buy these kind of products from Flipkart.",1,"LG AI Convertible 6-in-1 Cooling 2024 Model 1.5 Ton 4 Star Split Dual Inverter Viraat Mode, Super Silent, HD Filter With Anti-Virus Protection AC With 4 Way Swing, Monsoon Comfort & ADC Sensor AC - White",Giridih,"Jun, 2024","TS-Q19JNYE, Copper Condenser",Giridih
630,Indoor machine -no nitrogen gas,1,"LG AI Convertible 6-in-1 Cooling 2024 Model 1.5 Ton 4 Star Split Dual Inverter Viraat Mode, Super Silent, HD Filter With Anti-Virus Protection AC With 4 Way Swing, Monsoon Comfort & ADC Sensor AC - White",Chennai,"Jun, 2024","TS-Q19JNYE, Copper Condenser",Chennai
631,After Installation water leakage problem. Same problem still exists. Cooling takes more time than other Acs. Fan speed is very very very low even in 5th speed.,1,"LG AI Convertible 6-in-1 Cooling 2024 Model 1.5 Ton 4 Star Split Dual Inverter Viraat Mode, Super Silent, HD Filter With Anti-Virus Protection AC With 4 Way Swing, Monsoon Comfort & ADC Sensor AC - White",Raniganj,"Jun, 2024","TS-Q19JNYE, Copper Condenser",Raniganj
632,Very bad product and technician not good the installation cooling very low very bad not recommended by everyone,1,"LG AI Convertible 6-in-1 Cooling 2024 Model 1.5 Ton 4 Star Split Dual Inverter Viraat Mode, Super Silent, HD Filter With Anti-Virus Protection AC With 4 Way Swing, Monsoon Comfort & ADC Sensor AC - White",Saran District,"Jun, 2024","TS-Q19JNYE, Copper Condenser",Saran District
633,"Outdoor is very noisy
Cooling is okay",1,"LG AI Convertible 6-in-1 Cooling 2024 Model 1.5 Ton 4 Star Split Dual Inverter Viraat Mode, Super Silent, HD Filter With Anti-Virus Protection AC With 4 Way Swing, Monsoon Comfort & ADC Sensor AC - White",Samastipur District,"Jun, 2024","TS-Q19JNYE, Copper Condenser",Samastipur District
634,Please don't buy this product cooling 0% design 100% Quality of LG appliances decrease with time please buy another brand ac and save money Worst quality 😔,1,"LG AI Convertible 6-in-1 Cooling 2024 Model 1.5 Ton 4 Star Split Dual Inverter Viraat Mode, Super Silent, HD Filter With Anti-Virus Protection AC With 4 Way Swing, Monsoon Comfort & ADC Sensor AC - White",Tundla,"Jun, 2024","TS-Q19JNYE, Copper Condenser",Tundla
635,Please never buy. Very less cooling,1,"LG AI Convertible 6-in-1 Cooling 2024 Model 1.5 Ton 4 Star Split Dual Inverter Viraat Mode, Super Silent, HD Filter With Anti-Virus Protection AC With 4 Way Swing, Monsoon Comfort & ADC Sensor AC - White",Rupnagar,"Jun, 2024","TS-Q19JNYE, Copper Condenser",Rupnagar
636,"Please don't buy any electronics from Flipkart, I got this AC and it never worked from day 1. They wouldn't help with replacement and just point you to LG customer service. I'm not buying anymore products from Flipkart.",1,"LG AI Convertible 6-in-1 Cooling 2024 Model 1.5 Ton 4 Star Split Dual Inverter Viraat Mode, Super Silent, HD Filter With Anti-Virus Protection AC With 4 Way Swing, Monsoon Comfort & ADC Sensor AC - White",Coimbatore,"Jun, 2024","TS-Q19JNYE, Copper Condenser",Coimbatore
637,"It is only 1.25 Ton AC.

4400 W is 1.25 Ton",1,"LG AI Convertible 6-in-1 Cooling 2024 Model 1.5 Ton 4 Star Split Dual Inverter Viraat Mode, Super Silent, HD Filter With Anti-Virus Protection AC With 4 Way Swing, Monsoon Comfort & ADC Sensor AC - White",Pen,"Jun, 2024","TS-Q19JNYE, Copper Condenser",Pen
638,20 days installation not cooling bad product not,1,"LG AI Convertible 6-in-1 Cooling 2024 Model 1.5 Ton 4 Star Split Dual Inverter Viraat Mode, Super Silent, HD Filter With Anti-Virus Protection AC With 4 Way Swing, Monsoon Comfort & ADC Sensor AC - White",Kanpur,"Jun, 2024","TS-Q19JNYE, Copper Condenser",Kanpur
639,Terrible product.,1,"LG AI Convertible 6-in-1 Cooling 2024 Model 1.5 Ton 4 Star Split Dual Inverter Viraat Mode, Super Silent, HD Filter With Anti-Virus Protection AC With 4 Way Swing, Monsoon Comfort & ADC Sensor AC - White",New Delhi,"Jun, 2024","TS-Q19JNYE, Copper Condenser",New Delhi
640,Don't buy the AC from Flipkart. AC has been delivered on 2nd of June but No service engineer is coming for installation even after the elapse of 1 month. Customer care executives are non cooperative. It is not worth buying. I will rate it 0 star,1,"LG AI Convertible 6-in-1 Cooling 2024 Model 1.5 Ton 4 Star Split Dual Inverter Viraat Mode, Super Silent, HD Filter With Anti-Virus Protection AC With 4 Way Swing, Monsoon Comfort & ADC Sensor AC - White",Mandi District,"Jun, 2024","TS-Q19JNYE, Copper Condenser",Mandi District
641,Worst service by flipkart. My Ac delivered on 1st june and till now no installation done. Many follow up done by my side but no result. Flipkart team only giving fast comment daily. If someone want same pain which I get then go ahead or take another option.,1,"LG AI Convertible 6-in-1 Cooling 2024 Model 1.5 Ton 4 Star Split Dual Inverter Viraat Mode, Super Silent, HD Filter With Anti-Virus Protection AC With 4 Way Swing, Monsoon Comfort & ADC Sensor AC - White",Jaipur,"Jun, 2024","TS-Q19JNYE, Copper Condenser",Jaipur
642,"I bought this AC and it's not cooling at all. Previously I owned a LG qc which was good in all aspects. DONT BUY THIS AC OTHERWISE YOU WILL LOOSE YOUR MONEY.

0 COOLING EVEN ON VIRAT MODE

WORST AC MODEL",1,"LG AI Convertible 6-in-1 Cooling 2024 Model 1.5 Ton 4 Star Split Dual Inverter Viraat Mode, Super Silent, HD Filter With Anti-Virus Protection AC With 4 Way Swing, Monsoon Comfort & ADC Sensor AC - White",Gurugram,"Jun, 2024","TS-Q19JNYE, Copper Condenser",Gurugram
643,"Don't buy this AC, company labelling it as 1.5 toh AC, but it's not. It's 1.25 ton AC.

Don't
Don't
Don't
Don't buy it..
LG good for other appliances but not good in AC.
It won't work at 48 degree

Also it takes 2 hours to cool room
Don't buy if you want chilled cooling.

This AC is a normal cooler.",1,"LG AI Convertible 6-in-1 Cooling 2024 Model 1.5 Ton 4 Star Split Dual Inverter Viraat Mode, Super Silent, HD Filter With Anti-Virus Protection AC With 4 Way Swing, Monsoon Comfort & ADC Sensor AC - White",Bahadurgarh,"Jun, 2024","TS-Q19JNYE, Copper Condenser",Bahadurgarh
644,This unit not able to maintaine the cooling effect in the room. If the room temprature is 32*c and we have set the temprature at 28*c then it will take 3 to 4 hour to reached the set temprature. My room size is 160sft. Room is air packed also.,1,"LG AI Convertible 6-in-1 Cooling 2024 Model 1.5 Ton 4 Star Split Dual Inverter Viraat Mode, Super Silent, HD Filter With Anti-Virus Protection AC With 4 Way Swing, Monsoon Comfort & ADC Sensor AC - White",Agra,"Jun, 2024","TS-Q19JNYE, Copper Condenser",Agra
645,"I am reviewing after using this AC for ~6 months. It is not like LG's old ACs.
It takes too much time for cooling even 12x10 room. I registered compain to LG and their technician also accepted that this AC takes time to cool.
My neighbour's 1 ton AC cools room faster than this AC.
Other issue is remote is without light in display. so in the night it creates problem.",1,"LG AI Convertible 6-in-1 Cooling 2024 Model 1.5 Ton 4 Star Split Dual Inverter Viraat Mode, Super Silent, HD Filter With Anti-Virus Protection AC With 4 Way Swing, Monsoon Comfort & ADC Sensor AC - White",Ahmedabad,"Jun, 2024","TS-Q19JNYE, Copper Condenser",Ahmedabad
646,Average Performance.... cooling Condition is not Sufficient in HC Position,1,"LG AI Convertible 6-in-1 Cooling 2024 Model 1.5 Ton 4 Star Split Dual Inverter Viraat Mode, Super Silent, HD Filter With Anti-Virus Protection AC With 4 Way Swing, Monsoon Comfort & ADC Sensor AC - White",Vayalar,"Jun, 2024","TS-Q19JNYE, Copper Condenser",Vayalar
647,"AC is good but installation was very poor, charged extra for outdoor unit installation, no cover taping on pipe they did like free fund job. They didn't even carried their foldable steps. Really pathetic. 3rd class installation, installed without outdoor unit side cover.",1,"LG AI Convertible 6-in-1 Cooling 2024 Model 1.5 Ton 4 Star Split Dual Inverter Viraat Mode, Super Silent, HD Filter With Anti-Virus Protection AC With 4 Way Swing, Monsoon Comfort & ADC Sensor AC - White",Araria,"Jun, 2024","TS-Q19JNYE, Copper Condenser",Araria
648,Product is not working properly,1,"LG AI Convertible 6-in-1 Cooling 2024 Model 1.5 Ton 4 Star Split Dual Inverter Viraat Mode, Super Silent, HD Filter With Anti-Virus Protection AC With 4 Way Swing, Monsoon Comfort & ADC Sensor AC - White",Moradabad,"Jun, 2024","TS-Q19JNYE, Copper Condenser",Moradabad
649,Cooling is very low,1,"LG AI Convertible 6-in-1 Cooling 2024 Model 1.5 Ton 4 Star Split Dual Inverter Viraat Mode, Super Silent, HD Filter With Anti-Virus Protection AC With 4 Way Swing, Monsoon Comfort & ADC Sensor AC - White",Amritsar,"Jun, 2024","TS-Q19JNYE, Copper Condenser",Amritsar
650,Don't buy wastage of money it do nor provide cooling in the recommended size room. Pls don't buy it .,1,"LG AI Convertible 6-in-1 Cooling 2024 Model 1.5 Ton 4 Star Split Dual Inverter Viraat Mode, Super Silent, HD Filter With Anti-Virus Protection AC With 4 Way Swing, Monsoon Comfort & ADC Sensor AC - White",Bhogpur,"Jun, 2024","TS-Q19JNYE, Copper Condenser",Bhogpur
651,Very poor and low quality products and waste of money don't buy this product very bad experience also not good customer service,1,"LG AI Convertible 6-in-1 Cooling 2024 Model 1.5 Ton 4 Star Split Dual Inverter Viraat Mode, Super Silent, HD Filter With Anti-Virus Protection AC With 4 Way Swing, Monsoon Comfort & ADC Sensor AC - White",Lunkaransar,"Jun, 2024","TS-Q19JNYE, Copper Condenser",Lunkaransar
652,It is very expensive in this amount,1,"LG AI Convertible 6-in-1 Cooling 2024 Model 1.5 Ton 4 Star Split Dual Inverter Viraat Mode, Super Silent, HD Filter With Anti-Virus Protection AC With 4 Way Swing, Monsoon Comfort & ADC Sensor AC - White",Lormi,"Jun, 2024","TS-Q19JNYE, Copper Condenser",Lormi
653,Avoid buying,1,"LG AI Convertible 6-in-1 Cooling 2024 Model 1.5 Ton 4 Star Split Dual Inverter Viraat Mode, Super Silent, HD Filter With Anti-Virus Protection AC With 4 Way Swing, Monsoon Comfort & ADC Sensor AC - White",Amritsar,"Jun, 2024","TS-Q19JNYE, Copper Condenser",Amritsar
654,Waste product from LG . Customer service is very bad. Cooling is zero I raised complaint even after the cooling is not good . Done buy this product from LG,1,"LG AI Convertible 6-in-1 Cooling 2024 Model 1.5 Ton 4 Star Split Dual Inverter Viraat Mode, Super Silent, HD Filter With Anti-Virus Protection AC With 4 Way Swing, Monsoon Comfort & ADC Sensor AC - White",Hyderabad,"Jun, 2024","TS-Q19JNYE, Copper Condenser",Hyderabad
655,Getting switched off automatically after 30+ minutes and water leaking problem.,1,"LG AI Convertible 6-in-1 Cooling 2024 Model 1.5 Ton 4 Star Split Dual Inverter Viraat Mode, Super Silent, HD Filter With Anti-Virus Protection AC With 4 Way Swing, Monsoon Comfort & ADC Sensor AC - White",Indore,"May, 2024","TS-Q19JNYE, Copper Condenser",Indore
656,Ac is not cooling properly.,1,"LG AI Convertible 6-in-1 Cooling 2024 Model 1.5 Ton 4 Star Split Dual Inverter Viraat Mode, Super Silent, HD Filter With Anti-Virus Protection AC With 4 Way Swing, Monsoon Comfort & ADC Sensor AC - White",Yamunanagar,"May, 2024","TS-Q19JNYE, Copper Condenser",Yamunanagar
657,Water leaking from the indoor unit after use of one month was a very bad experience .. waste of money,1,"LG AI Convertible 6-in-1 Cooling 2024 Model 1.5 Ton 4 Star Split Dual Inverter Viraat Mode, Super Silent, HD Filter With Anti-Virus Protection AC With 4 Way Swing, Monsoon Comfort & ADC Sensor AC - White",Berhampur,"May, 2024","TS-Q19JNYE, Copper Condenser",Berhampur
658,"Worse than a ceiling fan ,no cooling nothing ...dabba",1,"LG AI Convertible 6-in-1 Cooling 2024 Model 1.5 Ton 4 Star Split Dual Inverter Viraat Mode, Super Silent, HD Filter With Anti-Virus Protection AC With 4 Way Swing, Monsoon Comfort & ADC Sensor AC - White",Zirakpur,"May, 2024","TS-Q19JNYE, Copper Condenser",Zirakpur
659,"Very bad quality AC took so much time for cooling and very less cooling
Worst quality ac never buy any product from LG specially AC",1,"LG AI Convertible 6-in-1 Cooling 2024 Model 1.5 Ton 4 Star Split Dual Inverter Viraat Mode, Super Silent, HD Filter With Anti-Virus Protection AC With 4 Way Swing, Monsoon Comfort & ADC Sensor AC - White",Jaipur,"May, 2024","TS-Q19JNYE, Copper Condenser",Jaipur
660,"Cooling is very very low.
Very disappointed

When I set at 19c /20c it takes approximately 4 hour to reach 25 c room temperature from 31c.
And it consumes 12 kwh ( unit) to 13 kwh power consumption. It's very high for 4 hour usages.",1,"LG AI Convertible 6-in-1 Cooling 2024 Model 1.5 Ton 4 Star Split Dual Inverter Viraat Mode, Super Silent, HD Filter With Anti-Virus Protection AC With 4 Way Swing, Monsoon Comfort & ADC Sensor AC - White",Rajkot District,"May, 2024","TS-Q19JNYE, Copper Condenser",Rajkot District
661,The product was not installed as the Jeeves Technician won't install if you don't buy AC stand and stabilizer from them. I dirc LG for installation. Cooling is not that great. You have to buy 1 Ton or above. 0.8 Ton is useless for my 90 sq.ft room.,1,"LG AI Convertible 6-in-1 Cooling 2024 Model 1.5 Ton 4 Star Split Dual Inverter Viraat Mode, Super Silent, HD Filter With Anti-Virus Protection AC With 4 Way Swing, Monsoon Comfort & ADC Sensor AC - White",Chennai,"May, 2024","TS-Q19JNYE, Copper Condenser",Chennai
662,Cooling capacity is very low ..takes too much time for cooling.,1,"LG AI Convertible 6-in-1 Cooling 2024 Model 1.5 Ton 4 Star Split Dual Inverter Viraat Mode, Super Silent, HD Filter With Anti-Virus Protection AC With 4 Way Swing, Monsoon Comfort & ADC Sensor AC - White",Patna,"May, 2024","TS-Q19JNYE, Copper Condenser",Patna
663,The AI feature doesn't work,1,"LG AI Convertible 6-in-1 Cooling 2024 Model 1.5 Ton 4 Star Split Dual Inverter Viraat Mode, Super Silent, HD Filter With Anti-Virus Protection AC With 4 Way Swing, Monsoon Comfort & ADC Sensor AC - White",Gorakhpur,"May, 2024","TS-Q19JNYE, Copper Condenser",Gorakhpur
664,"Waste of money, getting complain frequently, lg customer service not supportive etc...",1,"LG AI Convertible 6-in-1 Cooling 2024 Model 1.5 Ton 4 Star Split Dual Inverter Viraat Mode, Super Silent, HD Filter With Anti-Virus Protection AC With 4 Way Swing, Monsoon Comfort & ADC Sensor AC - White",Gopalganj District,"May, 2024","TS-Q19JNYE, Copper Condenser",Gopalganj District
665,"Third class AC I have purchased ever, makes too much noise while in running condition. 8 won't recommend it to buy to anyone. Utterly disappointed by its performance too.",1,"LG AI Convertible 6-in-1 Cooling 2024 Model 1.5 Ton 4 Star Split Dual Inverter Viraat Mode, Super Silent, HD Filter With Anti-Virus Protection AC With 4 Way Swing, Monsoon Comfort & ADC Sensor AC - White",Bharuch,"May, 2024","TS-Q19JNYE, Copper Condenser",Bharuch
666,"very low cooling,next to zero cooling
poor service by jeeves of flipkart

poor service by flipkart",1,"LG AI Convertible 6-in-1 Cooling 2024 Model 1.5 Ton 4 Star Split Dual Inverter Viraat Mode, Super Silent, HD Filter With Anti-Virus Protection AC With 4 Way Swing, Monsoon Comfort & ADC Sensor AC - White",Hyderabad,"May, 2024","TS-Q19JNYE, Copper Condenser",Hyderabad
667,"Not cooling properly. And the behaviour of the technician is very bad
don't buy",1,"LG AI Convertible 6-in-1 Cooling 2024 Model 1.5 Ton 4 Star Split Dual Inverter Viraat Mode, Super Silent, HD Filter With Anti-Virus Protection AC With 4 Way Swing, Monsoon Comfort & ADC Sensor AC - White",Bansberia,"May, 2024","TS-Q19JNYE, Copper Condenser",Bansberia
668,Wrost experience,1,"LG AI Convertible 6-in-1 Cooling 2024 Model 1.5 Ton 4 Star Split Dual Inverter Viraat Mode, Super Silent, HD Filter With Anti-Virus Protection AC With 4 Way Swing, Monsoon Comfort & ADC Sensor AC - White",Jamshedpur,"May, 2024","TS-Q19JNYE, Copper Condenser",Jamshedpur
669,"After one month i am writing this review, worst even after 30 mins the room is not getting cool and getting more noice",1,"LG AI Convertible 6-in-1 Cooling 2024 Model 1.5 Ton 4 Star Split Dual Inverter Viraat Mode, Super Silent, HD Filter With Anti-Virus Protection AC With 4 Way Swing, Monsoon Comfort & ADC Sensor AC - White",Ranga Reddy,"May, 2024","TS-Q19JNYE, Copper Condenser",Ranga Reddy
670,More power consumption installation not properly,1,"LG AI Convertible 6-in-1 Cooling 2024 Model 1.5 Ton 4 Star Split Dual Inverter Viraat Mode, Super Silent, HD Filter With Anti-Virus Protection AC With 4 Way Swing, Monsoon Comfort & ADC Sensor AC - White",Alwar,"May, 2024","TS-Q19JNYE, Copper Condenser",Alwar
671,Very bad experience in this product..,1,"LG AI Convertible 6-in-1 Cooling 2024 Model 1.5 Ton 4 Star Split Dual Inverter Viraat Mode, Super Silent, HD Filter With Anti-Virus Protection AC With 4 Way Swing, Monsoon Comfort & ADC Sensor AC - White",Udala,"May, 2024","TS-Q19JNYE, Copper Condenser",Udala
672,Not cooling worst ac,1,"LG AI Convertible 6-in-1 Cooling 2024 Model 1.5 Ton 4 Star Split Dual Inverter Viraat Mode, Super Silent, HD Filter With Anti-Virus Protection AC With 4 Way Swing, Monsoon Comfort & ADC Sensor AC - White",Kancheepuram,"May, 2024","TS-Q19JNYE, Copper Condenser",Kancheepuram
673,"It's really bad... Even in HC mode(110%) capacity, it is not able to bring the room tem down even to 27-28 during summers...
Worst product",1,"LG AI Convertible 6-in-1 Cooling 2024 Model 1.5 Ton 4 Star Split Dual Inverter Viraat Mode, Super Silent, HD Filter With Anti-Virus Protection AC With 4 Way Swing, Monsoon Comfort & ADC Sensor AC - White",Muzaffarpur,"May, 2024","TS-Q19JNYE, Copper Condenser",Muzaffarpur
674,Not cooling..worst AC in this universe. I recommend never to buy LG ac.,1,"LG AI Convertible 6-in-1 Cooling 2024 Model 1.5 Ton 4 Star Split Dual Inverter Viraat Mode, Super Silent, HD Filter With Anti-Virus Protection AC With 4 Way Swing, Monsoon Comfort & ADC Sensor AC - White",Patna,"May, 2024","TS-Q19JNYE, Copper Condenser",Patna
675,"Don't buy this product. Giving review after using for 1month. Water leaking from indoor unit, cooling is very less.",1,"LG AI Convertible 6-in-1 Cooling 2024 Model 1.5 Ton 4 Star Split Dual Inverter Viraat Mode, Super Silent, HD Filter With Anti-Virus Protection AC With 4 Way Swing, Monsoon Comfort & ADC Sensor AC - White",Hyderabad,"Apr, 2024","TS-Q19JNYE, Copper Condenser",Hyderabad
676,"I'm writing my review of LG 1.5-ton 3-star AC after using it for one month (In April which is not a peak hot time).

1. The cooling is very poor and inefficient. If you continue running the AC for more than 4 hours in Virat Mode, you won't be able to set the room temperature below 28 C.
2. Indoor unit size is small as compared to 1.5-ton ac of other brands so It doesn't circulate air in a wide area.

I have used Voltas and Hitachi in the past and they are much better than LG. Worst AC so I ...
READ MORE",1,"LG AI Convertible 6-in-1 Cooling 2024 Model 1.5 Ton 4 Star Split Dual Inverter Viraat Mode, Super Silent, HD Filter With Anti-Virus Protection AC With 4 Way Swing, Monsoon Comfort & ADC Sensor AC - White",Jaipur,"Apr, 2024","TS-Q19JNYE, Copper Condenser",Jaipur
677,Worst Experience ever.,1,"LG AI Convertible 6-in-1 Cooling 2024 Model 1.5 Ton 4 Star Split Dual Inverter Viraat Mode, Super Silent, HD Filter With Anti-Virus Protection AC With 4 Way Swing, Monsoon Comfort & ADC Sensor AC - White",Kolkata,"Apr, 2024","TS-Q19JNYE, Copper Condenser",Kolkata
678,No cooling waste of money,1,"LG AI Convertible 6-in-1 Cooling 2024 Model 1.5 Ton 4 Star Split Dual Inverter Viraat Mode, Super Silent, HD Filter With Anti-Virus Protection AC With 4 Way Swing, Monsoon Comfort & ADC Sensor AC - White",Polur,"Apr, 2024","TS-Q19JNYE, Copper Condenser",Polur
679,"Writing my review after using it for 1 month.
1. Lg claims about viraat mode is fake. It doesn't cool the room in viraat mode.
2. In normal mode after 15-20 minutes ac goes in the inverter mode. It again doesn't cool the room.
3. Highly unsatisfied with the product.",1,"LG AI Convertible 6-in-1 Cooling 2024 Model 1.5 Ton 4 Star Split Dual Inverter Viraat Mode, Super Silent, HD Filter With Anti-Virus Protection AC With 4 Way Swing, Monsoon Comfort & ADC Sensor AC - White",Jabalpur,"Apr, 2024","TS-Q19JNYE, Copper Condenser",Jabalpur
680,One of the bad purchases I made in recent times.,1,"LG AI Convertible 6-in-1 Cooling 2024 Model 1.5 Ton 4 Star Split Dual Inverter Viraat Mode, Super Silent, HD Filter With Anti-Virus Protection AC With 4 Way Swing, Monsoon Comfort & ADC Sensor AC - White",Talikkulam,"Apr, 2024","TS-Q19JNYE, Copper Condenser",Talikkulam
681,Kharab quality,1,"LG AI Convertible 6-in-1 Cooling 2024 Model 1.5 Ton 4 Star Split Dual Inverter Viraat Mode, Super Silent, HD Filter With Anti-Virus Protection AC With 4 Way Swing, Monsoon Comfort & ADC Sensor AC - White",Gir Somnath District,"Apr, 2024","TS-Q19JNYE, Copper Condenser",Gir Somnath District
682,Worst product. Waste of money. Refrain buying high value product from Flipkart,1,"LG AI Convertible 6-in-1 Cooling 2024 Model 1.5 Ton 4 Star Split Dual Inverter Viraat Mode, Super Silent, HD Filter With Anti-Virus Protection AC With 4 Way Swing, Monsoon Comfort & ADC Sensor AC - White",Lucknow,"Apr, 2024","TS-Q19JNYE, Copper Condenser",Lucknow
683,Not good,1,"LG AI Convertible 6-in-1 Cooling 2024 Model 1.5 Ton 4 Star Split Dual Inverter Viraat Mode, Super Silent, HD Filter With Anti-Virus Protection AC With 4 Way Swing, Monsoon Comfort & ADC Sensor AC - White",Ghatampur,"Apr, 2024","TS-Q19JNYE, Copper Condenser",Ghatampur
684,Modrate product,1,"LG AI Convertible 6-in-1 Cooling 2024 Model 1.5 Ton 4 Star Split Dual Inverter Viraat Mode, Super Silent, HD Filter With Anti-Virus Protection AC With 4 Way Swing, Monsoon Comfort & ADC Sensor AC - White",Prithvipur,"Apr, 2024","TS-Q19JNYE, Copper Condenser",Prithvipur
685,Very bad product,1,"LG AI Convertible 6-in-1 Cooling 2024 Model 1.5 Ton 4 Star Split Dual Inverter Viraat Mode, Super Silent, HD Filter With Anti-Virus Protection AC With 4 Way Swing, Monsoon Comfort & ADC Sensor AC - White",Secunderabad,"Apr, 2024","TS-Q19JNYE, Copper Condenser",Secunderabad
686,"Don't buy this ac,it is not cooling from day 1.",1,"LG AI Convertible 6-in-1 Cooling 2024 Model 1.5 Ton 4 Star Split Dual Inverter Viraat Mode, Super Silent, HD Filter With Anti-Virus Protection AC With 4 Way Swing, Monsoon Comfort & ADC Sensor AC - White",Allahabad,"Apr, 2024","TS-Q19JNYE, Copper Condenser",Allahabad
687,"Waste money low quality product
11x12 Room Not Cooling 2 Month use",1,"LG AI Convertible 6-in-1 Cooling 2024 Model 1.5 Ton 4 Star Split Dual Inverter Viraat Mode, Super Silent, HD Filter With Anti-Virus Protection AC With 4 Way Swing, Monsoon Comfort & ADC Sensor AC - White",South Twenty Four Parganas District,"Apr, 2024","TS-Q19JNYE, Copper Condenser",South Twenty Four Parganas District
688,Ac doer nunchi water vasthunae complant echanu vachi chusi vellaru kani problem enka clear avva ledhu service baga ledhu,1,"LG AI Convertible 6-in-1 Cooling 2024 Model 1.5 Ton 4 Star Split Dual Inverter Viraat Mode, Super Silent, HD Filter With Anti-Virus Protection AC With 4 Way Swing, Monsoon Comfort & ADC Sensor AC - White",Nellore,"Apr, 2024","TS-Q19JNYE, Copper Condenser",Nellore
689,Very bad experience,1,"LG AI Convertible 6-in-1 Cooling 2024 Model 1.5 Ton 4 Star Split Dual Inverter Viraat Mode, Super Silent, HD Filter With Anti-Virus Protection AC With 4 Way Swing, Monsoon Comfort & ADC Sensor AC - White",Bijpur,"Apr, 2024","TS-Q19JNYE, Copper Condenser",Bijpur
690,"Ac takes too much time to cool , also if I put it on 24 room temp show 26 after running 1hr.",1,"LG AI Convertible 6-in-1 Cooling 2024 Model 1.5 Ton 4 Star Split Dual Inverter Viraat Mode, Super Silent, HD Filter With Anti-Virus Protection AC With 4 Way Swing, Monsoon Comfort & ADC Sensor AC - White",Mahesana,"Apr, 2024","TS-Q19JNYE, Copper Condenser",Mahesana
691,Worst product,1,"LG AI Convertible 6-in-1 Cooling 2024 Model 1.5 Ton 4 Star Split Dual Inverter Viraat Mode, Super Silent, HD Filter With Anti-Virus Protection AC With 4 Way Swing, Monsoon Comfort & ADC Sensor AC - White",Indore,"Apr, 2024","TS-Q19JNYE, Copper Condenser",Indore
692,Outdoor unit noise is unbearable,1,"LG AI Convertible 6-in-1 Cooling 2024 Model 1.5 Ton 4 Star Split Dual Inverter Viraat Mode, Super Silent, HD Filter With Anti-Virus Protection AC With 4 Way Swing, Monsoon Comfort & ADC Sensor AC - White",Suryapet District,"Apr, 2024","TS-Q19JNYE, Copper Condenser",Suryapet District
693,"Flipkart provides the worst customer service which I've observed these days. My AC delivered on time but they didn't have a good brand authorised partner in Hyderabad so that my installation was not done for a week which is bad. I had wasted my time and money by believing their promised date of installation everyday. If you are planning to get this one Flipkart, I would suggest not to do that.",1,"LG AI Convertible 6-in-1 Cooling 2024 Model 1.5 Ton 4 Star Split Dual Inverter Viraat Mode, Super Silent, HD Filter With Anti-Virus Protection AC With 4 Way Swing, Monsoon Comfort & ADC Sensor AC - White",Hyderabad,"Apr, 2024","TS-Q19JNYE, Copper Condenser",Hyderabad
