,text,star,hp_data,city,transformed_date,product_num,state
0,"Waste of money . AC not working till one month of installation. Installed by Jeeves company authorized from LG but both are blaming on one another
I request not to purchase from flipkart
As it lie there as waste of money
Junk",1,"LG AI Convertible 6-in-1 Cooling 2024 Model 1.5 Ton 3 Star Split Dual Inverter HD Filter with Anti-Virus Protection,VIRAAT Mode, Diet Mode & ADC Sensor AC - White",Alwar,"May, 2023","TS-Q18JNXE3, Copper Condenser",Alwar
1,"I purchased this LG A. C. on 17 April 23..The most horrible experience ever... My A. C. Is just not working... Even if I run it on 16 the room is hot.. I don't understand what is it .. I have an IFB ac in my hometown. It's 3 years old.. I have to wear a blanket even if I put it on 27 degree C..
But this LG AC.. I get a feeling that iv been fooled.. I'm a very nice guy.. Normally i never complain of things... But this time the experience has been really disastrous... I have problem when it ge...
READ MORE",1,"LG AI Convertible 6-in-1 Cooling 2024 Model 1.5 Ton 3 Star Split Dual Inverter HD Filter with Anti-Virus Protection,VIRAAT Mode, Diet Mode & ADC Sensor AC - White",Kalyan,"Apr, 2023","TS-Q18JNXE3, Copper Condenser",Kalyan
2,"If you want to buy a white showpiece for your bedroom then go ahead otherwise BIG NO. Worst service experience. Flipkart would not accept return/exchange if you need to. The indoor unit has serious water leakage issues, so this showpiece can be used as bedside shower.",1,"LG AI Convertible 6-in-1 Cooling 2024 Model 1.5 Ton 3 Star Split Dual Inverter HD Filter with Anti-Virus Protection,VIRAAT Mode, Diet Mode & ADC Sensor AC - White",Madhyamgram,"Apr, 2023","TS-Q18JNXE3, Copper Condenser",Madhyamgram
3,Totally waste of money. company is not refund my money as per their policy which was not mentioned during purchase. That is why i am not using this and i have put it in the store room. thanks Flipkart 🙏🙏🙏,1,"LG AI Convertible 6-in-1 Cooling 2024 Model 1.5 Ton 3 Star Split Dual Inverter HD Filter with Anti-Virus Protection,VIRAAT Mode, Diet Mode & ADC Sensor AC - White",Charkhi Dadri,"May, 2022","TS-Q18JNXE3, Copper Condenser",Charkhi Dadri
4,"This model don't have 4 way swing, it's actual ton is 1.3 because it's cooling capacity is 4400w, they are cheating us and selling it as 1.5 ton compare with other ac brands",1,"LG AI Convertible 6-in-1 Cooling 2024 Model 1.5 Ton 3 Star Split Dual Inverter HD Filter with Anti-Virus Protection,VIRAAT Mode, Diet Mode & ADC Sensor AC - White",Erode,"Feb, 2024","TS-Q18JNXE3, Copper Condenser",Erode
5,"Do not buy any product from Flipkart
Not cooling
Ac remote stop working within a month",1,"LG AI Convertible 6-in-1 Cooling 2024 Model 1.5 Ton 3 Star Split Dual Inverter HD Filter with Anti-Virus Protection,VIRAAT Mode, Diet Mode & ADC Sensor AC - White",Kolkata,"Mar, 2022","TS-Q18JNXE3, Copper Condenser",Kolkata
6,"Worst service from flipkart and jeeves ,wrong instllation done of indoor and outdoor unit ,continuous water leakage from Indoor unit ,no service support as continously following up from day of installation ,still no positive response",1,"LG AI Convertible 6-in-1 Cooling 2024 Model 1.5 Ton 3 Star Split Dual Inverter HD Filter with Anti-Virus Protection,VIRAAT Mode, Diet Mode & ADC Sensor AC - White",Boisar,"Mar, 2022","TS-Q18JNXE3, Copper Condenser",Boisar
7,My ac is not getting temperature less than 23,1,"LG AI Convertible 6-in-1 Cooling 2024 Model 1.5 Ton 3 Star Split Dual Inverter HD Filter with Anti-Virus Protection,VIRAAT Mode, Diet Mode & ADC Sensor AC - White",Bela Pratapgarh,"Apr, 2022","TS-Q18JNXE3, Copper Condenser",Bela Pratapgarh
8,Watter leek in outdoor pipe line indoor,1,"LG AI Convertible 6-in-1 Cooling 2024 Model 1.5 Ton 3 Star Split Dual Inverter HD Filter with Anti-Virus Protection,VIRAAT Mode, Diet Mode & ADC Sensor AC - White",Tiruvallur,"Apr, 2022","TS-Q18JNXE3, Copper Condenser",Tiruvallur
9,Third class AC very very slow cooling,1,"LG AI Convertible 6-in-1 Cooling 2024 Model 1.5 Ton 3 Star Split Dual Inverter HD Filter with Anti-Virus Protection,VIRAAT Mode, Diet Mode & ADC Sensor AC - White",Raichur,"May, 2022","TS-Q18JNXE3, Copper Condenser",Raichur
10,Not giving cool instent cooling i m not satisfied with this product ....,1,"LG AI Convertible 6-in-1 Cooling 2024 Model 1.5 Ton 3 Star Split Dual Inverter HD Filter with Anti-Virus Protection,VIRAAT Mode, Diet Mode & ADC Sensor AC - White",Munger,"Apr, 2022","TS-Q18JNXE3, Copper Condenser",Munger
11,Please do not buy from here. AC is not cooling at all.,1,"LG AI Convertible 6-in-1 Cooling 2024 Model 1.5 Ton 3 Star Split Dual Inverter HD Filter with Anti-Virus Protection,VIRAAT Mode, Diet Mode & ADC Sensor AC - White",Mainpuri,"Apr, 2022","TS-Q18JNXE3, Copper Condenser",Mainpuri
12,Not energy efficient. Not as per company spoken.,1,"LG AI Convertible 6-in-1 Cooling 2024 Model 1.5 Ton 3 Star Split Dual Inverter HD Filter with Anti-Virus Protection,VIRAAT Mode, Diet Mode & ADC Sensor AC - White",Gwalior,"May, 2023","TS-Q18JNXE3, Copper Condenser",Gwalior
13,"Installation not good, water lekeage issue after 10 days",1,"LG AI Convertible 6-in-1 Cooling 2024 Model 1.5 Ton 3 Star Split Dual Inverter HD Filter with Anti-Virus Protection,VIRAAT Mode, Diet Mode & ADC Sensor AC - White",Mathura District,"Apr, 2022","TS-Q18JNXE3, Copper Condenser",Mathura District
14,It worked a week and cooling rate dropped drastically. May be I received the defective one.,1,"LG AI Convertible 6-in-1 Cooling 2024 Model 1.5 Ton 3 Star Split Dual Inverter HD Filter with Anti-Virus Protection,VIRAAT Mode, Diet Mode & ADC Sensor AC - White",Hyderabad,"Apr, 2022","TS-Q18JNXE3, Copper Condenser",Hyderabad
15,Very bad product,1,"LG AI Convertible 6-in-1 Cooling 2024 Model 1.5 Ton 3 Star Split Dual Inverter HD Filter with Anti-Virus Protection,VIRAAT Mode, Diet Mode & ADC Sensor AC - White",Bharthana,"Aug, 2024","TS-Q18JNXE3, Copper Condenser",Bharthana
16,Not energy seving,1,"LG AI Convertible 6-in-1 Cooling 2024 Model 1.5 Ton 3 Star Split Dual Inverter HD Filter with Anti-Virus Protection,VIRAAT Mode, Diet Mode & ADC Sensor AC - White",Junagadh,"Aug, 2024","TS-Q18JNXE3, Copper Condenser",Junagadh
17,Plz don't buy ....it's not working,1,"LG AI Convertible 6-in-1 Cooling 2024 Model 1.5 Ton 3 Star Split Dual Inverter HD Filter with Anti-Virus Protection,VIRAAT Mode, Diet Mode & ADC Sensor AC - White",Gorakhpur,"Aug, 2024","TS-Q18JNXE3, Copper Condenser",Gorakhpur
18,No cooling heavy electricity bill. Better to buy bluestar 1 tonn ac,1,"LG AI Convertible 6-in-1 Cooling 2024 Model 1.5 Ton 3 Star Split Dual Inverter HD Filter with Anti-Virus Protection,VIRAAT Mode, Diet Mode & ADC Sensor AC - White",Hisar District,"Jul, 2024","TS-Q18JNXE3, Copper Condenser",Hisar District
19,Product is very nice but service is not that good as my AC has cooling issue and not resolved by company or installation team..also known that the LG company and installation tema was different so ensure while installing,1,"LG AI Convertible 6-in-1 Cooling 2024 Model 1.5 Ton 3 Star Split Dual Inverter HD Filter with Anti-Virus Protection,VIRAAT Mode, Diet Mode & ADC Sensor AC - White",Panch Mahals District,"Jul, 2024","TS-Q18JNXE3, Copper Condenser",Panch Mahals District
20,Very worst product,1,"LG AI Convertible 6-in-1 Cooling 2024 Model 1.5 Ton 3 Star Split Dual Inverter HD Filter with Anti-Virus Protection,VIRAAT Mode, Diet Mode & ADC Sensor AC - White",Madurai,"Jul, 2024","TS-Q18JNXE3, Copper Condenser",Madurai
21,"Not a good product and installation by service partner is worst, installation tacnician is unexperienced . Thay made my new ac into old ac. Ac is not cooling room",1,"LG AI Convertible 6-in-1 Cooling 2024 Model 1.5 Ton 3 Star Split Dual Inverter HD Filter with Anti-Virus Protection,VIRAAT Mode, Diet Mode & ADC Sensor AC - White",Firozpur,"Jul, 2024","TS-Q18JNXE3, Copper Condenser",Firozpur
22,Worst experience,1,"LG AI Convertible 6-in-1 Cooling 2024 Model 1.5 Ton 3 Star Split Dual Inverter HD Filter with Anti-Virus Protection,VIRAAT Mode, Diet Mode & ADC Sensor AC - White",Pimpri Chinchwad,"Jul, 2024","TS-Q18JNXE3, Copper Condenser",Pimpri Chinchwad
23,Cooling is very bad,1,"LG AI Convertible 6-in-1 Cooling 2024 Model 1.5 Ton 3 Star Split Dual Inverter HD Filter with Anti-Virus Protection,VIRAAT Mode, Diet Mode & ADC Sensor AC - White",Guwahati,"Jul, 2024","TS-Q18JNXE3, Copper Condenser",Guwahati
24,Very bad Cooling problem,1,"LG AI Convertible 6-in-1 Cooling 2024 Model 1.5 Ton 3 Star Split Dual Inverter HD Filter with Anti-Virus Protection,VIRAAT Mode, Diet Mode & ADC Sensor AC - White",Sendhwa,"Jul, 2024","TS-Q18JNXE3, Copper Condenser",Sendhwa
25,Not good products,1,"LG AI Convertible 6-in-1 Cooling 2024 Model 1.5 Ton 3 Star Split Dual Inverter HD Filter with Anti-Virus Protection,VIRAAT Mode, Diet Mode & ADC Sensor AC - White",Rohtas District,"Jul, 2024","TS-Q18JNXE3, Copper Condenser",Rohtas District
26,Please don't get this ..... LG is completely fraud and Flipkart never sends people to install this product.. we have ordered this on May 1 and we have not yet recieved a person to install the same..,1,"LG AI Convertible 6-in-1 Cooling 2024 Model 1.5 Ton 3 Star Split Dual Inverter HD Filter with Anti-Virus Protection,VIRAAT Mode, Diet Mode & ADC Sensor AC - White",Kelambakkam,"Jun, 2024","TS-Q18JNXE3, Copper Condenser",Kelambakkam
27,It's cooling power is soo poor,1,"LG AI Convertible 6-in-1 Cooling 2024 Model 1.5 Ton 3 Star Split Dual Inverter HD Filter with Anti-Virus Protection,VIRAAT Mode, Diet Mode & ADC Sensor AC - White",Khongapani,"Jun, 2024","TS-Q18JNXE3, Copper Condenser",Khongapani
28,"Worst product, Cooling issue from 2nd week, The 3rd party installation provided by flipkart is worst ,they don't even know to properly install it , no response while calling and lg team also not taking.
Totally hate the purchase.",1,"LG AI Convertible 6-in-1 Cooling 2024 Model 1.5 Ton 3 Star Split Dual Inverter HD Filter with Anti-Virus Protection,VIRAAT Mode, Diet Mode & ADC Sensor AC - White",Thoraipakkam,"Jun, 2024","TS-Q18JNXE3, Copper Condenser",Thoraipakkam
29,"Worst ac I ever seen. After 10 days, colling process became pathetic. I have raised complaints but no solution so far. Don't buy these kind of products from Flipkart.",1,"LG AI Convertible 6-in-1 Cooling 2024 Model 1.5 Ton 3 Star Split Dual Inverter HD Filter with Anti-Virus Protection,VIRAAT Mode, Diet Mode & ADC Sensor AC - White",Giridih,"Jun, 2024","TS-Q18JNXE3, Copper Condenser",Giridih
30,Indoor machine -no nitrogen gas,1,"LG AI Convertible 6-in-1 Cooling 2024 Model 1.5 Ton 3 Star Split Dual Inverter HD Filter with Anti-Virus Protection,VIRAAT Mode, Diet Mode & ADC Sensor AC - White",Chennai,"Jun, 2024","TS-Q18JNXE3, Copper Condenser",Chennai
31,After Installation water leakage problem. Same problem still exists. Cooling takes more time than other Acs. Fan speed is very very very low even in 5th speed.,1,"LG AI Convertible 6-in-1 Cooling 2024 Model 1.5 Ton 3 Star Split Dual Inverter HD Filter with Anti-Virus Protection,VIRAAT Mode, Diet Mode & ADC Sensor AC - White",Raniganj,"Jun, 2024","TS-Q18JNXE3, Copper Condenser",Raniganj
32,Very bad product and technician not good the installation cooling very low very bad not recommended by everyone,1,"LG AI Convertible 6-in-1 Cooling 2024 Model 1.5 Ton 3 Star Split Dual Inverter HD Filter with Anti-Virus Protection,VIRAAT Mode, Diet Mode & ADC Sensor AC - White",Saran District,"Jun, 2024","TS-Q18JNXE3, Copper Condenser",Saran District
33,"Outdoor is very noisy
Cooling is okay",1,"LG AI Convertible 6-in-1 Cooling 2024 Model 1.5 Ton 3 Star Split Dual Inverter HD Filter with Anti-Virus Protection,VIRAAT Mode, Diet Mode & ADC Sensor AC - White",Samastipur District,"Jun, 2024","TS-Q18JNXE3, Copper Condenser",Samastipur District
34,Please don't buy this product cooling 0% design 100% Quality of LG appliances decrease with time please buy another brand ac and save money Worst quality 😔,1,"LG AI Convertible 6-in-1 Cooling 2024 Model 1.5 Ton 3 Star Split Dual Inverter HD Filter with Anti-Virus Protection,VIRAAT Mode, Diet Mode & ADC Sensor AC - White",Tundla,"Jun, 2024","TS-Q18JNXE3, Copper Condenser",Tundla
35,Please never buy. Very less cooling,1,"LG AI Convertible 6-in-1 Cooling 2024 Model 1.5 Ton 3 Star Split Dual Inverter HD Filter with Anti-Virus Protection,VIRAAT Mode, Diet Mode & ADC Sensor AC - White",Rupnagar,"Jun, 2024","TS-Q18JNXE3, Copper Condenser",Rupnagar
36,"Please don't buy any electronics from Flipkart, I got this AC and it never worked from day 1. They wouldn't help with replacement and just point you to LG customer service. I'm not buying anymore products from Flipkart.",1,"LG AI Convertible 6-in-1 Cooling 2024 Model 1.5 Ton 3 Star Split Dual Inverter HD Filter with Anti-Virus Protection,VIRAAT Mode, Diet Mode & ADC Sensor AC - White",Coimbatore,"Jun, 2024","TS-Q18JNXE3, Copper Condenser",Coimbatore
37,"It is only 1.25 Ton AC.

4400 W is 1.25 Ton",1,"LG AI Convertible 6-in-1 Cooling 2024 Model 1.5 Ton 3 Star Split Dual Inverter HD Filter with Anti-Virus Protection,VIRAAT Mode, Diet Mode & ADC Sensor AC - White",Pen,"Jun, 2024","TS-Q18JNXE3, Copper Condenser",Pen
38,20 days installation not cooling bad product not,1,"LG AI Convertible 6-in-1 Cooling 2024 Model 1.5 Ton 3 Star Split Dual Inverter HD Filter with Anti-Virus Protection,VIRAAT Mode, Diet Mode & ADC Sensor AC - White",Kanpur,"Jun, 2024","TS-Q18JNXE3, Copper Condenser",Kanpur
39,Terrible product.,1,"LG AI Convertible 6-in-1 Cooling 2024 Model 1.5 Ton 3 Star Split Dual Inverter HD Filter with Anti-Virus Protection,VIRAAT Mode, Diet Mode & ADC Sensor AC - White",New Delhi,"Jun, 2024","TS-Q18JNXE3, Copper Condenser",New Delhi
40,Don't buy the AC from Flipkart. AC has been delivered on 2nd of June but No service engineer is coming for installation even after the elapse of 1 month. Customer care executives are non cooperative. It is not worth buying. I will rate it 0 star,1,"LG AI Convertible 6-in-1 Cooling 2024 Model 1.5 Ton 3 Star Split Dual Inverter HD Filter with Anti-Virus Protection,VIRAAT Mode, Diet Mode & ADC Sensor AC - White",Mandi District,"Jun, 2024","TS-Q18JNXE3, Copper Condenser",Mandi District
41,Worst service by flipkart. My Ac delivered on 1st june and till now no installation done. Many follow up done by my side but no result. Flipkart team only giving fast comment daily. If someone want same pain which I get then go ahead or take another option.,1,"LG AI Convertible 6-in-1 Cooling 2024 Model 1.5 Ton 3 Star Split Dual Inverter HD Filter with Anti-Virus Protection,VIRAAT Mode, Diet Mode & ADC Sensor AC - White",Jaipur,"Jun, 2024","TS-Q18JNXE3, Copper Condenser",Jaipur
42,"I bought this AC and it's not cooling at all. Previously I owned a LG qc which was good in all aspects. DONT BUY THIS AC OTHERWISE YOU WILL LOOSE YOUR MONEY.

0 COOLING EVEN ON VIRAT MODE

WORST AC MODEL",1,"LG AI Convertible 6-in-1 Cooling 2024 Model 1.5 Ton 3 Star Split Dual Inverter HD Filter with Anti-Virus Protection,VIRAAT Mode, Diet Mode & ADC Sensor AC - White",Gurugram,"Jun, 2024","TS-Q18JNXE3, Copper Condenser",Gurugram
43,"Don't buy this AC, company labelling it as 1.5 toh AC, but it's not. It's 1.25 ton AC.

Don't
Don't
Don't
Don't buy it..
LG good for other appliances but not good in AC.
It won't work at 48 degree

Also it takes 2 hours to cool room
Don't buy if you want chilled cooling.

This AC is a normal cooler.",1,"LG AI Convertible 6-in-1 Cooling 2024 Model 1.5 Ton 3 Star Split Dual Inverter HD Filter with Anti-Virus Protection,VIRAAT Mode, Diet Mode & ADC Sensor AC - White",Bahadurgarh,"Jun, 2024","TS-Q18JNXE3, Copper Condenser",Bahadurgarh
44,This unit not able to maintaine the cooling effect in the room. If the room temprature is 32*c and we have set the temprature at 28*c then it will take 3 to 4 hour to reached the set temprature. My room size is 160sft. Room is air packed also.,1,"LG AI Convertible 6-in-1 Cooling 2024 Model 1.5 Ton 3 Star Split Dual Inverter HD Filter with Anti-Virus Protection,VIRAAT Mode, Diet Mode & ADC Sensor AC - White",Agra,"Jun, 2024","TS-Q18JNXE3, Copper Condenser",Agra
45,"I am reviewing after using this AC for ~6 months. It is not like LG's old ACs.
It takes too much time for cooling even 12x10 room. I registered compain to LG and their technician also accepted that this AC takes time to cool.
My neighbour's 1 ton AC cools room faster than this AC.
Other issue is remote is without light in display. so in the night it creates problem.",1,"LG AI Convertible 6-in-1 Cooling 2024 Model 1.5 Ton 3 Star Split Dual Inverter HD Filter with Anti-Virus Protection,VIRAAT Mode, Diet Mode & ADC Sensor AC - White",Ahmedabad,"Jun, 2024","TS-Q18JNXE3, Copper Condenser",Ahmedabad
46,Average Performance.... cooling Condition is not Sufficient in HC Position,1,"LG AI Convertible 6-in-1 Cooling 2024 Model 1.5 Ton 3 Star Split Dual Inverter HD Filter with Anti-Virus Protection,VIRAAT Mode, Diet Mode & ADC Sensor AC - White",Vayalar,"Jun, 2024","TS-Q18JNXE3, Copper Condenser",Vayalar
47,"AC is good but installation was very poor, charged extra for outdoor unit installation, no cover taping on pipe they did like free fund job. They didn't even carried their foldable steps. Really pathetic. 3rd class installation, installed without outdoor unit side cover.",1,"LG AI Convertible 6-in-1 Cooling 2024 Model 1.5 Ton 3 Star Split Dual Inverter HD Filter with Anti-Virus Protection,VIRAAT Mode, Diet Mode & ADC Sensor AC - White",Araria,"Jun, 2024","TS-Q18JNXE3, Copper Condenser",Araria
48,Product is not working properly,1,"LG AI Convertible 6-in-1 Cooling 2024 Model 1.5 Ton 3 Star Split Dual Inverter HD Filter with Anti-Virus Protection,VIRAAT Mode, Diet Mode & ADC Sensor AC - White",Moradabad,"Jun, 2024","TS-Q18JNXE3, Copper Condenser",Moradabad
49,Cooling is very low,1,"LG AI Convertible 6-in-1 Cooling 2024 Model 1.5 Ton 3 Star Split Dual Inverter HD Filter with Anti-Virus Protection,VIRAAT Mode, Diet Mode & ADC Sensor AC - White",Amritsar,"Jun, 2024","TS-Q18JNXE3, Copper Condenser",Amritsar
50,Don't buy wastage of money it do nor provide cooling in the recommended size room. Pls don't buy it .,1,"LG AI Convertible 6-in-1 Cooling 2024 Model 1.5 Ton 3 Star Split Dual Inverter HD Filter with Anti-Virus Protection,VIRAAT Mode, Diet Mode & ADC Sensor AC - White",Bhogpur,"Jun, 2024","TS-Q18JNXE3, Copper Condenser",Bhogpur
51,Very poor and low quality products and waste of money don't buy this product very bad experience also not good customer service,1,"LG AI Convertible 6-in-1 Cooling 2024 Model 1.5 Ton 3 Star Split Dual Inverter HD Filter with Anti-Virus Protection,VIRAAT Mode, Diet Mode & ADC Sensor AC - White",Lunkaransar,"Jun, 2024","TS-Q18JNXE3, Copper Condenser",Lunkaransar
52,It is very expensive in this amount,1,"LG AI Convertible 6-in-1 Cooling 2024 Model 1.5 Ton 3 Star Split Dual Inverter HD Filter with Anti-Virus Protection,VIRAAT Mode, Diet Mode & ADC Sensor AC - White",Lormi,"Jun, 2024","TS-Q18JNXE3, Copper Condenser",Lormi
53,Avoid buying,1,"LG AI Convertible 6-in-1 Cooling 2024 Model 1.5 Ton 3 Star Split Dual Inverter HD Filter with Anti-Virus Protection,VIRAAT Mode, Diet Mode & ADC Sensor AC - White",Amritsar,"Jun, 2024","TS-Q18JNXE3, Copper Condenser",Amritsar
54,Waste product from LG . Customer service is very bad. Cooling is zero I raised complaint even after the cooling is not good . Done buy this product from LG,1,"LG AI Convertible 6-in-1 Cooling 2024 Model 1.5 Ton 3 Star Split Dual Inverter HD Filter with Anti-Virus Protection,VIRAAT Mode, Diet Mode & ADC Sensor AC - White",Hyderabad,"Jun, 2024","TS-Q18JNXE3, Copper Condenser",Hyderabad
55,Getting switched off automatically after 30+ minutes and water leaking problem.,1,"LG AI Convertible 6-in-1 Cooling 2024 Model 1.5 Ton 3 Star Split Dual Inverter HD Filter with Anti-Virus Protection,VIRAAT Mode, Diet Mode & ADC Sensor AC - White",Indore,"May, 2024","TS-Q18JNXE3, Copper Condenser",Indore
56,Ac is not cooling properly.,1,"LG AI Convertible 6-in-1 Cooling 2024 Model 1.5 Ton 3 Star Split Dual Inverter HD Filter with Anti-Virus Protection,VIRAAT Mode, Diet Mode & ADC Sensor AC - White",Yamunanagar,"May, 2024","TS-Q18JNXE3, Copper Condenser",Yamunanagar
57,Water leaking from the indoor unit after use of one month was a very bad experience .. waste of money,1,"LG AI Convertible 6-in-1 Cooling 2024 Model 1.5 Ton 3 Star Split Dual Inverter HD Filter with Anti-Virus Protection,VIRAAT Mode, Diet Mode & ADC Sensor AC - White",Berhampur,"May, 2024","TS-Q18JNXE3, Copper Condenser",Berhampur
58,"Worse than a ceiling fan ,no cooling nothing ...dabba",1,"LG AI Convertible 6-in-1 Cooling 2024 Model 1.5 Ton 3 Star Split Dual Inverter HD Filter with Anti-Virus Protection,VIRAAT Mode, Diet Mode & ADC Sensor AC - White",Zirakpur,"May, 2024","TS-Q18JNXE3, Copper Condenser",Zirakpur
59,"Very bad quality AC took so much time for cooling and very less cooling
Worst quality ac never buy any product from LG specially AC",1,"LG AI Convertible 6-in-1 Cooling 2024 Model 1.5 Ton 3 Star Split Dual Inverter HD Filter with Anti-Virus Protection,VIRAAT Mode, Diet Mode & ADC Sensor AC - White",Jaipur,"May, 2024","TS-Q18JNXE3, Copper Condenser",Jaipur
60,"Cooling is very very low.
Very disappointed

When I set at 19c /20c it takes approximately 4 hour to reach 25 c room temperature from 31c.
And it consumes 12 kwh ( unit) to 13 kwh power consumption. It's very high for 4 hour usages.",1,"LG AI Convertible 6-in-1 Cooling 2024 Model 1.5 Ton 3 Star Split Dual Inverter HD Filter with Anti-Virus Protection,VIRAAT Mode, Diet Mode & ADC Sensor AC - White",Rajkot District,"May, 2024","TS-Q18JNXE3, Copper Condenser",Rajkot District
61,The product was not installed as the Jeeves Technician won't install if you don't buy AC stand and stabilizer from them. I dirc LG for installation. Cooling is not that great. You have to buy 1 Ton or above. 0.8 Ton is useless for my 90 sq.ft room.,1,"LG AI Convertible 6-in-1 Cooling 2024 Model 1.5 Ton 3 Star Split Dual Inverter HD Filter with Anti-Virus Protection,VIRAAT Mode, Diet Mode & ADC Sensor AC - White",Chennai,"May, 2024","TS-Q18JNXE3, Copper Condenser",Chennai
62,Cooling capacity is very low ..takes too much time for cooling.,1,"LG AI Convertible 6-in-1 Cooling 2024 Model 1.5 Ton 3 Star Split Dual Inverter HD Filter with Anti-Virus Protection,VIRAAT Mode, Diet Mode & ADC Sensor AC - White",Patna,"May, 2024","TS-Q18JNXE3, Copper Condenser",Patna
63,The AI feature doesn't work,1,"LG AI Convertible 6-in-1 Cooling 2024 Model 1.5 Ton 3 Star Split Dual Inverter HD Filter with Anti-Virus Protection,VIRAAT Mode, Diet Mode & ADC Sensor AC - White",Gorakhpur,"May, 2024","TS-Q18JNXE3, Copper Condenser",Gorakhpur
64,"Waste of money, getting complain frequently, lg customer service not supportive etc...",1,"LG AI Convertible 6-in-1 Cooling 2024 Model 1.5 Ton 3 Star Split Dual Inverter HD Filter with Anti-Virus Protection,VIRAAT Mode, Diet Mode & ADC Sensor AC - White",Gopalganj District,"May, 2024","TS-Q18JNXE3, Copper Condenser",Gopalganj District
65,"Third class AC I have purchased ever, makes too much noise while in running condition. 8 won't recommend it to buy to anyone. Utterly disappointed by its performance too.",1,"LG AI Convertible 6-in-1 Cooling 2024 Model 1.5 Ton 3 Star Split Dual Inverter HD Filter with Anti-Virus Protection,VIRAAT Mode, Diet Mode & ADC Sensor AC - White",Bharuch,"May, 2024","TS-Q18JNXE3, Copper Condenser",Bharuch
66,"very low cooling,next to zero cooling
poor service by jeeves of flipkart

poor service by flipkart",1,"LG AI Convertible 6-in-1 Cooling 2024 Model 1.5 Ton 3 Star Split Dual Inverter HD Filter with Anti-Virus Protection,VIRAAT Mode, Diet Mode & ADC Sensor AC - White",Hyderabad,"May, 2024","TS-Q18JNXE3, Copper Condenser",Hyderabad
67,"Not cooling properly. And the behaviour of the technician is very bad
don't buy",1,"LG AI Convertible 6-in-1 Cooling 2024 Model 1.5 Ton 3 Star Split Dual Inverter HD Filter with Anti-Virus Protection,VIRAAT Mode, Diet Mode & ADC Sensor AC - White",Bansberia,"May, 2024","TS-Q18JNXE3, Copper Condenser",Bansberia
68,Wrost experience,1,"LG AI Convertible 6-in-1 Cooling 2024 Model 1.5 Ton 3 Star Split Dual Inverter HD Filter with Anti-Virus Protection,VIRAAT Mode, Diet Mode & ADC Sensor AC - White",Jamshedpur,"May, 2024","TS-Q18JNXE3, Copper Condenser",Jamshedpur
69,"After one month i am writing this review, worst even after 30 mins the room is not getting cool and getting more noice",1,"LG AI Convertible 6-in-1 Cooling 2024 Model 1.5 Ton 3 Star Split Dual Inverter HD Filter with Anti-Virus Protection,VIRAAT Mode, Diet Mode & ADC Sensor AC - White",Ranga Reddy,"May, 2024","TS-Q18JNXE3, Copper Condenser",Ranga Reddy
70,More power consumption installation not properly,1,"LG AI Convertible 6-in-1 Cooling 2024 Model 1.5 Ton 3 Star Split Dual Inverter HD Filter with Anti-Virus Protection,VIRAAT Mode, Diet Mode & ADC Sensor AC - White",Alwar,"May, 2024","TS-Q18JNXE3, Copper Condenser",Alwar
71,Very bad experience in this product..,1,"LG AI Convertible 6-in-1 Cooling 2024 Model 1.5 Ton 3 Star Split Dual Inverter HD Filter with Anti-Virus Protection,VIRAAT Mode, Diet Mode & ADC Sensor AC - White",Udala,"May, 2024","TS-Q18JNXE3, Copper Condenser",Udala
72,Not cooling worst ac,1,"LG AI Convertible 6-in-1 Cooling 2024 Model 1.5 Ton 3 Star Split Dual Inverter HD Filter with Anti-Virus Protection,VIRAAT Mode, Diet Mode & ADC Sensor AC - White",Kancheepuram,"May, 2024","TS-Q18JNXE3, Copper Condenser",Kancheepuram
73,"It's really bad... Even in HC mode(110%) capacity, it is not able to bring the room tem down even to 27-28 during summers...
Worst product",1,"LG AI Convertible 6-in-1 Cooling 2024 Model 1.5 Ton 3 Star Split Dual Inverter HD Filter with Anti-Virus Protection,VIRAAT Mode, Diet Mode & ADC Sensor AC - White",Muzaffarpur,"May, 2024","TS-Q18JNXE3, Copper Condenser",Muzaffarpur
